title,source,date,summary,url,query,category,fetched_at
Aluminum Eases from 3-Year High,Trading Economics,2025-11-11,"Aluminum futures in the UK fell to $2,850 per tonne from a three-year high of $2,915 on November 1st, reflecting a broad pullback in base metals due to soft manufacturing PMIs in the US and China. Despite the dip, lingering supply concerns have kept prices 12% higher year-to-date.",https://tradingeconomics.com/commodity/aluminum,aluminum prices and market trends,aluminum,2025-11-14T05:13:13.961890
"Aluminium price dips slightly to USD 2,878.55/t amid mixed market signals",Balaji Aluminium,2025-11-12,"Aluminum futures were quoted at around USD 2,878.55 per ton on November 12, 2025, marking a slight daily drop of 0.15%. The market remains volatile with mixed signals, but prices are still near recent highs.",https://www.balajialuminium.com/aluminium-price-dips-slightly-to-usd-2878-55-t-amid-mixed-market-signals-12-november-2025/,aluminum prices and market trends,aluminum,2025-11-14T05:13:13.961904
Forget Rare Earths: Aluminum Is the Metal of the Moment,Streetwise Reports,2025-11-11,"Aluminum is trading near a three-year high, close to US$2,900 per metric ton, driven by supply constraints in China and recovering global demand. Investment positioning has turned strongly bullish, with analysts forecasting potential supply deficits in 2026.",https://www.streetwisereports.com/article/2025/11/11/forget-rare-earths-aluminum-is-the-metal-of-the-moment.html,aluminum prices and market trends,aluminum,2025-11-14T05:13:13.961909
Aluminum Prices Surge Amid U.S. Government Reopening Hopes,GuruFocus,2025-11-11,"Aluminum prices on the London Metal Exchange surged 1.7% to $2,895 per ton, fueled by optimism over a potential U.S. government reopening. This positive sentiment has contributed to recent price strength in the aluminum market.",https://www.gurufocus.com/news/3198766/aluminum-prices-surge-amid-us-government-reopening-hopes,aluminum prices and market trends,aluminum,2025-11-14T05:13:13.961913
Commodity Update – November 2025,Border States,November 2025,"Aluminum prices opened at $2.18 and have gained 14% this year, trading near a three-year high due to China's smelter capacity struggles amid rising demand. China, producing about 60% of the world's aluminum, is reaching output capacity, pushing expansion abroad and raising concerns about tighter supply or greater reliance on foreign production. The Aluminum Association urges unified USMCA enforcement to prevent tariff circumvention and ensure fair trade.",https://solutions.borderstates.com/newsletter/commodity-update-november-2025/,aluminum production and capacity,aluminum,2025-11-14T05:13:30.420931
Alcoa says high US aluminum prices offset Trump tariff costs,Mining.com,"November 13, 2025","Alcoa reported that US tariffs on Canadian aluminum increased costs by $69 million compared to the previous quarter, but higher domestic aluminum prices have more than offset these tariff costs. The company expects tariff-related costs to rise further by $50 million in the current quarter, reflecting declining inventory and imports, while shipments from Canada to the US are returning to normal.",https://www.mining.com/web/alcoa-sees-tariff-costs-on-aluminum-shipments-continuing-to-rise/,aluminum production and capacity,aluminum,2025-11-14T05:13:30.420943
Forget Rare Earths Aluminum Is the Metal of the Moment,Streetwise Reports,"November 11, 2025","Aluminum prices have surged to their highest since May 2022 due to supply constraints in China and renewed optimism for global demand after a tentative US-China trade truce. China has imposed production limits tightening supply, while demand rebounds in construction, automotive, and consumer goods sectors. The market expects higher shipment volumes and notes aluminum demand could grow 40% by 2030 driven by infrastructure and energy efficiency trends.",https://www.streetwisereports.com/article/2025/11/11/forget-rare-earths-aluminum-is-the-metal-of-the-moment.html,aluminum production and capacity,aluminum,2025-11-14T05:13:30.420948
Premiums for aluminum in U.S. reach record highs,Global News,"November 10, 2025",Aluminum premiums in the U.S. have reached record highs amid strong demand and supply challenges. This reflects broader market dynamics including trade policies and economic factors impacting aluminum pricing and availability in North America.,https://globalnews.ca/video/11519806/premiums-for-aluminum-in-u-s-reach-record-highs,aluminum production and capacity,aluminum,2025-11-14T05:13:30.420951
Linktour's 'Can-to-Car' Aluminum Tech Sets New Standard,OpenPR,"November 13, 2025","Linktour has developed a proprietary WQAL Registered technology that uses post-consumer aluminum to minimize waste and energy consumption, significantly reducing the carbon footprint in vehicle manufacturing. Their all-aluminum monocoque body reduces vehicle weight by 45% compared to steel, enhancing performance and energy efficiency while promoting sustainability in EV production.",https://www.openpr.com/news/4269924/linktour-s-can-to-car-aluminum-tech-sets-new-standard,aluminum technology innovation sustainability,aluminum,2025-11-14T05:13:45.260730
Inert Anode Aluminium Technology: Revolutionary Breakthrough,Discovery Alert,"November 14, 2025","Rio Tinto has successfully implemented a 450 kiloampere inert anode cell at its Alma smelter in Quebec, eliminating direct CO₂ emissions from aluminium production. This technology is a key part of Rio Tinto's decarbonisation strategy and is being scaled with a demonstration plant under construction at the Arvida smelter, promising a transformative impact on sustainable aluminium production.",https://discoveryalert.com.au/aluminium-production-inert-anode-technology-2025/,aluminum technology innovation sustainability,aluminum,2025-11-14T05:13:45.260748
ELYSIS Hits Milestone: First Inert Anode Aluminum Cell,Mirage News,"November 14, 2025","ELYSIS has started up a 450 kiloampere inert anode cell at Rio Tinto's Alma smelter, marking the first commercial-scale use of this technology that produces aluminium without direct carbon emissions. This breakthrough supports large-scale low-carbon aluminium production and is central to Rio Tinto's long-term decarbonization plans, with a demonstration plant underway at Arvida.",https://www.miragenews.com/elysis-hits-milestone-first-inert-anode-1569913/,aluminum technology innovation sustainability,aluminum,2025-11-14T05:13:45.260752
"Ball, Unilever show green aluminium can work",Mines and Money,"November 14, 2025","Ball and Unilever are using aluminium produced with Alcoa's ELYSIS carbon-free smelting technology, which employs inert anode technology to eliminate greenhouse gas emissions. This collaboration combines low-carbon primary aluminium with high recycled content, representing a significant advancement in sustainable aluminium packaging and supply chain innovation.",https://minesandmoney.com/news/industry/ball-unilever-show-green-aluminium-can-work,aluminum technology innovation sustainability,aluminum,2025-11-14T05:13:45.260757
Manufacturer unveils innovative product that could transform future brake calipers,The Cool Down,"November 14, 2025","Brembo has launched brake calipers made from 100% recycled aluminum, reducing lifecycle carbon emissions by 70%. After five years of R&D, this innovation demonstrates that high-performance automotive components can be produced sustainably without compromising quality, marking a significant step in the industry's sustainability efforts.",https://www.thecooldown.com/green-tech/brembo-brake-calipers-recycled-aluminum/,aluminum technology innovation sustainability,aluminum,2025-11-14T05:13:45.260761
Revolutionizing Industries: The Rising Impact of Lightweight Metal Tubing,TechBullion,"November 14, 2025","Lightweight aluminum-based metal tubing is driving industrial transformation by offering high strength-to-weight ratios that improve efficiency and sustainability in automotive, aerospace, and construction sectors. Innovations in low-carbon manufacturing and closed-loop recycling are enhancing environmental performance, supporting global sustainability goals.",https://techbullion.com/revolutionizing-industries-the-rising-impact-of-lightweight-metal-tubing/,aluminum technology innovation sustainability,aluminum,2025-11-14T05:13:45.260764
Major step forward for emissions-free aluminium smelting,Mining Weekly,"November 14, 2025","ELYSIS is advancing aluminium production by replacing carbon anodes with inert materials that generate oxygen instead of greenhouse gases. This technology aims to revolutionize the industry by enabling emissions-free smelting, contributing significantly to global decarbonization efforts.",https://www.miningweekly.com/article/major-step-forward-for-emissions-free-aluminium-smelting-2025-11-14,aluminum technology innovation sustainability,aluminum,2025-11-14T05:13:45.260767
"Turkey billet prices increased in the second half of October, affecting imports and domestic supplies",Steel Radar,"November 14, 2025","In Turkey, billet prices rose in late October, impacting both domestic supplies and imports from Russia. However, Russian companies face limited price increases due to weak demand outside Turkey, and Turkish steel producers have struggled to raise rebar prices, limiting further cost increases for scrap and semi-finished products.",https://www.steelradar.com/en/,steel prices and market trends,steel,2025-11-14T05:13:57.270533
NDRC: China's steel prices to rally in November,Mysteel,"November 14, 2025","China's steel prices are expected to rebound in November amid cautious optimism among market participants. Recent reports indicate a rangebound rebar market with some softening, but overall bullish sentiment is supported by macroeconomic signals and capacity adjustments.",https://www.mysteel.net/news/5103780-ndrc-chinas-steel-prices-to-rally-in-november,steel prices and market trends,steel,2025-11-14T05:13:57.270546
American rebar producers have raised prices by $60/t,GMK Center,"November 14, 2025","American rebar producers have increased prices by $60 per ton, reflecting ongoing cost pressures and market dynamics. This price adjustment is part of broader trends in steel production and consumption observed globally.",https://gmk.center/en/news/,steel prices and market trends,steel,2025-11-14T05:13:57.270552
"Proposal to amend publication deadline for Germany, Italy steel scrap price assessments",Fastmarkets,"November 14, 2025",Fastmarkets proposed changing the publication deadline for Germany and Italy domestic steel scrap price assessments from the second Friday to the final Friday of each month. This amendment aims to ensure all key market participants have finalized monthly prices before assessments are published.,https://www.fastmarkets.com/insights/proposal-to-amend-publication-deadline-for-germany-italy-steel-scrap-price-assessments/,steel prices and market trends,steel,2025-11-14T05:13:57.270557
Steel & Tube: Procurement Update Nov 2025,MarketScreener,November 2025,"Steel & Tube released a procurement update for November 2025, providing insights into current cost drivers and market conditions as the year ends. The update highlights ongoing challenges and trends affecting steel procurement costs.",https://www.marketscreener.com/news/steel-tube-procurement-update-nov-2025-ce7d5fdddb8df722,steel prices and market trends,steel,2025-11-14T05:13:57.270562
IEEFA: Oman a Frontrunner in the Green Steel Transition,Association for Iron & Steel Technology - AIST,13 November 2025,"A report from the Institute for Energy Economics and Financial Analysis (IEEFA) highlights Oman as a global leader in the green iron and steel industry, emphasizing its progress in sustainable steel production.",https://www.aist.org/steel-news,steel production and capacity,steel,2025-11-14T05:14:14.389573
U. S. Steel to Build DRI Plant on Big River Steel Works Campus,Association for Iron & Steel Technology - AIST,13 November 2025,"United States Steel Corporation confirmed plans to build a direct reduced iron (DRI) plant on the Big River Steel Works campus in Osceola, Arkansas, as part of a broader $11 billion capital investment program including new hot strip mill construction and blast furnace relining.",https://www.aist.org/steel-news,steel production and capacity,steel,2025-11-14T05:14:14.389586
Indian steel industry stumbles in September 2025 but outlook remains strong,SteelOrbis,November 2025,"India's crude steel production fell 4% month-on-month to 13.56 million mt in September 2025 due to weak demand and extended monsoon impacts, with pig iron production also down 6%. Despite this, the outlook remains positive with expected growth driven by GST cuts and festive demand.",https://www.steelorbis.com/steel-news/latest-news/indian-steel-industry-stumbles-in-september-2025-but-outlook-remains-strong-1419412.htm,steel production and capacity,steel,2025-11-14T05:14:14.389592
"Vale gearing up to meet Indian demand as China steel output stagnates, CEO says",Cyprus Shipping News,14 November 2025,"Vale's CEO stated that the company is preparing to meet rising iron ore demand from India, which is expected to double its steel production capacity to around 300 million tons in the next five to seven years. Meanwhile, China's steel production has stabilized near 1 billion metric tons and may decline slightly.",https://cyprusshippingnews.com/2025/11/14/vale-gearing-up-to-meet-indian-demand-as-china-steel-output-stagnates-ceo-says/,steel production and capacity,steel,2025-11-14T05:14:14.389597
"China's steel mills deepen output cuts over Oct-Nov as demand, margins weaken",S&P Global,November 2025,"Chinese steel mills have continued to reduce production in late October and early November due to declining construction demand and weakening profit margins, contributing to a slowdown in steel output.",https://www.spglobal.com/commodity-insights/en/news-research/latest-news/metals/111225-chinas-steel-mills-deepen-output-cuts-over-oct-nov-as-demand-margins-weaken,steel production and capacity,steel,2025-11-14T05:14:14.389602
"China October crude steel output slides on weather-led restrictions, lower margins",MarketScreener,November 2025,"China's crude steel output in October 2025 fell 2% from the previous month and declined 12.1% year-on-year, impacted by weather-related production restrictions and lower profit margins.",https://www.marketscreener.com/news/china-october-crude-steel-output-slides-on-weather-led-restrictions-lower-margins-ce7d5fdddc88f124,steel production and capacity,steel,2025-11-14T05:14:14.389606
Commodity Update – November 2025: Steel demand looks modest for 2026,Border States,November 2025,"The World Steel Association projects global steel demand to remain flat in 2025 compared to 2024, with a modest rebound expected in 2026. Growth drivers include a slowdown in China's demand decline, strong growth in India and Vietnam, and recovery in Europe, although risks like elevated costs and trade tensions persist.",https://solutions.borderstates.com/newsletter/commodity-update-november-2025/,steel production and capacity,steel,2025-11-14T05:14:14.389617
IEEFA: Oman a Frontrunner in the Green Steel Transition,Association for Iron & Steel Technology (AIST),2025-11-13,A report from the Institute for Energy Economics and Financial Analysis (IEEFA) indicates that Oman is positioned to become a global leader in the green iron and steel industry. The country is making significant progress in the transition toward sustainable steel production.,https://www.aist.org/steel-news,steel technology innovation sustainability,steel,2025-11-14T05:14:23.062197
U.S. Steel to Build DRI Plant on Big River Steel Works Campus,Association for Iron & Steel Technology (AIST),2025-11-13,"United States Steel Corporation confirmed plans to construct a direct reduced iron (DRI) plant on the Big River Steel Works campus in Osceola, Arkansas. This investment represents a significant step toward cleaner steel production methods.",https://www.aist.org/steel-news,steel technology innovation sustainability,steel,2025-11-14T05:14:23.062212
Steel Dynamics Inc. Promotes Matt Bell to President of OmniSource,Association for Iron & Steel Technology (AIST),2025-11-11,"Steel Dynamics Inc. has promoted Matt Bell to president of OmniSource, the company's metals recycling platform. This leadership change reflects the industry's growing emphasis on recycling and sustainable steel production.",https://www.aist.org/steel-news,steel technology innovation sustainability,steel,2025-11-14T05:14:23.062217
"Primetals Technologies, Deutsche Bank Extend ESG Initiative and Set Gender Diversity Goal",Association for Iron & Steel Technology (AIST),2025-11-11,"Primetals Technologies and Deutsche Bank have extended their agreement linking financial trading to sustainability, social responsibility, and gender diversity goals. This partnership demonstrates the steel industry's commitment to environmental and social governance standards.",https://www.aist.org/steel-news,steel technology innovation sustainability,steel,2025-11-14T05:14:23.062223
Commodity Update – November 2025,Border States,November 2025,"Copper prices on the London Metal Exchange reached a new high driven by the US-China trade deal at the end of October. Despite a current surplus, supply disruptions at key mines are intensifying, signaling a potential shortage in 2026. Copper prices have surged over 25% this year, helped by a weak US dollar and falling interest rates.",https://solutions.borderstates.com/newsletter/commodity-update-november-2025/,copper prices and market trends,copper,2025-11-14T05:14:41.297751
"Copper Prices, Charts, Analysis & Forecast",SMM Metals Market,"November 14, 2025","Copper prices showed slight fluctuations with the LMEselect Copper 3 Month price at around $10,859/mt on November 14, 2025. Downstream procurement remains weak, but spot discounts for SHFE copper are unlikely to widen as delivery dates approach, keeping transactions near parity.",https://www.metal.com/Copper,copper prices and market trends,copper,2025-11-14T05:14:41.297766
"Copper price hovers near $11,000 as test of record high beckons",Mining.com,November 2025,"Copper prices hovered just below $11,000 a ton, close to last year's record high, amid supply concerns following incidents at major mines including the suspension of Freeport-McMoRan’s Grasberg pit in Indonesia. The metal has rallied about 25% this year, with supply challenges becoming a key investor concern.",https://www.mining.com/web/copper-hovers-near-11000-as-test-of-record-high-beckons/,copper prices and market trends,copper,2025-11-14T05:14:41.297776
Copper Price Outlook 2025: Supply Demand & Price Forecast,Farmonaut,October 2025,"The copper price forecast for late 2025 projects a trading range of $9,000 to $10,500 per metric tonne, with demand expected to outstrip supply by about 400,000 tonnes. Persistent supply constraints and growing demand from infrastructure, renewable energy, and agricultural modernization are driving elevated prices and volatility.",https://farmonaut.com/mining/copper-price-outlook-2025-supply-demand-price-forecast,copper prices and market trends,copper,2025-11-14T05:14:41.297783
"Copper retreats on weak China data, US caution",TradingView (Reuters),"November 14, 2025","Copper prices retreated after a four-session winning streak due to weak economic data from China raising demand concerns, alongside cautious investor sentiment in the US. This pullback reflects ongoing sensitivity of copper prices to global economic indicators.","https://www.tradingview.com/news/reuters.com,2025:newsml_L1N3WQ03C:0-copper-retreats-on-weak-china-data-us-caution/",copper prices and market trends,copper,2025-11-14T05:14:41.297789
Grasberg Mine Suspension Creates Major Copper Production Crisis,Discovery Alert,"November 14, 2025","The Grasberg mine suspension has caused a significant disruption in copper production, with Freeport McMoRan reporting a 13.2% decline in Q3 2025 output compared to Q3 2024. The suspension could reduce 2025 copper production by approximately 262,000 metric tons, a 35% decrease from original forecasts, driving copper prices to 15-month highs of $10,485 per metric ton due to tightened supply.",https://discoveryalert.com.au/grasberg-underground-catastrophe-copper-supply-2025/,copper production and capacity,copper,2025-11-14T05:14:58.176201
Border States Commodity Update — November 2025,tEDmag,November 2025,"Copper supply disruptions are intensifying following incidents at key mines, signaling a potential shortage in 2026 despite a current surplus. Copper prices have surged over 25% this year, influenced by a weak U.S. dollar and falling interest rates, with the International Copper Study Group forecasting a 150,000 metric ton production drop in 2026.",https://tedmag.com/border-states-commodity-update-november-2025/,copper production and capacity,copper,2025-11-14T05:14:58.176221
DPM Metals Reports Record Third Quarter 2025 Financial Results,DPM Metals,"November 14, 2025","DPM Metals reported strong copper production of 7.8 million pounds in Q3 2025, a 6% increase over Q3 2024, driven by higher ore volumes and copper grades. However, copper production for the first nine months of 2025 was 8% lower than 2024 due to lower grades and recoveries, consistent with the mine plan.",https://dpmmetals.com/news-media/news-releases/dpm-metals-reports-record-third-quarter-2025-finan-11656/,copper production and capacity,copper,2025-11-14T05:14:58.176229
American Pacific Announces Sale of Palmer Copper-Zinc VMS Project to Vizsla Copper,American Pacific Mining,"November 14, 2025","American Pacific Mining sold its Palmer Copper-Zinc VMS Project to Vizsla Copper for $15 million in equity plus up to $15 million in milestone payments. The project is seen as a critical metals opportunity in Alaska, with Vizsla Copper planning to advance exploration and development in 2026.",https://americanpacificmining.com/news-releases-2025/american-pacific-announces-sale-of-palmer-copper-zinc-vms-project-to-vizsla-copper/,copper production and capacity,copper,2025-11-14T05:14:58.176236
Vizsla Copper to buy Palmer VMS project,North of 60 Mining News,"November 14, 2025","Vizsla Copper announced the acquisition of the Palmer VMS project, a significant copper-zinc deposit in Alaska. The acquisition is expected to enhance Vizsla's portfolio of critical mineral assets and support year-round exploration activities.",https://www.miningnewsnorth.com/story/2025/11/14/news-nuggets/vizsla-copper-to-buy-palmer-vms-project/9359.html,copper production and capacity,copper,2025-11-14T05:14:58.176242
Investor targets copper production boost,Mining Weekly,"October 30, 2025","The Kansanshi S3 expansion project, commissioned in the second half of 2025, aims to extend the mine's life to 2049 and increase copper production capacity. This expansion is part of broader efforts to boost copper output amid tightening supply conditions.",https://www.miningweekly.com/article/investor-targets-copper-production-boost-2025-10-30,copper production and capacity,copper,2025-11-14T05:14:58.176248
"Tivan Ltd News Today, Nov 14: Gold and Copper Discoveries Boost Timor",Meyka,"November 14, 2025","Tivan Ltd announced significant gold and copper discoveries in Timor-Leste, marking an important development for the region's mining sector. These discoveries could enhance future copper production potential in the area.",https://meyka.com/blog/tivan-ltd-news-today-nov-14-gold-and-copper-discoveries-boost-timor-1411/,copper production and capacity,copper,2025-11-14T05:14:58.176253
"AI boom pushes copper toward a supply crunch, BNEF warns",Mining.com,"November 10, 2025","A BloombergNEF report warns that AI data center construction is increasing copper demand by approximately 400,000 tonnes annually, with prices potentially reaching $13,500 per tonne by 2028. The surge in demand from AI infrastructure, combined with energy transition projects and fragile mine supply, is creating significant pressure on the copper market.",https://www.mining.com/video/ai-boom-pushes-copper-toward-a-supply-crunch-bnef-warns/,copper technology innovation sustainability,copper,2025-11-14T05:15:07.126622
$25.3M ARENA boost to scale SunDrive's copper solar manufacturing tech,Australian Manufacturing,November 2025,"The Australian Renewable Energy Agency has announced $25.3 million in funding for SunDrive to scale its copper solar cell technology to commercial production. The innovation replaces expensive silver with copper in solar cells, reducing costs and improving efficiency while supporting global decarbonization efforts.",https://www.australianmanufacturing.com.au/25-3m-arena-boost-to-scale-sundrives-copper-solar-manufacturing-tech/,copper technology innovation sustainability,copper,2025-11-14T05:15:07.126638
BHP Resolution Copper Mine: 7 Innovations for 2025,Farmonaut,2025,"BHP and Rio Tinto are implementing seven key innovations at the Resolution Copper Project in Arizona, including automated drilling, advanced ore processing, and water recycling systems. These technologies aim to increase copper output by up to 100,000 tonnes annually while reducing carbon emissions by approximately 8% and improving operational efficiency by 30%.",https://farmonaut.com/mining/bhp-resolution-copper-mine-7-innovations-for-2025,copper technology innovation sustainability,copper,2025-11-14T05:15:07.126645
