title,source,date,summary,url,query,category,fetched_at
Aluminum Rises to 3-Year High,Trading Economics,2025-10-23,"Aluminum prices rose to $2,862.80 per tonne on October 23, 2025, up 1.89% from the previous day and reaching a three-year high. The price increase is driven by tight supply conditions, including China's aluminum output cap of 45 million tons, which is expected to be breached this year.",https://tradingeconomics.com/commodity/aluminum,aluminum prices and market trends,aluminum,2025-10-24T05:12:59.401666
"Macro and Fundamentals Resonate Positively, Aluminum Prices Expected to Fluctuate at Highs [SMM Aluminum Morning Meeting Minutes]",SMM (Shanghai Metals Market),2025-10-24,"On October 23, the most-traded SHFE aluminum contract closed at 21,265 yuan/mt, up 0.64%, with prices expected to hover at highs in the short term. Technical indicators show a bullish trend, with resistance projected between 21,400-21,580 yuan/mt and support between 20,730-20,930 yuan/mt, though caution is advised for potential pullbacks.",https://news.metal.com/newscontent/103585036/Macro-and-Fundamentals-Resonate-Positively-Aluminum-Prices-Expected-to-Fluctuate-at-Highs-%5BSMM-Aluminum-Morning-Meeting-Minutes%5D,aluminum prices and market trends,aluminum,2025-10-24T05:12:59.401681
"LME Aluminium cash price rises 0.92% on October 23, inventories down 4,850t",Alcircle,2025-10-23,"The LME aluminium cash price increased by 0.92% to USD 2,843 per tonne on October 23, 2025, accompanied by a decline in inventories by 4,850 tonnes, indicating tightening supply conditions in the market.",https://www.alcircle.com/news/lme-aluminium-cash-price-rises-0-92-on-october-23-inventories-down-4-850t-115932,aluminum prices and market trends,aluminum,2025-10-24T05:12:59.401686
Here's why these three Aluminium-linked stocks are in focus on Friday,CNBC TV18,2025-10-24,"Shares of Hindalco Ltd., Nalco Ltd., and Vedanta Ltd. rose over 3% on October 24 as LME aluminum prices crossed $2,850 per tonne. The surge is attributed to tight global supply, a smelter shutdown in Iceland affecting 100 kt of production, and prospects of global monetary easing. US-listed Alcoa Corp shares gained 12% following CEO comments that current prices cover tariff impacts.",https://www.cnbctv18.com/market/hindalco-nalco-vedanta-share-price-lme-aluminium-rates-key-factors-behind-surge-tariff-impact-19724756.htm,aluminum prices and market trends,aluminum,2025-10-24T05:12:59.401690
"Aluminum Stocks Rally as LME Prices Surge Past $2,850 Per Tonne",ScanX Trade,2025-10-24,"Indian aluminum stocks including Hindalco, Nalco, and Vedanta saw price increases between 0.30% and 1.60% as LME aluminum prices surged past $2,850 per tonne. The rally is driven by tight global supply-demand dynamics, a smelter shutdown in Iceland, and expectations of global monetary easing. Alcoa Corporation's shares jumped 12% after CEO remarks on tariff impacts.",https://scanx.trade/stock-market-news/stocks/aluminum-stocks-rally-as-lme-prices-surge-past-2-850-per-tonne/22821187,aluminum prices and market trends,aluminum,2025-10-24T05:12:59.401693
Alcoa to own just 5pc of WA plant to bust China's dominance of gallium supply,Boiling Cold,"October 23, 2025","Alcoa will own only 5% of a new gallium plant in Western Australia aimed at reducing China's dominance in gallium supply, a critical mineral used in semiconductors and electronics. The plant leverages Alcoa's Wagerup alumina refinery and aligns with government interests to diversify supply chains outside China.",https://www.boilingcold.com.au/alcoa-to-own-just-5pc-of-wa-plant-to-bust-chinas-dominance-of-gallium-supply/,aluminum production and capacity,aluminum,2025-10-24T05:13:17.524430
Evonik Strengthens Asian Presence with New Aluminum Specialty Plant in Japan,Evonik Press Release,"October 24, 2025","Evonik has opened its first advanced fumed alumina production facility 'Alu5' in Yokkaichi, Japan, producing AEROXIDE®, a high-performance fumed aluminum oxide. The plant supports regional growth, reduces lead times and carbon footprint, and enhances supply security for industries including electric mobility and electronics.",https://www.evonik.com/en/news/press-releases/2025/10/evonik-strengthens-asian-presence-with-new-aluminum-specialty-pl.html,aluminum production and capacity,aluminum,2025-10-24T05:13:17.524448
Norsk Hydro: Solid results amid uncertain markets,GlobeNewswire,"October 24, 2025","Norsk Hydro reported a decrease in adjusted EBITDA for Aluminium Metal in Q3 2025 due to currency effects despite higher sales volumes and lower alumina costs. Global primary aluminium consumption remained flat, with growth in China offsetting declines elsewhere. Extrusion demand in Europe was flat year-over-year but down seasonally from the previous quarter.",https://www.globenewswire.com/news-release/2025/10/24/3172590/0/en/Norsk-Hydro-Solid-results-amid-uncertain-markets.html,aluminum production and capacity,aluminum,2025-10-24T05:13:17.524453
Aluminium producer Norsk Hydro's Q3 core profit lags expectations,Reuters via Sunday Guardian Live,"October 24, 2025","Norsk Hydro reported an 18.6% decline in third-quarter core profit, impacted by lower alumina prices and a stronger Norwegian crown, partially offset by increased production volumes. The results reflect ongoing market challenges in the aluminium sector.",https://sundayguardianlive.com/world/aluminium-producer-norsk-hydros-q3-core-profit-lags-expectations-157673/,aluminum production and capacity,aluminum,2025-10-24T05:13:17.524456
"Ford lowers annual guidance, citing fire at supplier's aluminum plant",The Business Times,"October 23, 2025","Ford Motor Company reduced its profit guidance due to a fire at Novelis' aluminum plant in Oswego, New York, which supplies aluminum for Ford's F-150 trucks. The disruption is expected to reduce production by up to 100,000 units through the end of 2025, with Novelis aiming to restart affected operations by December.",https://www.businesstimes.com.sg/companies-markets/transport-logistics/ford-lowers-annual-guidance-citing-fire-suppliers-aluminum-plant,aluminum production and capacity,aluminum,2025-10-24T05:13:17.524460
Kaiser Aluminum Corporation Reports Third Quarter 2025 Financial Results,Kaiser Aluminum Investor Relations,"October 24, 2025",Kaiser Aluminum announced third quarter 2025 financial results including net sales of $844 million and net income of $40 million. The report highlights ongoing operational performance amid current market conditions.,https://investors.kaiseraluminum.com/investors/news/news-details/2025/Kaiser-Aluminum-Corporation-Reports-Third-Quarter-2025-Financial-Results/default.aspx,aluminum production and capacity,aluminum,2025-10-24T05:13:17.524463
"LME Aluminium cash price rises 0.92% on October 23, inventories down 4,850t",Alcircle,"October 23, 2025","The London Metal Exchange (LME) aluminium cash price increased by 0.92% to USD 2,843 per tonne on October 23, 2025, while aluminium inventories declined by 4,850 tonnes, indicating tightening supply conditions.",https://www.alcircle.com/news/lme-aluminium-cash-price-rises-0-92-on-october-23-inventories-down-4-850t-115932,aluminum production and capacity,aluminum,2025-10-24T05:13:17.524466
Investing In Innovation: GBCCA Showcases New Technology To Close The Recycling Loop For Aluminium Cans,International Aluminium Institute,"October 23, 2025","The GBCCA presented breakthrough technologies at the International Aluminium Institute event during Climate Week NYC, focusing on autonomous sorting and recovery of aluminium cans from municipal waste. Innovations include robotics and AI systems, advanced material recovery facilities, large-scale deposit return machines, and next-generation home recycling systems, all aimed at accelerating aluminium circularity and supporting decarbonisation through recycling.",https://international-aluminium.org/investing-in-innovation-gbcca-showcases-new-technology-to-close-the-recycling-loop-for-aluminium-cans/,aluminum technology innovation sustainability,aluminum,2025-10-24T05:13:40.790772
AL Circle x Takuo Harato: Advancing sustainability and innovation in the global aluminium industry,AL Circle,"October 23, 2025","Takuo Harato, an alumina production technology consultant, discussed key sustainability challenges in the aluminium industry, emphasizing the need for carbon neutrality and green aluminium production. He highlighted energy efficiency improvements in refining processes, such as heat exchanger and heat recovery systems, as critical steps to reduce energy consumption and carbon emissions.",https://www.alcircle.com/news/al-circle-x-takuo-harato-advancing-sustainability-and-innovation-in-the-global-aluminium-industry-115903,aluminum technology innovation sustainability,aluminum,2025-10-24T05:13:40.790786
Evonik Strengthens Asian Presence with New Aluminum Specialty Production Facility,Evonik,"October 23, 2025","Evonik opened its new state-of-the-art fumed alumina production plant 'Alu5' in Yokkaichi, Japan, producing AEROXIDE®, an advanced fumed aluminum oxide that enhances performance and durability in electric mobility, electronics, and sustainable coatings. The facility reduces lead times and carbon footprint, supporting sustainable innovation and regional growth in Asia.",https://www.evonik.com/en/news/press-releases/2025/10/evonik-strengthens-asian-presence-with-new-aluminum-specialty-pl.html,aluminum technology innovation sustainability,aluminum,2025-10-24T05:13:40.790794
ET Startup Awards 2025: Chakr Innovation eyes international foray and new technology,Economic Times,"October 23, 2025","Chakr Innovation is developing clean-tech solutions including an aluminium-air energy storage technology as an alternative to lithium-ion batteries, leveraging India's abundant aluminium reserves. The startup is scaling commercial deployments and overcoming challenges related to hardware manufacturing and regulatory support under India's National Clean Air Programme.",https://economictimes.com/tech/startups/et-startup-awards-2025-chakr-innovation-eyes-international-foray-and-new-technology/articleshow/124769968.cms,aluminum technology innovation sustainability,aluminum,2025-10-24T05:13:40.790798
Can a-metal Democratize Access to Laser Fusion Technology?,3Dnatives,"October 24, 2025","a-metal, a startup spun off from ETH Zurich, is developing compact, affordable metal 3D printing solutions using laser powder bed fusion to make metal additive manufacturing accessible to SMEs. Their technology aims to reduce machine size and complexity while increasing robustness, enabling broader adoption of metal 3D printing for sustainable manufacturing.",https://www.3dnatives.com/en/can-a-metal-democratize-access-to-laser-fusion-technology-24102025/,aluminum technology innovation sustainability,general,2025-10-24T05:13:40.790808
Steel prices hit five-year low; weak trend likely to persist in near term,The Economic Times,"October 24, 2025","Domestic steel prices have dropped to a five-year low, trading between Rs 47,000-48,000 per tonne due to multiple factors including surging imports and weak export demand. Hot rolled coil prices hover around Rs 47,150 per tonne, while re-bar prices range from Rs 46,500-47,000 per tonne, levels last seen during the 2020 pandemic slowdown.",https://economictimes.com/industry/indl-goods/svs/steel/steel-prices-hit-five-year-low-weak-trend-likely-to-persist-in-near-term-bigmint/articleshow/124776337.cms,steel prices and market trends,steel,2025-10-24T05:14:03.379034
"Steel fell to 3,035 CNY/T on October 24, 2025, down 0.16% from the previous day",Trading Economics,"October 24, 2025","Steel prices declined slightly to 3,035 CNY per tonne on October 24, 2025, down 0.16% from the previous day. Over the past month, steel prices have fallen 1.37% and are down 6.41% compared to the same time last year. Analysts expect prices to continue declining to around 2,875.97 CNY/MT within 12 months.",https://tradingeconomics.com/commodity/steel,steel prices and market trends,steel,2025-10-24T05:14:03.379049
US scrap trends outlook: October 2025,Fastmarkets,October 2025,"Ferrous scrap prices in the US are expected to fall further in October 2025, continuing a downward trend from September. Market participants cite lower demand as the primary driver, with bearish sentiment across buyers, brokers, and sellers. Inventories remain slightly below average, indicating supply constraints are unlikely to support prices.",https://www.fastmarkets.com/insights/us-scrap-trends-outlook-october-2025-2/,steel prices and market trends,general,2025-10-24T05:14:03.379058
Steel Ministry to Address Import Issues with Industry Stakeholders on October 27,ETInfra (The Economic Times),"October 24, 2025","The Ministry of Steel will hold an Open House on October 27, 2025, to address steel import-related concerns amid rising imports that have pressured domestic steel prices and market share. The session aims to facilitate direct interaction with industry stakeholders to discuss issues related to SIMS, NOC, QCO, and other import matters.",https://infra.economictimes.indiatimes.com/news/construction/steel-ministry-to-address-import-issues-with-industry-stakeholders-on-october-27/124737235,steel prices and market trends,steel,2025-10-24T05:14:03.379063
"JSW Steel Ltd: Live Stock Update and Price as of October 24, 2025",Angel One,"October 24, 2025","JSW Steel Ltd's share price experienced a slight increase of 0.34%, actively trading at ₹1,145.00 as of October 24, 2025. This reflects a positive upturn in the company's stock performance amid current market conditions.",https://www.angelone.in/live-blog/jsw-steel-ltd-24-oct-2025-500228,steel prices and market trends,steel,2025-10-24T05:14:03.379072
Global crude steel production falls 1.6% in September,Anadolu Agency,"October 23, 2025","Global crude steel production decreased by 1.6% in September compared to the same period last year, primarily due to a 4.6% decline in Chinese production. Despite this, countries like the US and India saw increases in production. Türkiye's production rose by 3.3% to 3.2 million tons.",https://www.aa.com.tr/en/economy/global-crude-steel-production-falls-16-in-september/3725089,steel production and capacity,steel,2025-10-24T05:14:09.246676
Steel prices hit five-year low; weak trend likely to persist in near term,The Economic Times,Recent,"Domestic steel prices in India have dropped to a five-year low, influenced by rising imports and stable raw material costs. The Ministry of Steel is set to discuss these issues with industry stakeholders. India remains a net importer of steel despite increased exports.",https://economictimes.com/industry/indl-goods/svs/steel/steel-prices-hit-five-year-low-weak-trend-likely-to-persist-in-near-term-bigmint/articleshow/124776337.cms,steel production and capacity,steel,2025-10-24T05:14:09.246693
EU's Proposed Tariffs on Steel to Address Excess Capacity and Enable Decarbonization Could Worsen Trade Tensions,Columbia University's Center on Global Energy Policy,Recent,The EU's proposed tariffs on steel aim to address excess capacity and promote decarbonization but may exacerbate trade tensions. The regulation could impact global steel trade dynamics and compliance with trade norms.,https://www.energypolicy.columbia.edu/eus-proposed-tariffs-on-steel-to-address-excess-capacity-and-enable-decarbonization-could-worsen-trade-tensions/,steel production and capacity,steel,2025-10-24T05:14:09.246700
"Reinventing Steel for a Stronger, Lighter, Greener Future",Highways Today,"October 7, 2025","Next-generation steel is transforming construction with stronger, lighter alloys and low-carbon manufacturing. Innovations in green steel are enabling more sustainable building designs and reducing embodied carbon, though challenges remain in scaling production and cost competitiveness.",https://highways.today/2025/10/07/reinventing-steel/,steel technology innovation sustainability,steel,2025-10-24T05:14:17.663591
The Global Steel Industry 2025: At a Pivotal Crossroads,Steel Technology,2025 (exact date not specified),"The steel industry is undergoing major changes with AI integration, green steel production, hydrogen use, automation, and a strong focus on sustainability and recycling. These innovations are reshaping manufacturing processes and driving demand for low-carbon steel materials globally.",https://www.steel-technology.com/articles/the-global-steel-industry-2025-at-a-pivotal-crossroads,steel technology innovation sustainability,steel,2025-10-24T05:14:17.663605
"Steel Tech 2025: The event where steel, technology and innovation shape its future",Bilbao Exhibition Centre,"October 21-23, 2025","Steel Tech 2025 congress and expo in Bilbao gathers industry leaders and experts to discuss challenges and innovations in steel technology, including carbon-free energy sources, AI applications, and CO2 capture and valorisation. The event highlights the sector’s commitment to sustainability and technological advancement.",https://steeltech.bilbaoexhibitioncentre.com/en/steel-tech-2025-the-event-where-steel-technology-and-innovation-shape-its-future/,steel technology innovation sustainability,steel,2025-10-24T05:14:17.663616
GPH Ispat pioneers green steel in Bangladesh with most advanced technology,TBS News,October 2025 (exact date not specified),"GPH Ispat is leading green steel production in Bangladesh by adopting Q-EAF technology, investing in renewable energy, and emphasizing sustainability. This positions the company at the forefront of environmentally responsible steel manufacturing in the region.",https://www.tbsnews.net/economy/industry/gph-ispat-pioneers-green-steel-bangladesh-most-advanced-technology-1252871,steel technology innovation sustainability,steel,2025-10-24T05:14:17.663621
SteelDays Celebrates Sustainability,Modern Steel Construction,October 2025 (exact date not specified),"SteelDays highlights innovations and leadership in steel sustainability, showcasing cutting-edge mills and sustainable practices that reinforce steel as a highly sustainable construction material.",https://www.aisc.org/modernsteel/news/2025/october/steeldays-celebrates-sustainability/,steel technology innovation sustainability,steel,2025-10-24T05:14:17.663626
Tetelo Copper Ore Project Is Expected to Commence Production; LME Copper Rose Sharply Overnight,Metal.com,"October 24, 2025","The Tetelo copper mine project in Angola is set to start production, marking a significant development for the country's mining sector. Meanwhile, LME copper prices rose sharply overnight, reaching a high of $10,876 per tonne before closing at $10,817 per tonne. This increase reflects ongoing supply disruptions and robust demand.",https://news.metal.com/newscontent/103585001/Tetelo-Copper-Ore-Project-Is-Expected-to-Commence-Production-LME-Copper-Rose-Sharply-Overnight-%5BSMM-Copper-Morning-Meeting-Minutes%5D,copper prices and market trends,copper,2025-10-24T05:14:23.054092
Copper Prices Rise,Business Recorder,Recent,"Benchmark three-month copper on the London Metal Exchange rose 1.6% to USD10,834 a metric ton, marking its highest level since October 14. This increase is attributed to ongoing market dynamics and supply constraints.",https://www.brecorder.com/news/40388913/copper-prices-rise,copper prices and market trends,copper,2025-10-24T05:14:23.054106
Copper Strides Higher on Hopes for Stimulus After China Plenum,Hellenic Shipping News,Recent,"Copper prices have increased due to expectations that China will introduce new stimulus measures in its five-year plan. This potential stimulus could bolster demand from China, the world's top metals consumer.",https://www.hellenicshippingnews.com/copper-strides-higher-on-hopes-for-stimulus-after-china-plenum/,copper prices and market trends,copper,2025-10-24T05:14:23.054113
Weekly Overseas Copper News Roundup Oct 20-24,SMM,"October 23, 2025","Antofagasta reported Q3 2025 copper production of 161,800 metric tons, up 1% quarter-on-quarter, with full-year production expected at the low end of 660,000–700,000 metric tons. Freeport-McMoRan's Q3 copper production declined year-on-year to 912 million pounds due to a mudslide incident and lower ore grades but profits exceeded expectations due to rising copper prices.",https://news.metal.com/newscontent/103585546/Weekly-Overseas-Copper-News-Roundup-Oct-20-24,copper production and capacity,copper,2025-10-24T05:14:44.054622
Tetelo Copper Ore Project Is Expected to Commence Production,SMM,"October 24, 2025","The Tetelo copper mine project in Uíge Province, Angola, controlled by Chinese company Shining Star Icarus, is expected to start production soon. The project involves an initial open-pit mining phase with an annual output of about 25,000 metric tons of copper concentrates, transitioning to underground mining in the second half of 2026, marking a significant expansion of Angola's copper capacity.",https://news.metal.com/newscontent/103585001/Tetelo-Copper-Ore-Project-Is-Expected-to-Commence-Production-LME-Copper-Rose-Sharply-Overnight-%5BSMM-Copper-Morning-Meeting-Minutes%5D,copper production and capacity,copper,2025-10-24T05:14:44.054641
Angola Opens First Major Copper Mine in $250 Million Push Beyond Oil,The Voice of Africa,"October 23, 2025","Angola launched its first large-scale copper mine, the Tetelo project, valued at $250 million and owned by China's Shining Star Icarus. The mine is expected to produce 25,000 metric tons of copper concentrate annually during its first two years, transitioning from open-pit to underground mining in 2026, supporting Angola's economic diversification and positioning it as a key player in the global clean energy minerals market.",https://thevoiceofafrica.com/2025/10/23/angola-opens-first-major-copper-mine-in-250-million-push-beyond-oil/,copper production and capacity,copper,2025-10-24T05:14:44.054650
Antofagasta 9-month Copper Production Rises,Nasdaq,"October 23, 2025","Antofagasta reported copper production of 476,600 tonnes for the first nine months of 2025, a 3% increase year-on-year, driven by higher output at Centinela Concentrates. The company expects full-year 2025 copper production to be at the lower end of its guidance range of 660,000 to 700,000 tonnes, with a forecasted increase in 2026 at Los Pelambres.",https://www.nasdaq.com/articles/antofagasta-9-month-copper-production-rises,copper production and capacity,copper,2025-10-24T05:14:44.054656
Robert Friedland says global economy faces copper crisis,Canadian Mining Journal,October 2025,"Industry veteran Robert Friedland warns that global copper demand is accelerating and could outstrip supply within two decades, requiring mining of as much copper in the next 18 years as in the past 10,000 years combined. Despite copper prices rising to over $5 per pound, Friedland argues prices need to reach $15,000 per tonne to justify new mine investments critical for the energy transition.",https://www.canadianminingjournal.com/news/robert-friedland-says-global-economy-faces-copper-crisis/,copper production and capacity,copper,2025-10-24T05:14:44.054663
Indonesia may allow copper miner Amman Mineral to export copper concentrate,Reuters,"October 24, 2025","Indonesia is considering allowing copper miner Amman Mineral International to resume copper concentrate exports after a fire at its smelter caused technical constraints. The government banned concentrate exports in mid-2023 to boost domestic processing but may grant exemptions under force majeure conditions, with the export permit process underway.",https://sundayguardianlive.com/world/update-1-indonesia-may-allow-copper-miner-amman-mineral-to-export-copper-concentrate-157667/,copper production and capacity,copper,2025-10-24T05:14:44.054669
More high-grade copper discovered at Rae,North of 60 Mining News,"October 23, 2025","New discoveries of high-grade copper have been reported at the Rae project, indicating promising exploration results that could enhance copper production capacity in the region.",https://www.miningnewsnorth.com/story/2025/10/24/northern-neighbors/more-high-grade-copper-discovered-at-rae/9325.html,copper production and capacity,copper,2025-10-24T05:14:44.054675
Solis Minerals (ASX:SLM) Boosts Copper Plans with Cucho Move,Kalkine Media,October 2025,"Solis Minerals has gained full option to acquire the Cucho Copper Project and has begun the exploration phase with strong geological groundwork, aiming to expand its copper production potential.",https://kalkinemedia.com/au/stocks/metal-and-mining/solis-minerals-asxslm-boosts-copper-plans-with-cucho-move,copper production and capacity,copper,2025-10-24T05:14:44.054680
Codelco and Ennomotive Launch Global Challenge to Reduce Mining Dust,Canadian Mining Journal,Recent,"Codelco and Ennomotive have launched a global challenge to find solutions for reducing airborne dust generated by the interaction between underground and open-pit mining operations. The challenge seeks technologies that can efficiently measure, control, and mitigate dust with minimal human intervention and low environmental impact. Solutions must be compatible with daily operations and withstand extreme weather conditions.",https://www.canadianminingjournal.com/news/codelco-and-ennomotive-launch-an-international-challenge-to-control-dust-generated-by-the-interaction-between-underground-and-open-pit-mining/,copper technology innovation sustainability,general,2025-10-24T05:14:50.593800
