title,source,date,summary,url,query,category,fetched_at
"Aluminum Price Hits Three-Year High at $2,920/Tonne",Discovery Alert,"November 3, 2025","Aluminum prices reached a three-year high of $2,920 per tonne on November 3, 2025, driven by Chinese production caps, supply shortages, and strong global demand. Sustained buying pressure and tight inventory levels on the London Metal Exchange support continued price strength.",https://discoveryalert.com.au/aluminum-price-2025-high-china-production-impact/,aluminum prices and market trends,aluminum,2025-11-27T05:14:05.733702
Aluminum - Price - Chart - Historical Data - News,Trading Economics,"November 26, 2025","Aluminum prices rose to $2,871.65 per tonne on November 26, 2025, up 2.12% from the previous day, rebounding from a recent four-week low. Despite a slight monthly decline, prices remain nearly 10% higher than a year ago, supported by macroeconomic tailwinds and stimulus signals.",https://tradingeconomics.com/commodity/aluminum,aluminum prices and market trends,aluminum,2025-11-27T05:14:05.733716
Aluminum Premium Reaches Record High in the US Due to Tariffs and Global Squeeze,OE Digital (Energy News),"November 10, 2025","The US aluminum premium hit a record high, with spot buyers paying $4,792 per tonne due to import tariffs and global supply constraints. The Midwest premium reached $1,942 per metric ton, reflecting ongoing market tightness and trade policy impacts.",https://energynews.oedigital.com/mining/2025/11/10/aluminum-premium-reaches-record-high-in-the-us-due-to-tariffs-and-global-squeeze,aluminum prices and market trends,aluminum,2025-11-27T05:14:05.733721
"LME Aluminium Cash Offer Jumps 1.27% to $2,822.50/t as Opening Stocks Fall",AL Circle,"November 26, 2025","LME aluminium prices rose to $2,822.50 per tonne on November 26, 2025, as exchange stocks declined by 0.37%. The increase reflects tightening supply conditions and sustained market demand.",https://www.alcircle.com/news/lme-aluminium-cash-offer-jumps-1-27-to-2-822-50-t-as-opening-stocks-fall-0-37-116348,aluminum prices and market trends,aluminum,2025-11-27T05:14:05.733725
The Premium for Aluminum in the US Spot Market Has Hit a Record High,Metal.com,"November 26, 2025","The US spot market aluminum premium reached a record high, with buyers paying $4,792 per tonne when the base price is $2,850. The surge is attributed to import tariffs and global supply constraints.",https://news.metal.com/newscontent/103615477/,aluminum prices and market trends,aluminum,2025-11-27T05:14:05.733728
Aluminum Prices Surging: Bull Run Amid Supply Crunches,Ag Metal Miner,"November 27, 2024","Aluminum prices are up approximately 18% year-on-year, with three-month futures on the London Metal Exchange reaching $2,710 per tonne on November 7. China's removal of export tax rebates and plans to cap domestic production at 45 million tons are driving supply concerns globally. Russian metals giant Rusal announced plans to cut aluminum production by at least 6%, reducing output by 250,000 metric tons in the initial phase.",https://agmetalminer.com/2024/11/27/aluminum-prices-to-surge/,aluminum production and capacity,aluminum,2025-11-27T05:14:13.012919
"According to SMM statistics, the weekly aluminum ingot outflow was 143200 tons last week",Metal News,"November 27, 2025","Weekly aluminum ingot outflow reached 143,200 tons, representing an increase of 18,500 tons compared to the previous week. This data reflects current market activity in aluminum production and distribution.",https://news.metal.com/newscontent/102493865/,aluminum production and capacity,aluminum,2025-11-27T05:14:13.012932
Across the Aluminum Value Chain: How Collaboration Drives Decarbonization,Alcoa,2025-11,"The ELYSIS joint venture by Alcoa and Rio Tinto has achieved a major milestone by starting up a 450 kA inert anode cell at a commercial smelter in Quebec, marking the first large-scale deployment of carbon-free aluminum smelting technology. This technology replaces carbon anodes with inert materials that emit oxygen instead of CO₂, reducing the carbon footprint of aluminum by about 40%. The initiative aims to scale sustainable aluminum production and expand recycling systems to meet decarbonization and economic viability goals.",https://www.alcoa.com/global/en/stories/releases?id=2025%2F11%2Facross-the-aluminum-value-chain-how-collaboration-drives-decarbonization,aluminum technology innovation sustainability,aluminum,2025-11-27T05:14:33.387182
Choosing Aluminum Alloys: Performance in Extreme Temperatures,Bioengineer.org,2025,"A recent study published in 'Ionics' explores the performance of industrial aluminum alloys in aluminum-air batteries under extreme temperatures, highlighting their potential as sustainable, high-energy-density power sources. The research emphasizes the importance of alloy selection to optimize battery efficiency and sustainability, positioning aluminum-air batteries as promising alternatives for renewable energy storage and electric vehicles.",https://bioengineer.org/choosing-aluminum-alloys-performance-in-extreme-temperatures/,aluminum technology innovation sustainability,aluminum,2025-11-27T05:14:33.387195
"Aerosol can features Elysis primary aluminum, recycled content",Recycling Today,2025-11,"Alcoa, Ball Corp., and Unilever have partnered to launch aerosol cans made with 50% Elysis primary aluminum and 50% post-consumer recycled content, representing one of the lowest-carbon packaging solutions available. The Elysis technology eliminates direct greenhouse gas emissions from aluminum smelting by using inert anode technology, supporting industry-wide decarbonization and responding to consumer demand for sustainable products.",https://www.recyclingtoday.com/news/alcoa-ball-unilever-partner-on-aerosole-can-made-with-elysis-primary-aluminum/,aluminum technology innovation sustainability,aluminum,2025-11-27T05:14:33.387200
"Ball, Unilever show green aluminium can work",Mines and Money,2025-11-06,"Ball Corporation and Unilever are using aluminum produced with Alcoa's ELYSIS carbon-free smelting technology in aerosol cans, marking a significant step in sustainable packaging and industrial collaboration. The cans combine 50% low-carbon primary aluminum and 50% recycled content, demonstrating a scalable model for decarbonizing aluminum packaging and meeting global sustainability goals.",https://minesandmoney.com/news/industry/ball-unilever-show-green-aluminium-can-work,aluminum technology innovation sustainability,aluminum,2025-11-27T05:14:33.387203
"Alcoa, Ball and Unilever debut carbon-free aluminium aerosol packaging",World Aerosols,2025-11,"Ahead of COP30, Alcoa, Ball, and Unilever introduced an innovative aerosol can made with 50% Elysis aluminum and 50% post-consumer recycled content, significantly reducing carbon emissions in packaging. The Elysis process replaces carbon emissions with oxygen during smelting, eliminating direct greenhouse gases and advancing sustainable materials for personal and home care sectors.",https://worldaerosols.com/news/alcoa-ball-and-unilever-debut-carbon-free-aluminium-aerosol-packaging/,aluminum technology innovation sustainability,aluminum,2025-11-27T05:14:33.387207
Building a sustainable metals infrastructure: NIST report highlights strategic opportunities,Tech Xplore,2025-11-18,"A recent NIST report outlines strategies to advance sustainable metals manufacturing, including aluminum, through new measurement science, standards development, enhanced data and modeling tools, workforce education, and stakeholder collaboration. The report emphasizes the importance of recycling technologies and supply chain innovations to support green technology development and address critical material scarcity.",https://techxplore.com/news/2025-11-sustainable-metals-infrastructure-nist-highlights.html,aluminum technology innovation sustainability,aluminum,2025-11-27T05:14:33.387211
Aluminum giants hit major milestone with low-carbon production,Canary Media,2025-11,"Elysis, a joint venture between Alcoa and Rio Tinto, announced a breakthrough in scaling its carbon-free inert anode technology for aluminum smelting, significantly reducing greenhouse gas emissions. This milestone represents a key advancement toward large-scale, low-carbon aluminum production and industry decarbonization.",https://www.canarymedia.com/articles/clean-aluminum/alcoa-riotinto-hit-low-carbon-production-milestone,aluminum technology innovation sustainability,aluminum,2025-11-27T05:14:33.387215
US steel demand to firm in 4Q: Gerdau,Argus Media,27 November 2025,"US steel demand is expected to strengthen in the fourth quarter, with spot and long-term premiums ranging from 18-21¢/lb ($396-463/t). Persistent inventory depletion has led to pronounced backwardation in the market, making forward pricing difficult and slowing contract negotiations.",https://www.argusmedia.com/en/news-and-insights/latest-market-news/2748988-us-steel-demand-to-firm-in-4q-gerdau,steel prices and market trends,steel,2025-11-27T05:14:41.100945
"Steel Prices, News and Analysis",SteelOrbis,27 November 2025,"US flat steel prices continue to rise ahead of the Thanksgiving holiday, while rebar and wire rod prices remain flat. The weekly average price change for flat steel was +1.49%, reflecting ongoing market activity despite holiday slowdowns.",https://www.steelorbis.com/steel-prices/,steel prices and market trends,steel,2025-11-27T05:14:41.100960
"Canada to add new tariffs to US steel, curb foreign imports",Moneycontrol,27 November 2025,Canada has introduced a new 25% levy on steel derivative products from the US as part of measures to support domestic producers. This is the first time new tariffs have been added since most retaliatory tariffs were dropped in September.,https://www.moneycontrol.com/news/business/canada-to-add-new-tariffs-to-us-steel-curb-foreign-imports-13698384.html,steel prices and market trends,steel,2025-11-27T05:14:41.100965
Carney to announce new supports today for steel industry hammered by U.S. tariffs,The Canadian Press (via Ottawa CityNews),"November 26, 2025","Prime Minister Mark Carney announced new measures to support Canada's steel sector, including limiting foreign steel imports and cutting interprovincial rail freight rates by 50%. The government plans to reduce steel imports from non-free-trade agreement countries to 20% of 2024 levels and subsidize rail freight rate reductions to help the industry affected by U.S. tariffs.",https://ottawa.citynews.ca/2025/11/26/carney-to-announce-new-supports-today-for-steel-industry-hammered-by-u-s-tariffs/,steel production and capacity,steel,2025-11-27T05:15:01.973151
"Canada unveils more measures to protect tariff-hit steel, lumber industries",Economic Times Infra,"November 26, 2025","Canada announced enhanced protections for its steel and lumber industries facing U.S. tariffs, including reducing steel import quotas from non-FTA countries to 20% of 2024 levels and imposing a 25% tariff on steel derivative products. The government will also work with railways to cut freight rates by 50% for interprovincial steel shipments and support local steel use in construction.",https://infra.economictimes.indiatimes.com/news/construction/canada-strengthens-measures-to-protect-steel-and-lumber-industries-amid-us-tariffs/125603230,steel production and capacity,steel,2025-11-27T05:15:01.973167
"Canada to add new tariffs to US steel, curb foreign imports",Moneycontrol,"November 27, 2025","Canada introduced a new 25% tariff on steel derivative products imported from the U.S. as part of a broader strategy to protect its steel industry. This marks the first time new import taxes on U.S. products have been added since most retaliatory tariffs were dropped in September, aiming to curb foreign imports and support domestic producers.",https://www.moneycontrol.com/news/business/canada-to-add-new-tariffs-to-us-steel-curb-foreign-imports-13698384.html,steel production and capacity,steel,2025-11-27T05:15:01.973172
Govt Urged to Act on Surge in Cheap Imported Steel,Mirage News,"November 27, 2025","The Australian steel industry has requested emergency trade relief measures to counter a surge in low-priced imported fabricated steelwork threatening local manufacturers. The Australian Steel Institute highlighted significant business closures and reduced capacity utilization due to competition from cheap imports, urging government intervention to preserve domestic steel production capacity.",https://www.miragenews.com/govt-urged-to-act-on-surge-in-cheap-imported-1578786/,steel production and capacity,steel,2025-11-27T05:15:01.973178
Iron Ore Prices Forecast to Ease,Sharecafe,"November 27, 2025","Iron ore prices are expected to decline in 2026 due to increased supply from new projects and ongoing demand pressure from China. Despite low inventories supporting prices currently, factors such as steel production curbs and weak Chinese demand are forecasted to weigh on prices, with a long-term decline projected through 2034.",https://www.sharecafe.com.au/2025/11/27/iron-ore-prices-forecast-to-ease/,steel production and capacity,steel,2025-11-27T05:15:01.973183
The Global Steel Industry 2025: At a Pivotal Crossroads,Steel Technology,2025,"The steel industry is undergoing a major transformation driven by AI, hydrogen-based methods, automation, and sustainability efforts. Green steel production is gaining momentum as demand for low-carbon materials rises, with hydrogen playing a key role in decarbonizing steelmaking processes. Supply chain disruptions continue to challenge the industry, prompting tech-driven solutions and a shift toward greener practices.",https://www.steel-technology.com/articles/the-global-steel-industry-2025-at-a-pivotal-crossroads,steel technology innovation sustainability,steel,2025-11-27T05:15:24.769513
How decarbonizing steel build a greener future,Abdul Latif Jameel®,2025,"Innovations such as electric arc furnaces using less fossil fuel and green hydrogen-powered furnaces are advancing steel decarbonization. The UAE's Masdar and EMSTEEL have launched a pilot project producing green steel with renewable hydrogen, potentially reducing CO₂ emissions by up to 95%. Governments are encouraged to support multiple technologies, increase demand for low-carbon steel, and fund the transition to sustainable steel manufacturing.",https://alj.com/en/spotlight-by-fady-jameel/steel-deal-how-could-decarbonizing-steel-help-build-a-greener-future/,steel technology innovation sustainability,steel,2025-11-27T05:15:24.769533
Stalatube's High-Strength Stainless Steel & Smart Solutions for Sustainable Bus Design,Motor India Online,2025,"Stalatube Oy is innovating with high-strength stainless steel and smart design to create lighter, stronger, and more sustainable bus structures. Their duplex stainless steels significantly reduce CO₂ emissions compared to traditional materials due to lighter construction and recyclability. Sustainability is integrated across their value chain, from raw material sourcing to production and logistics, supporting the transition to zero-emission public transport.",https://www.motorindiaonline.in/stalatubes-high-strength-stainless-steel-smart-solutions-for-sustainable-bus-design/,steel technology innovation sustainability,steel,2025-11-27T05:15:24.769543
Building a sustainable metals infrastructure: NIST report highlights key strategies,TechXplore,November 2025,"The National Institute of Standards and Technology (NIST) released a report outlining strategies to develop a sustainable and resilient U.S. metals processing infrastructure. Key challenges include supply chain vulnerabilities and lack of robust standards for recycled content. The report recommends advancing measurement science, developing standards, enhancing data tools, workforce development, and fostering collaboration to improve metals recycling and sustainability.",https://techxplore.com/news/2025-11-sustainable-metals-infrastructure-nist-highlights.html,steel technology innovation sustainability,general,2025-11-27T05:15:24.769554
Addressing steel decarbonisation challenges for industry and policy,OECD,2025,"Over 90% of global steelmaking capacity is in countries committed to net-zero emissions, with many producers setting ambitious decarbonization goals. Challenges include scaling technologies, securing resources, investment needs, creating markets for low-carbon steel, and phasing out emission-intensive plants. Effective policies are needed to support innovation, infrastructure, demand for green steel, and manage the transition without exacerbating excess capacity.",https://www.oecd.org/en/publications/addressing-steel-decarbonisation-challenges-for-industry-and-policy_e6cb2f3c-en.html,steel technology innovation sustainability,steel,2025-11-27T05:15:24.769561
Eco-friendly inhibitors for sustainable corrosion protection of mild steel under oilfield acidizing conditions,Nature,27 November 2025,"This study explores novel eco-friendly corrosion inhibitors derived from agro-industrial and botanical wastes to protect mild steel in harsh acidizing conditions. Using electrochemical and surface analysis methods, the research demonstrates effective corrosion protection at elevated temperatures, contributing to sustainable steel maintenance practices.",https://www.nature.com/articles/s41598-025-27271-8,steel technology innovation sustainability,steel,2025-11-27T05:15:24.769566
"Copper breaks above $11,000 on increased likelihood of US rate cut",Hellenic Shipping News,2025-11-27,"Copper prices rose to their highest level in almost a month, reaching $11,025 per metric ton on Wednesday. The rally was driven by increased expectations for a US Federal Reserve rate cut, with CME's FedWatch Tool showing over 84% probability of a 25 basis point cut in December.",https://www.hellenicshippingnews.com/copper-breaks-above-11000-on-increased-likelihood-of-us-rate-cut/,copper prices and market trends,copper,2025-11-27T05:15:35.498226
Highland Copper Partial Project Equity Transfer Overnight LME Copper Surged Significantly,Metal.com,2025-11-27,"LME copper opened at $10,992.5/mt and touched a high of $11,009.5/mt in early trading on Thursday, November 27, 2025. The contract closed at $10,953/mt, up 1.11%, with trading volume at 22,000 lots.",https://news.metal.com/newscontent/103641780/Highland-Copper-Partial-Project-Equity-Transfer-Overnight-LME-Copper-Surged-Significantly-%5BSMM-Copper-Morning-Meeting-Minutes%5D,copper prices and market trends,copper,2025-11-27T05:15:35.498243
Copper Stabilizes on Dovish Fed Bets,Trading Economics,2025-11-25,"Copper steadied around $5 per pound on Monday as dovish comments from a senior US Federal Reserve official boosted expectations for a rate cut next month. Markets priced in about a 69% chance of a 25 basis point cut in December, up from 44% a week earlier.",https://tradingeconomics.com/commodity/copper,copper prices and market trends,copper,2025-11-27T05:15:35.498251
Mercuria's copper bull forecasts more price records next year,Hellenic Shipping News,2025-11-27,"A squeeze in global copper markets is expected to tighten again next year, pushing prices of concentrate and refined metal to new records. Market analysts forecast continued upward pressure on copper prices due to supply constraints.",https://www.hellenicshippingnews.com/mercurias-copper-bull-forecasts-more-price-records-next-year/,copper prices and market trends,copper,2025-11-27T05:15:35.498258
"Comex copper premium here to stay, LME executive says",Mining Weekly,2025-11-27,An LME executive stated that the copper price premium on the US Comex exchange over the London Metal Exchange is likely to persist over the next 18 months. This premium reflects structural differences in the two markets.,https://www.miningweekly.com/article/comex-copper-premium-here-to-stay-lme-executive-says-2025-11-27,copper prices and market trends,copper,2025-11-27T05:15:35.498265
Highland Copper Partial Project Equity Transfer Overnight LME Copper Surged Significantly [SMM Copper Morning Meeting Minutes],Metal.com,"Thursday, November 27, 2025","LME copper prices opened at $10,992.5/mt overnight and reached a high of $11,009.5/mt before closing at $10,953/mt, up 1.11%. Copper inventories on LME and SHFE decreased, while secondary copper rod market transactions remained mediocre with cautious procurement from downstream buyers.",https://news.metal.com/newscontent/103641780/Highland-Copper-Partial-Project-Equity-Transfer-Overnight-LME-Copper-Surged-Significantly-%5BSMM-Copper-Morning-Meeting-Minutes%5D,copper production and capacity,copper,2025-11-27T05:15:56.391015
"'Fire away copper, build the bank': Revolver Resources",Mining.com.au,"November 26, 2025","Revolver Resources is preparing for a final investment decision to develop copper production, expecting first copper cathode output in H2 2026. The company highlights strong copper demand growth and increased copper grades in its resource, positioning it well for production and cash flow generation next year.",https://mining.com.au/fire-away-copper-build-the-bank-revolver-resources/,copper production and capacity,copper,2025-11-27T05:15:56.391031
UBS raises copper outlook as mine disruptions deepen supply deficits,Hellenic Shipping News,"November 27, 2025","UBS lowered its refined copper production growth estimates to 1.2% for 2025 and 2.2% for 2026 due to declining ore grades and operational challenges at mines, signaling deeper supply deficits in the copper market.",https://www.hellenicshippingnews.com/ubs-raises-copper-outlook-as-mine-disruptions-deepen-supply-deficits/,copper production and capacity,copper,2025-11-27T05:15:56.391039
Mitsubishi Materials to cut primary copper smelting volume by 30% to 40% by 2035,Hellenic Shipping News,"November 27, 2025","Japan's Mitsubishi Materials announced plans to reduce its primary copper smelting volume by 30% to 40% by 2035, reflecting strategic adjustments in copper production capacity over the next decade.",https://www.hellenicshippingnews.com/mitsubishi-materials-to-cut-primary-copper-smelting-volume-by-30-to-40-by-2035/,copper production and capacity,copper,2025-11-27T05:15:56.391046
China's grip on copper sets scene for make-or-break supply talks,The Japan Times,"November 24, 2025","China's dominance in copper processing is creating tensions as global supply negotiations approach a critical point. The industry faces challenges due to geopolitical tensions, limited metal availability, and pressure on the pricing mechanism that underpins global copper trade.",https://www.japantimes.co.jp/business/2025/11/24/china-copper-supply-talks/,copper production and capacity,copper,2025-11-27T05:15:56.391052
All resolutions passed as the company advances copper expansion and strategic partnerships,TradingView,"November 26, 2025","HCH announced the passing of all resolutions related to advancing its copper expansion projects and forming strategic partnerships, signaling progress in increasing copper production capacity.",https://www.tradingview.com/news/urn:summary_document_transcript:quartr.com:2343472:0-hch-all-resolutions-passed-as-the-company-advances-copper-expansion-and-strategic-partnerships/,copper production and capacity,copper,2025-11-27T05:15:56.391058
BWR Exploration Inc. and Electro Metals and Mining Inc. Announce Meeting of Shareholders and Record Date,GlobeNewswire,"November 25, 2025","BWR Exploration and Electro Metals and Mining announced a transaction to create a new publicly traded company focused on high-grade copper and gold projects in Canada, aiming to advance exploration and development with significant growth potential.",https://www.globenewswire.com/news-release/2025/11/25/3194537/0/en/BWR-Exploration-Inc-and-Electro-Metals-and-Mining-Inc-Announce-Meeting-of-Shareholders-and-Record-Date.html,copper production and capacity,copper,2025-11-27T05:15:56.391064
"AI boom pushes copper toward a supply crunch, BNEF warns",mining.com,"November 26, 2025","The expansion of artificial intelligence data centres is increasing copper demand by an estimated 400,000 tonnes annually, with prices potentially reaching $13,500 per tonne by 2028. Energy transition projects and fragile mine supply are adding additional pressure to the copper market.",https://www.mining.com/video/ai-boom-pushes-copper-toward-a-supply-crunch-bnef-warns/,copper technology innovation sustainability,copper,2025-11-27T05:16:05.628335
Doubleview Gold Corp. Achieves a Major Breakthrough in Scandium Recovery from Copper Porphyry Tailings,AZoMining,"November 27, 2025","Doubleview Gold has successfully recovered scandium from copper porphyry flotation tailings to produce scandium oxide, marking a global first in the industry. The breakthrough could enable scandium to be included as a high-margin bonus product alongside copper, gold, and cobalt production at the HAT project.",https://www.azomining.com/News.aspx?newsID=18526,copper technology innovation sustainability,copper,2025-11-27T05:16:05.628352
"Amid Expectations of Copper Concentrate Shortages, How Are Smelters Adjusting Their Operating Strategies",metal.com,November 2025,"Global smelters are actively adjusting their strategies in response to copper concentrate shortages and declining treatment charges. Chinese smelters are expanding cathode exports to approximately 700,000 tons in 2025 and negotiating long-term contracts to secure stable feedstock supply.",https://news.metal.com/newscontent/103634470/amid-expectations-of-copper-concentrate-shortages-how-are-smelters-adjusting-their-operating-strategies,copper technology innovation sustainability,copper,2025-11-27T05:16:05.628359
