title,source,date,summary,url,query,category,fetched_at
Aluminum Eases from 3-Year High,Trading Economics,2025-11-11,"Aluminum futures in the UK fell to $2,850 per tonne from a three-year high of $2,915 on November 1st, reflecting a broad pullback in base metals due to soft manufacturing PMIs in the US and China. Despite the dip, prices remain 12% higher year-to-date, with lingering supply concerns supporting the market.",https://tradingeconomics.com/commodity/aluminum,aluminum prices and market trends,aluminum,2025-11-13T05:13:48.273674
European Aluminum Duty-Paid Premium Hits $324 Per Ton,Discovery Alert,2025-11-12,"The European aluminum duty-paid premium reached $324 per metric ton, up from a recent low, driven by supply disruptions, carbon tax preparations, and freight cost pressures. The premium hit $330 on November 3, the highest since late January, signaling renewed upward pressure on regional pricing.",https://discoveryalert.com.au/european-aluminum-premium-2025-dynamics/,aluminum prices and market trends,aluminum,2025-11-13T05:13:48.273689
Alcoa (AA) Soars as Aluminum Prices Hit 17-Month High Amidst Green Energy Boom,WRAL Market Minute,2025-11-03,"Aluminum prices climbed to a 17-month high, with LME futures hovering around $2,900 per tonne, driven by tightening global supply, easing US-China trade tensions, and strong demand from green energy sectors. Inventories fell to their lowest since 2021, fueling investor optimism.",https://markets.financialcontent.com/wral/article/marketminute-2025-11-3-alcoa-aa-soars-as-aluminum-prices-hit-17-month-high-amidst-green-energy-boom,aluminum prices and market trends,aluminum,2025-11-13T05:13:48.273694
Trump's Tariffs Send US Aluminum Prices to Record Highs,OilPrice.com,2025-11-12,"US all-in aluminum prices hit a record $4,816 per ton, nearly double 2023 lows, due to sharply tightening inventories and Trump administration tariffs. The Midwest premium surged, reflecting significant cost increases for US buyers.",https://oilprice.com/Energy/Energy-General/Trumps-Tariffs-Send-US-Aluminum-Prices-to-Record-Highs.html,aluminum prices and market trends,aluminum,2025-11-13T05:13:48.273698
Aluminium Prices Are On The Rise As US Premium At Record High,CNBC-TV18,2025-11-12,"Aluminum prices are up 13% in 2025, with the US premium hitting record highs. China reiterated its commitment to preventing overcapacity in metal production, supporting global price increases.",https://www.youtube.com/watch?v=ZdDnECeL4Zs,aluminum prices and market trends,aluminum,2025-11-13T05:13:48.273702
Alcoa Says High US Aluminum Prices Offset Trump Tariff Costs,Mining.com,2025-11-12,Alcoa reported that higher US aluminum prices have offset the increased costs from Trump’s tariffs on Canadian aluminum. The company expects further tariff-related costs but sees domestic price strength helping to mitigate the impact.,https://www.mining.com/web/alcoa-sees-tariff-costs-on-aluminum-shipments-continuing-to-rise/,aluminum prices and market trends,aluminum,2025-11-13T05:13:48.273711
Aluminum Hits Three-Year High as US-China Truce Boosts Market Confidence,Channelchek,2025-11-12,"Aluminum prices surged to their highest level since May 2022, driven by supply constraints in China and renewed optimism following a tentative US-China trade truce. The rally reflects the market’s sensitivity to geopolitical developments and production policies.",https://www.channelchek.com/news-channel/aluminum-hits-three-year-high-as-us-china-truce-boosts-market-confidence,aluminum prices and market trends,aluminum,2025-11-13T05:13:48.273717
The Premium for Aluminum in the US Spot Market Has Hit a Record High,Metal News,2025-11-12,"The US spot market aluminum premium reached a record high, with buyers paying $4,792 per ton. The surge is attributed to high import tariffs and tight supply conditions.",https://news.metal.com/newscontent/103615477/,aluminum prices and market trends,aluminum,2025-11-13T05:13:48.273720
"Aluminum Rod Production Cut Wave Hits - Nearly 800,000 MT of Capacity Undergoes Concentrated Maintenance Shutdowns in November",Metal News,"November 12, 2025","China's aluminum rod production declined to 381,000 mt in October 2025, with operating rates falling to 53.56%. Production cuts affecting nearly 792,000 mt of capacity emerged in November across multiple regions, with Inner Mongolia leading reductions at 252,000 mt, representing approximately 10% of total sample capacity.",https://news.metal.com/newscontent/103617727/aluminum-rod-production-cut-wave-hits-nearly-800000-mt-of-capacity-undergoes-concentrated-maintenance-shutdowns-in-november-smm-analysis,aluminum production and capacity,aluminum,2025-11-13T05:13:59.958727
European Aluminum Premium Soars to Nine-Month High of $324 Per Tonne Amid Supply Disruptions and CBAM Anticipation,Financial Content / Market Minute,"November 12, 2025","The European aluminum duty-paid premium reached $324 per metric ton in November 2025, marking a nine-month high driven by supply disruptions including the Grundartangi smelter outage in Iceland and front-loading of imports ahead of CBAM implementation. European downstream manufacturers in automotive, construction, and packaging sectors face significantly increased input costs.",https://markets.financialcontent.com/wral/article/marketminute-2025-11-12-european-aluminum-premium-soars-to-nine-month-high-of-324tonne-amid-supply-disruptions-and-cbam-anticipation,aluminum production and capacity,aluminum,2025-11-13T05:13:59.958742
European Aluminum Duty-Paid Premium Hits $324 Per Ton,Discovery Alert,"November 12, 2025","The European aluminum duty-paid premium currently stands at $324 per metric ton, with a peak of $330 reached on November 3, the highest level since late January. The Grundartangi smelter in Iceland experienced a critical electrical equipment failure in late October, reducing production capacity by approximately two-thirds or 213,000 tons annually.",https://discoveryalert.com.au/european-aluminum-premium-2025-dynamics/,aluminum production and capacity,aluminum,2025-11-13T05:13:59.958747
Aluminium Prices Are On The Rise As US Premium At Record High,CNBC-TV18,"November 12, 2025","Aluminum prices have risen 13% in 2025 with LME prices near three-year highs, driven by supply concerns and China's reiteration of preventing overcapacity in metal production. Reports suggest the aluminum market faces a deficit for the current year and potentially 2026.",https://www.youtube.com/watch?v=ZdDnECeL4Zs,aluminum production and capacity,aluminum,2025-11-13T05:13:59.958752
"Alcoa, Ball, and Unilever Lead with Carbon-Free Smelting Technology",CSI Market,2025-11-07,"Alcoa Corporation, Ball Corporation, and Unilever PLC announced a groundbreaking collaboration introducing the first use of ELYSIS carbon-free smelting technology in consumer personal and home care packaging. The innovative technology eliminates direct greenhouse gas emissions from aluminum production by generating oxygen instead of CO2, aligning with global climate change mitigation efforts ahead of COP30.",https://csimarket.com/news/pioneering-sustainable-practices-alcoa-ball-and-unilever-lead-with-carbon-free-smelting-technology2025-11-07140104,aluminum technology innovation sustainability,aluminum,2025-11-13T05:14:11.710086
"Alcoa, Ball, and Unilever Pioneer Carbon-Free Aluminum in Consumer Packaging",Market Chameleon,2025-11-06,"The three companies unveiled the world's first consumer personal and home care packaging using ELYSIS carbon-free aluminum, with aerosol cans made from 50% ELYSIS primary aluminum and 50% post-consumer recycled content. This collaboration demonstrates how companies across the value chain can accelerate low-carbon innovation and deliver tangible sustainability benefits.",https://marketchameleon.com/articles/b/2025/11/6/alcoa-ball-unilever-elysis-carbon-free-aluminum-packaging,aluminum technology innovation sustainability,aluminum,2025-11-13T05:14:11.710100
"COP30: Unilever, Ball and Alcoa unveil ""first"" carbon-free aluminum aerosol can",Packaging Insights,2025-11-10,"Ball Corporation, Unilever, and Alcoa debuted the first aerosol can made using Elysis carbon-free smelting technology, combining 50% Elysis aluminum with 50% recycled content to eliminate direct GHG emissions from smelting. The collaboration marks a significant step in decarbonizing aluminum packaging for personal care products.",https://www.packaginginsights.com/news/carbon-free-aluminum-aerosol-can.html,aluminum technology innovation sustainability,aluminum,2025-11-13T05:14:11.710103
"Ball, Unilever show green aluminium can work",Mines and Money,2025-11-13T05:14:11.710108,Ball and Unilever are using aluminium produced using Alcoa Corporation's ELYSIS carbon-free smelting technology in aerosol cans as part of a critical supply chain collaboration. The project combines higher recycled content and low-carbon primary aluminum to decarbonize aluminum packaging and the aluminum sector at large.,https://minesandmoney.com/news/industry/ball-unilever-show-green-aluminium-can-work,aluminum technology innovation sustainability,aluminum,2025-11-13T05:14:11.710107
Ball Corporation launches 'Aluminum Assists' sustainability challenge,Waste360,2025-11-10,"Ball Corporation announced the launch of Aluminum Assists, a season-long sustainability challenge in partnership with the Denver Nuggets and Colorado Avalanche. The initiative promotes aluminum recycling and sustainable practices within the sports and entertainment sector.",https://www.waste360.com/sustainability/ball-corporation-launches-aluminum-assists-at-ball-arena-with-the-denver-nuggets-and-colorado-avalanche,aluminum technology innovation sustainability,aluminum,2025-11-13T05:14:11.710113
"SS Breaks Downward Through 12,500 yuan/mt, Stainless Steel Spot Trading Weak with Insufficient Market Confidence",SMM (Shanghai Metals Market),"November 12, 2025","Stainless steel futures broke below 12,500 yuan/mt, reaching an intraday low of 12,460 yuan/mt, driven by further declines in SHFE nickel and weak stainless steel fundamentals. The SS2601 contract was quoted at 12,560 yuan/mt, down 5 yuan/mt from the previous trading day, with market sentiment turning bearish.",https://www.metal.com/Finished-Steel,steel prices and market trends,steel,2025-11-13T05:14:22.949616
"Steel fell to 3,038 CNY/T on November 12, 2025",Trading Economics,"November 12, 2025","Steel prices declined to 3,038 CNY/T, down 0.16% from the previous day. Over the past month, steel prices have fallen 0.69%, and are down 7.09% compared to the same time last year.",https://tradingeconomics.com/commodity/steel,steel prices and market trends,steel,2025-11-13T05:14:22.949631
"HRC Steel fell to 844.05 USD/T on November 12, 2025",Trading Economics,"November 12, 2025","Hot-Rolled Coil (HRC) steel fell to 844.05 USD/T, down 0.93% from the previous day. Over the past month, HRC steel prices have risen 3.69%, and are up 23.22% compared to the same time last year.",https://tradingeconomics.com/commodity/hrc-steel,steel prices and market trends,steel,2025-11-13T05:14:22.949636
SMU Price Ranges: Sheet and plate products inch higher,Steel Market Update,"November 11, 2025","Sheet and plate steel prices moved higher in unison this week. Current pricing shows HR at 800-860 USD/T (average 830), CR at 980-1,060 USD/T (average 1,020), and plate at 960-1,060 USD/T (average 1,010).",https://www.steelmarketupdate.com,steel prices and market trends,steel,2025-11-13T05:14:22.949641
European carbon prices exceeded €80/t in November,GMK Center,"November 12, 2025","European carbon prices surpassed the €80 per ton threshold in November, reflecting market conditions affecting steel production costs in the region.",https://gmk.center/en/news/,steel prices and market trends,steel,2025-11-13T05:14:22.949650
SSAB gains SEA funds for steel mill,Global Trailer,Not specified,"SSAB has received approximately €28.67 million in funding from the Swedish Energy Agency to complete processes at its €4.5 billion electrified steel mill in Luleå, Sweden. The funding will support the development of technical solutions for electrification and energy efficiency in finishing processes, replacing natural gas and propane usage. The project is expected to reduce SSAB's carbon dioxide emissions by approximately 90 percent.",https://www.globaltrailermag.com/ssab-gains-sea-funds-for-steel-mill/,steel production and capacity,steel,2025-11-13T05:14:33.619415
Steel Firms Up as China Tackles Overcapacity,Trading Economics,Not specified,"Steel rebar futures climbed to around CNY 3,100 per ton following China's announcement of new measures to curb steelmaking capacity in key regions. Beijing proposed a stricter capacity swap plan that would prohibit adding new steel capacity in key areas to rebalance supply and demand and improve profit margins.",https://tradingeconomics.com/commodity/steel/news/496605,steel production and capacity,steel,2025-11-13T05:14:33.619430
"Flat Steel Market Size to Hit USD 1,157.84 Billion by 2034",Globe Newswire,"November 12, 2025","The global flat steel market is projected to grow from USD 724.33 billion in 2025 to USD 1,157.84 billion by 2034. Major developments include AM/NS India's capacity expansion with a new 7 MTPA integrated flat steel mill in Andhra Pradesh, and the industry's significant transition toward low-carbon steel production through electric arc furnaces and hydrogen-based technologies.",https://www.globenewswire.com/news-release/2025/11/12/3186658/0/en/Flat-Steel-Market-Size-to-Hit-USD-1-157-84-Billion-by-2034.html,steel production and capacity,steel,2025-11-13T05:14:33.619437
Oman Poised to Lead Global Green Steel Revolution: IEEFA Report,Solar Quarter,"November 13, 2025","An IEEFA report highlights Oman's potential to become a leader in green steel production, leveraging its integrated steelmaking supply chain and renewable energy resources. The report emphasizes that transitioning from gas-based direct reduced iron production to green hydrogen is essential for Oman to capture the green premium in global markets.",https://solarquarters.com/2025/11/13/oman-poised-to-lead-global-green-steel-revolution-ieefa-report/,steel production and capacity,steel,2025-11-13T05:14:33.619442
Green Iron Process Revolutionising Zero-Carbon Steel Manufacturing,Discovery Alert,"November 13, 2025","Green iron technology uses clean electricity and hydrogen gas instead of coal and natural gas to convert iron ore into high-grade steel products. The process can reduce steelmaking emissions by over 90% compared to traditional methods while maintaining cost competitiveness. Market projections suggest 15-25% of global steel production could convert to green iron processes by 2035, with potential capacity reaching 50-100 million tonnes annually.",https://discoveryalert.com.au/green-iron-technology-zero-carbon-2025/,steel technology innovation sustainability,steel,2025-11-13T05:14:45.588244
The Global Steel Industry 2025: At a Pivotal Crossroads,Steel Technology,2025,"The steel industry is undergoing major transformations including adoption of AI, green steel production, hydrogen technology, and automation. Hydrogen has shifted from experimental to essential in decarbonizing steel production, while electric arc furnaces powered by green electricity represent a cleaner alternative to traditional steelmaking methods. The industry faces a critical choice between maintaining historic practices or embracing sustainable innovations.",https://www.steel-technology.com/articles/the-global-steel-industry-2025-at-a-pivotal-crossroads,steel technology innovation sustainability,steel,2025-11-13T05:14:45.588260
Climate change and the production of iron and steel - 2025,World Steel,2025,The steel industry commits to supporting the Paris Agreement and developing low-carbon steelmaking technologies. Steel's infinite recyclability and role in circular economy solutions make it fundamental to climate resilience and sustainable infrastructure. Industry members representing 85% of global steel production are investing in efficient technologies including digitalization and AI to reduce energy use and greenhouse gas emissions.,https://worldsteel.org/climate-action/climate-change-and-the-production-of-iron-and-steel/,steel technology innovation sustainability,steel,2025-11-13T05:14:45.588266
SMA: Global steel industry in 2025 is rising to the challenge,Steel Orbis,2025,"Electric arc furnace adoption is recognized as crucial for the green transition, producing steel with less than half the carbon intensity of integrated production. The industry is debating standards for low-emissions steel certification to help customers compare emissions. With an estimated 600 million tons of excess steelmaking capacity worldwide, the industry has an opportunity to drastically reduce emissions by idling high-carbon mills.",https://www.steelorbis.com/steel-news/interviews/sma-the-global-steel-industry-in-2025-is-rising-to-the-challenge-1378160.htm,steel technology innovation sustainability,steel,2025-11-13T05:14:45.588271
Taseko Florence Copper Production: Arizona ISCR Mining 2025,Discovery Alert,"November 13, 2025","Taseko Florence Copper has achieved major construction milestones in 2025, with the solvent extraction and electrowinning plant substantially completed in September and wellfield operations commencing in mid-October. The project is now ramping up production using in-situ recovery technology, with a phased approach to ensure sustainability and efficiency.",https://discoveryalert.com.au/florence-copper-mining-difference-2025/,copper production and capacity,copper,2025-11-13T05:15:28.156467
"Taseko Reports Stronger Copper Output, Nears First Production at Florence Copper 2025",Mining Weekly,"November 13, 2025","Taseko's Gibraltar mine saw increased copper production, reaching 27.6 million pounds, including 895,000 pounds of cathode, as mining moved into higher-grade areas. The company is nearing first production at its Florence Copper project, marking a significant milestone for the company.",https://www.miningweekly.com/article/taseko-reports-stronger-copper-output-nears-first-production-at-florence-copper-2025-11-13,copper production and capacity,copper,2025-11-13T05:15:28.156484
Taseko Announces Improved Third Quarter Financial and Operational Results,Taseko Mines,"November 13, 2025","Taseko reported improved copper production for the third quarter, with expectations for 2025 output between 100 and 105 million pounds. The company anticipates further increases in copper head grades and recoveries in the fourth quarter.",https://tasekomines.com/investors/news/taseko-announces-improved-third-quarter-financial-and-operational-results,copper production and capacity,copper,2025-11-13T05:15:28.156491
DPM Metals Announces Preliminary Third Quarter Production Results,DPM Metals,"November 13, 2025","DPM Metals reported increased gold and copper production in the third quarter, with both mines on track to meet 2025 guidance. The company highlighted the integration of the Vareš asset and its growth potential for copper production.",https://dpmmetals.com/news-media/news-releases/dpm-metals-announces-preliminary-third-quarter-pro-11525/,copper production and capacity,copper,2025-11-13T05:15:28.156502
Copper Elevated to Critical Mineral Status: A Strategic Imperative for the Green Transition,FinancialContent Markets,"November 7, 2025","Copper was formally included in the 2025 List of Critical Minerals by the USGS, marking a strategic shift towards boosting domestic copper production and recycling to support clean energy technologies. This designation is expected to accelerate policy initiatives, innovation in sustainable mining practices, and partnerships focused on reducing import reliance and enhancing the circular economy for copper.",https://markets.financialcontent.com/stocks/article/marketminute-2025-11-12-copper-elevated-to-critical-mineral-status-a-strategic-imperative-for-the-green-transition,copper technology innovation sustainability,copper,2025-11-13T05:15:43.446614
$25.3 million finance to advance SunDrive copper solar cell technology,pv magazine Australia,"November 11, 2025","The Australian Renewable Energy Agency committed $25.3 million to SunDrive to develop its copper metallisation technology for solar cells, replacing silver to reduce costs and improve efficiency. This innovation supports ultra-low cost solar goals and aims to provide a scalable, silver-free alternative for solar cell manufacturing, enhancing global decarbonization efforts.",https://www.pv-magazine-australia.com/2025/11/11/25-3-million-finance-to-advance-sundrive-copper-solar-cell-technology/,copper technology innovation sustainability,copper,2025-11-13T05:15:43.446632
Marimaca Copper's oxide project passes environmental hurdle,Mining.com,November 2025,"Marimaca Copper received formal environmental approval for its flagship oxide project in Chile, designed as an open-pit, heap-leach operation producing 50,000 tonnes of copper cathodes annually. The project emphasizes sustainability through the use of recycled seawater and rigorous environmental and social standards, marking a significant step in advancing responsible copper mining.",https://www.mining.com/marimaca-coppers-oxide-project-passes-environmental-hurdle/,copper technology innovation sustainability,copper,2025-11-13T05:15:43.446639
"Teck Highlights Progress on Quebrada Blanca Ramp up, Pathway to Full Potential, and Value Delivery to Shareholders from Merger",Teck Resources Limited,"November 3, 2025","Teck Resources reported progress on ramping up its Quebrada Blanca copper mine in Chile, aiming to become a top 5 global copper producer through operational improvements and a merger with Anglo American. The project focuses on sustainable growth with state-of-the-art facilities and plans for increased copper production with environmental considerations.","https://www.teck.com/news/news-releases/2025/teck-highlights-progress-on-quebrada-blanca-ramp-up,-pathway-to-full-potential,-and-value-delivery-to-shareholders-from-merger",copper technology innovation sustainability,copper,2025-11-13T05:15:43.446647
Surge Copper Highlights Strengthening Policy Environment for Critical Minerals Development in Canada,GlobeNewswire,"November 10, 2025","Surge Copper welcomed recent Canadian federal and provincial policy measures that support critical minerals development, including streamlined permitting and infrastructure investments. The Berg Project, a large-scale copper and molybdenum resource with a low-carbon, hydro-powered design, aligns with national priorities for sustainable resource development and Indigenous partnerships.",https://www.globenewswire.com/news-release/2025/11/10/3184388/0/en/Surge-Copper-Highlights-Strengthening-Policy-Environment-for-Critical-Minerals-Development-in-Canada.html,copper technology innovation sustainability,copper,2025-11-13T05:15:43.446654
"Nickel Asia Q3 profit jumps to P3.09B on higher ore prices, exports",Business World Online,"November 13, 2025","Nickel Asia Corp. reported a more than twofold increase in attributable net income for Q3, reaching P3.09 billion, driven by higher nickel ore prices and strong export performance. The company's operating mines sold 13.89 million WMT of nickel ore in the first nine months, with exports of saprolite and limonite ore totaling 8.32 million WMT at an average price of $37.52 per WMT, marking a 51.66% increase in export prices. The company expects nickel ore price tightness to persist as Indonesia enforces stricter policies on production permits.",https://www.bworldonline.com/corporate/2025/11/13/711926/nickel-asia-q3-profit-jumps-to-p3-09b-on-higher-ore-prices-exports/,nickel prices and market trends,nickel,2025-11-13T05:15:53.806669
"Nickel fell to 15,025.25 USD/T on November 13, 2025",Trading Economics,"November 13, 2025","Nickel prices fell to 15,025.25 USD/T on November 13, 2025, down 0.13% from the previous day, with prices down 0.53% over the past month and 4.50% compared to the same time last year. Nickel futures in the UK fell to $15,000 per tonne in November, trading at the lower end of their narrow range since June and significantly underperforming other base metals amid views of an oversupplied market. The decline is attributed to ample output from Indonesia's over-expanded nickel sector following the country's ore export ban in 2020.",https://tradingeconomics.com/commodity/nickel,nickel prices and market trends,nickel,2025-11-13T05:15:53.806691
Indonesia releases benchmark prices for nickel ore in November period I,MySteel,November 2025,"The Indonesia Nickel Miners Association (APNI) announced benchmark prices for nickel ore for the first half of November 2025, with the reference price set at $15,075.33/wmt, dropping 0.44% from the second period of October. FOB prices by grade showed declines across all nickel content levels, with Ni 1.6% at $26.65/wmt and Ni 2.0% at $41.16/wmt. The price adjustments reflect the ongoing market conditions affecting nickel ore valuations.",https://www.mysteel.net/news/5103862-flash-indonesia-releases-benchmark-prices-for-nickel-ore-in-november-period-i,nickel prices and market trends,nickel,2025-11-13T05:15:53.806703
