title,source,date,summary,url,query,category,fetched_at
FACTBOX: Aluminum prices surge as Middle East war disrupts GCC trade flows,S&P Global,"March 06, 2026","The war in the Middle East has disrupted aluminum production and exports from Gulf Cooperation Council countries, which produced 6.16 million metric tons in 2025, about 8% of global output. Key smelters like Emirates Global Aluminium, Alba, and others are affected. US Midwest aluminum premiums have hit records due to these disruptions and tariffs.",https://www.spglobal.com/energy/en/news-research/latest-news/metals/030626-factbox-aluminum-prices-surge-as-middle-east-war-disrupts-gcc-trade-flows,aluminum production and capacity,aluminum,2026-03-27T06:07:53.474752
Aluminium prices expected to rise with prolonged war set to hit Gulf producers,The National,"March 10, 2026","Aluminum prices are expected to stay elevated due to ongoing war disruptions, with LME prices reaching $3,544/tonne amid Strait of Hormuz shipping closures. Bahrain's Alba declared force majeure, and Qatar’s Qatalum shut down production due to gas shortages. Analysts warn of potential prices toward $4,000/tonne if disruptions persist.",https://www.thenationalnews.com/business/2026/03/10/aluminium-prices-likely-to-rise-with-longer-war-disruption-set-to-hit-regional-producers/,aluminum production and capacity,aluminum,2026-03-27T06:07:53.474773
The Silver Squeeze: Aluminum Surges Past $3000 as 2026 Supply Crunch Hits Global Markets,Times Online,"March 23, 2026","Aluminum prices breached $3,000/tonne on the LME due to supply deficits from China's production caps and demand from energy transition sectors. Geopolitical chokepoints exacerbate the crunch, turning China into a net importer. Producers like Rio Tinto and Norsk Hydro benefit from high prices.",http://business.times-online.com/times-online/article/marketminute-2026-3-23-the-silver-squeeze-aluminum-surges-past-3000-as-2026-supply-crunch-hits-global-markets,aluminum production and capacity,aluminum,2026-03-27T06:07:53.474779
War Disruptions Trigger Smelting Capacity Crisis,Chronicle Journal Markets,"March 26, 2026","Middle East war has caused aluminum prices to surge past $3,500/tonne, with shuttered smelting capacity and high electricity costs due to shipping lane closures. Emirates Global Aluminium faces export blockades despite ongoing operations. US producers like Century Aluminum are restarting plants to fill the gap.",http://markets.chroniclejournal.com/chroniclejournal/article/marketminute-2026-3-26-aluminum-market-under-siege-war-disruptions-trigger-smelting-capacity-crisis,aluminum production and capacity,aluminum,2026-03-27T06:07:53.474783
Prysmian Partners with Rio Tinto for Innovative Aluminum Solution with ELYSIS™ Accelerating Sustainability Commitment,Morningstar / Accesswire,"March 12, 2026","Prysmian has partnered with Rio Tinto to produce building wire using ELYSIS™ aluminum, which eliminates direct greenhouse gas emissions from smelting and emits oxygen instead. This innovation supports lower carbon emissions in wire and cable production and aligns with sustainability goals for data centers and net zero targets by 2035. The partnership builds on a 2023 supply agreement for low-carbon aluminum from renewable hydropower.",https://www.morningstar.com/news/accesswire/1146299msn/prysmian-partners-with-rio-tinto-for-innovative-aluminum-solution-with-elysistm-accelerating-sustainability-commitment,aluminum technology innovation sustainability,aluminum,2026-03-27T06:08:02.243163
ALUMINIUM 2026 Launches New Industry Innovation Awards,ALUMINIUM Exhibition,2026-03-27T06:08:02.243178,"ALUMINIUM 2026 introduces Innovation Awards celebrating breakthroughs in sustainable manufacturing, technology, and smart automation. Categories include Sustainable & Low-Carbon Manufacturing, Technology & Product Innovation, and Smart Manufacturing, Automation & Connectivity. Entries from exhibitors open in May, with industry voting in September on innovations from the past 48 months.",https://www.aluminium-exhibition.com/germany/en-gb/blog/industry-news/innovation-awards.html,aluminum technology innovation sustainability,aluminum,2026-03-27T06:08:02.243176
"IBAAS–2026 to Spotlight Innovation, Sustainability and Digital Transformation in the Global Aluminium Industry",Alcircle,2026-03-27T06:08:02.243189,"IBAAS 2026 will unite global aluminum experts in India, focusing on bauxite innovation, recycling, green aluminum, AI, and sustainable practices. Key themes include bauxite beneficiation, red mud management, value recovery from wastes, advanced alloys, cathode technologies, circular economy, and Industry 4.0 digitalization. The event drives transformation toward low-carbon and resource-efficient production.",https://www.alcircle.com/press-release/ibaas-2026-to-spotlight-innovation-sustainability-and-digital-transformation-in-the-global-aluminium-industry-117624,aluminum technology innovation sustainability,aluminum,2026-03-27T06:08:02.243187
Aluminum at the Centre of Global Industrial Transformation AICE 2026,Highways Today,"February 9, 2026","AICE 2026 in Suzhou gathers the global aluminum industry to address sustainability, standards, and innovation across the value chain for infrastructure and manufacturing. Regulatory pressures and commitments accelerate investments in scrap collection, sorting, and remelting technologies. The event highlights aluminum's role in lighter materials and the shift to sustainable production.",https://highways.today/2026/02/09/aluminum-aice-2026/,aluminum technology innovation sustainability,aluminum,2026-03-27T06:08:02.243193
Why Is Aluminum Scrap Suddenly Shaping the Future? The 2026 Global Shockwave Explained,Made-in-China Insights,2026-03-27T06:08:02.243198,"The aluminum scrap market is booming due to policy shifts, rising prices, and demand for sustainability, with innovations in closed-loop recycling, green smelting, and sorting systems. Recycled aluminum uses 95% less energy than primary production, aiding carbon reduction and circular economy goals. Regions like Asia-Pacific see surging demand from construction, automotive, and electronics sectors.",https://insights.made-in-china.com/Why-Is-Aluminum-Scrap-Suddenly-Shaping-the-Future-The-2026-Global-Shockwave-Explained_paMGcqSuqJlA.html,aluminum technology innovation sustainability,aluminum,2026-03-27T06:08:02.243197
"Recycled AL & Sustainability update: Plant fire, low-carbon cable trials, recycling gains and major global expansions",Alcircle,2026-03-27T06:08:02.243204,"Recent developments in recycled aluminum and sustainability include plant fire disruptions, low-carbon cable trials, recycling advancements, and strategic global expansions. These updates shape the industry's push toward lower emissions and efficient practices. The news highlights ongoing innovations amid challenges.",http://www.alcircle.com/news/recycled-al-sustainability-update-plant-fire-low-carbon-cable-trials-recycling-gains-and-major-global-expansions-117631,aluminum technology innovation sustainability,aluminum,2026-03-27T06:08:02.243203
Global Iron and Steel Prices and News 26.03.2026,SteelRadar,"March 26, 2026","India's flat steel market remains firm, with HRC prices holding near multi-month highs amid strong demand and restocking activity. Russia's potential excise duty on imported steel and EU revisions to the Carbon Border Adjustment Mechanism are highlighted. U.S. steel imports rose 0.8% monthly in February, while Ukraine’s scrap export ban pressures the market.",https://www.steelradar.com/en/,steel prices and market trends,steel,2026-03-27T06:08:07.633987
Steel - Price - Chart - Historical Data - News,Trading Economics,"March 27, 2026","Steel prices fell to 3,122 CNY/T on March 26, 2026, down 0.29% from the previous day. Steel rebar futures dropped to around CNY 3,130 per ton due to Tangshan's level-two emergency response amid heavy air pollution, raising concerns over output curbs. Chinese steel production declined 3.6% in February, with global output falling 2.2%.",https://tradingeconomics.com/commodity/steel,steel prices and market trends,steel,2026-03-27T06:08:07.634002
Steel Market Forecast 2026-2027 | Global Price Outlook & Analysis,Steel on the Net,"March 27, 2026","Major regulatory developments are reshaping steel trade flows and prices in 2026–27, particularly in Europe, with ferrous scrap prices rangebound in the $350–380/t range. Little meaningful steel price recovery is expected globally in 2026 due to overcapacity, weak Chinese demand, and declining raw materials, with upturns more likely in 2027.",https://www.steelonthenet.com/resources/market-data/market-outlook.html,steel prices and market trends,steel,2026-03-27T06:08:07.634011
Steel Imports Up 0.8% In February vs. January,American Iron and Steel Institute (AISI),"March 25, 2026","The U.S. imported 1,663,000 net tons of steel in February 2026, up 0.8% from January, while finished steel imports fell 6.2%. Year-to-date imports are down significantly compared to 2025, with finished steel import market share at 15%. Over the 12-month period to February 2026, total steel imports declined 20.3%.",https://www.steel.org/2026/03/steel-imports-up-0-8-in-february-vs-january/,steel production and capacity,steel,2026-03-27T06:08:12.350848
U.S. Steel Manufacturers Plan Near-Term Capacity Additions,Industrial Info Resources,2026-03-27T06:08:12.350864,U.S. steel manufacturers are planning over $6 billion in capital projects starting in Q2 2026 to boost capacity and efficiency. United States Steel is adding a premium thread line in Alabama and upgrading its Mon Valley Works in Pennsylvania. These investments focus on operational improvements and reducing pollution amid shifts to EAF technology.,https://www.industrialinfo.com/iirenergy/industry-news/article/us-steel-manufacturers-plan-near-term-capacity-additions--355463,steel production and capacity,steel,2026-03-27T06:08:12.350862
Copper Supply Crunch Intensifies: Impact on Global Renewable Energy Sector,MarketMinute/MyMotherLode,"March 20, 2026","Global copper markets face a structural supply deficit with prices on the London Metal Exchange ranging from $12,000 to $14,500 per metric ton. The crisis stems from chronic underinvestment in new mines combined with major operational disruptions in 2025, including a mudslide at Indonesia's Grasberg mine that triggered a force majeure. China's top copper smelters cut production by over 10% for 2026 due to collapsed treatment and refining charges.",https://money.mymotherlode.com/clarkebroadcasting.mymotherlode/article/marketminute-2026-3-20-copper-supply-crunch-intensifies-impact-on-global-renewable-energy-sector,copper production and capacity,copper,2026-03-27T06:08:36.380714
"Chile's copper output, manufacturing production decline in January",Kitco News,"February 27, 2026","Chile, the world's largest copper producer, saw copper output fall 3% year-on-year in January 2026 to 413,712 metric tons. Manufacturing production in the country also declined 3.8% on a yearly basis during the same period.",https://www.kitco.com/news/off-the-wire/2026-02-27/chiles-copper-output-manufacturing-production-decline-january,copper production and capacity,copper,2026-03-27T06:08:36.380730
How Will Tight Copper Market Affect Data Center Growth?,Industrial Info,February 2026,"A looming copper shortage threatens data center expansion plans worth $600+ billion in 2026, as the International Copper Study Group predicts a 150,000 metric-ton deficit. The U.S. launched Project Vault with $10 billion in EXIM loans and $2 billion in private investment to create a Strategic Critical Minerals Reserve, while major projects like the Vicuna copper project in South America could eventually produce over 500,000 metric tons annually.",https://www.industrialinfo.com/iirenergy/industry-news/article/how-will-tight-copper-market-affect-data-center-growth--353673,copper production and capacity,copper,2026-03-27T06:08:36.380737
Copper Weekly Brief - 27th February 2026,Copper.com.au,"February 27, 2026","Copper traded around $13,000 per ton in late February, remaining strong year-on-year despite slight easing from recent records. Exchange inventories reached 20-year highs, but analysts attribute this to timing and logistics rather than true surplus, with forecasters expecting 2026 to be a consolidation year in a continuing bull market driven by electrification and grid investment.",https://copper.com.au/news/weekly-copper-brief/copper-weekly-brief-27th-february-2026/,copper production and capacity,copper,2026-03-27T06:08:36.380745
Barrick Mining delays copper-gold project,DAWN.COM,Not specified,Barrick Mining is delaying its major copper and gold project in Pakistan due to Middle East conflict and security concerns in the region.,https://www.dawn.com/news/amp/1985758,copper production and capacity,copper,2026-03-27T06:08:36.380750
Copper Supply Crunch Intensifies: Impact on Global Renewable Energy Sector,Wedbush Investor,"March 20, 2026","A global copper supply deficit is hindering the transition to carbon-neutral energy, with prices soaring to $12,000-$14,500 per ton due to demand from EVs and power grids. Short-term innovations include copper substitution with aluminum and rare-earth-free motors, while long-term solutions focus on recycling, urban mining, and potential deep-sea mining. Investors should note leverage for major miners like BHP and FCX amid rising costs for renewables.",https://investor.wedbush.com/wedbush/article/marketminute-2026-3-20-copper-supply-crunch-intensifies-impact-on-global-renewable-energy-sector,copper technology innovation sustainability,aluminum,2026-03-27T06:08:44.403779
Economic Survey 2026: World faces copper shortage as AI data centres drive power demand,The Economic Times,"Thursday (recent, 2026)","The Economic Survey warns of an impending global copper shortage driven by surging power demand from AI data centers, turning critical minerals into strategic bottlenecks. Copper prices are volatile due to mine outages in key regions, with massive ore processing required for production, such as 167-200 tons per ton of copper. Trade restrictions exacerbate supply deficits amid growing demand from power sectors worldwide.",https://economictimes.com/industry/indl-goods/svs/metals-mining/economic-survey-2026-world-faces-copper-shortage-as-ai-data-centres-drive-power-demand/articleshow/127770289.cms,copper technology innovation sustainability,copper,2026-03-27T06:08:44.403797
Ten major mining tech trends in 2026: Part 1,IMARC Global,2026,"Innovations in copper mining include reprocessing waste from major mines like El Teniente and Freeport-McMoRan sites to produce significant copper volumes without new mines. Freeport aims for 360,000 tons per annum from sulphide waste using advanced leaching, while Atlantic Copper plans to extract multiple metals from e-waste. Technologies also target up to 78% reduction in water use per ton of copper through innovative flowsheets.",https://imarcglobal.com/news/industry/ten-major-mining-tech-trends-in-2026-part-1,copper technology innovation sustainability,copper,2026-03-27T06:08:44.403805
Copper To Become the Global Economy's Most Critical Asset in 2026,Crux Investor,2026,"Global copper markets face deficits of hundreds of thousands of tons in 2026 due to underinvestment in mines and surging demand from AI data centers, cloud infrastructure, and electrification. Data centers require massive copper for wiring, power systems, and cooling, creating price-inelastic demand amid supply constraints. This shift positions copper as a scarcity premium asset with new consumption categories rivaling traditional uses.",https://www.cruxinvestor.com/posts/copper-to-become-the-global-economys-most-critical-asset-in-2026,copper technology innovation sustainability,copper,2026-03-27T06:08:44.403812
"Nickel prices rose 1.01%, and asphalt surged nearly 50% year-to-date",baonghean.vn,"March 27, 2026 10:31",Nickel prices rose 1.01% during the trading session on March 27. Asphalt prices surged nearly 50% year-to-date. This reflects positive movements in the commodities market.,https://baonghean.vn/en/gia-niken-tang-101-nhua-duong-but-pha-gan-50-tu-dau-nam-trong-phien-ngay-273-10330308.html,nickel prices and market trends,nickel,2026-03-27T06:08:49.035819
"Metals market on March 27: Nickel and tin prices recover, asphalt prices rise strongly",vietnam.vn,"March 27, 2026","On March 27, 2026, nickel prices rose 1.01% to $17,338 per ton, with a weekly increase of 2.65%. This recovery reflects positive expectations in battery and renewable energy sectors. Base metals like aluminum and zinc also saw gains.",https://www.vietnam.vn/en/thi-truong-kim-loai-ngay-27-3-gia-niken-va-thiec-phuc-hoi-nhua-duong-tang-manh,nickel prices and market trends,aluminum,2026-03-27T06:08:49.035832
"Middle East war pressures copper prices, could impact nickel production",S&P Global Market Intelligence,March 2026,"The article examines how Middle East geopolitical tensions and Strait of Hormuz closure are affecting global commodity markets, with particular focus on nickel production. It highlights that PT Weda Bay Nickel's production quota was cut to 12 million wet metric tons for 2026 from 42 million wmt in 2025, and discusses how sulfur supply chain disruptions threaten HPAL operations critical for battery-grade nickel production.",https://www.spglobal.com/market-intelligence/en/news-insights/research/2026/03/middle-east-war-pressures-copper-prices-could-impact-nickel-production,nickel production and capacity,copper,2026-03-27T06:09:00.654617
"AKP to maintain 2026 nickel output after strong 2025 growth, continues infrastructure build-out",Petromindo,"March 27, 2026","PT Adhi Kartiko Pratama Tbk (AKP), a nickel miner, plans to maintain its 2026 nickel output following strong growth in 2025 while continuing infrastructure development.",https://www.petromindo.com/news/article/akp-to-maintain-2026-nickel-output-after-strong-2025-growth-continues-infrastructure-build-out,nickel production and capacity,nickel,2026-03-27T06:09:00.654634
"Metals market on March 27: Nickel and tin prices recover, asphalt prices surge",Vietnam.vn,"March 27, 2026","Global metals markets showed positive developments with nickel prices rising 1.01% to $17,338 per ton and gaining 2.65% on a weekly basis, reflecting positive expectations in battery and renewable energy sectors.",https://www.vietnam.vn/en/thi-truong-kim-loai-ngay-27-3-gia-niken-va-thiec-phuc-hoi-nhua-duong-tang-manh,nickel production and capacity,nickel,2026-03-27T06:09:00.654641
Can nickel prices hit $25000 in 2026?,The Oregon Group,March 2026,"The article analyzes Indonesia's strategic shift from maximizing supply to maximizing value through supply cuts and quota reductions for 2026. It notes that only 55% of Indonesia's approved nickel ore production capacity was utilized in 2025, and discusses how the country is implementing stricter environmental enforcement and banning new NPI smelters.",https://theoregongroup.com/commodities/nickel/can-nickel-prices-hit-25000-in-2026/,nickel production and capacity,nickel,2026-03-27T06:09:00.654649
"INTERVIEW: Nickel Industries to add battery products, grow ore throughput fivefold by 2026",S&P Global Energy,2025,Nickel Industries plans to expand its product mix to include nickel cathode and nickel sulfate while increasing ore extraction to 25 million mt in 2026 from 19 million mt in 2024. The company is commissioning a second mine (Sampala) expected to enter production within 12 months.,https://www.spglobal.com/energy/en/news-research/latest-news/metals/091125-interview-nickel-industries-to-add-battery-products-grow-ore-throughput-fivefold-by-2026-27,nickel production and capacity,copper,2026-03-27T06:09:00.654656
