title,source,date,summary,url,query,category,fetched_at
[SMM Nickel Midday Review] Nickel prices fell sharply on November 14 as concerns over the US Fed's hawkish stance triggered cautious market sentiment,SMM (Shanghai Metals Market),"November 14, 2025","On November 14, the SMM #1 refined nickel price averaged 119,600 yuan/mt, down 1,050 yuan/mt from the previous day. The decline was driven by market caution due to the US Federal Reserve's hawkish stance and uncertainty from divergent Fed officials' views on interest rates, pressuring nickel prices to remain weak in the near term.",https://news.metal.com/newscontent/103621463/%5BSMM-Nickel-Midday-Review%5D-Nickel-prices-fell-sharply-on-November-14-as-concerns-over-the-US-Feds-hawkish-stance-triggered-cautious-market-sentiment,nickel prices and market trends,nickel,2025-11-14T05:15:22.192747
FLASH: Indonesia releases benchmark prices for nickel ore in November Period I,Mysteel,"November 14, 2025","The Indonesia Nickel Miners Association announced benchmark prices for nickel ore for the first half of November 2025, with the reference price set at $15,075.33/wmt, down 0.44% from late October. Prices for various nickel grades also saw slight decreases compared to the previous period.",https://www.mysteel.net/news/5103862-flash-indonesia-releases-benchmark-prices-for-nickel-ore-in-november-period-i,nickel prices and market trends,nickel,2025-11-14T05:15:22.192767
Nickel Price Update: Q3 2025 in Review,Investing News Network,"November 14, 2025","Nickel prices were volatile in the first half of 2025 but stabilized in Q3 amid ongoing oversupply concerns driven mainly by rapid production growth in Indonesia. Despite rising consumption, structural oversupply pressured prices, with a forecast of temporary price support due to seasonal output declines in the Philippines from October to early 2026.",https://investingnews.com/daily/resource-investing/base-metals-investing/nickel-investing/nickel-forecast/,nickel prices and market trends,nickel,2025-11-14T05:15:22.192777
LME nickel holds steady as U.S. government shutdown ends amid persistent market caution,Yieh.com,"November 13, 2025","LME nickel prices remained steady following the end of the U.S. government shutdown, but market caution persists amid uncertain economic conditions. The cautious sentiment continues to influence nickel trading dynamics.",https://yieh.com/en/News/lme-nickel-holds-steady-as-us-government-shutdown-ends-amid-persistent-market-caution/157756,nickel prices and market trends,nickel,2025-11-14T05:15:22.192786
FNI income triples to P1.5B as prices climb,Daily Tribune,"November 11, 2025","Filipino Nickel Industry (FNI) reported a tripling of income to P1.5 billion, driven by a 16.6% revenue increase due to higher average realized nickel ore prices amid strong demand and tight supply conditions.",https://tribune.net.ph/2025/11/11/fni-income-triples-to-p15b-as-prices-climb,nickel prices and market trends,nickel,2025-11-14T05:15:22.192795
'Green' energy transition leaves a dirty trail in the Philippines' nickel belt,Mongabay,"November 4, 2025","Nickel mining in the southern Philippines is causing environmental damage and harming local communities' health and livelihoods. The region's nickel production is concentrated in the Dinagat Islands and Surigao del Sur, with most nickel ore exported to China due to limited local processing capacity. Refined nickel-cobalt sulfide is sent to Japan for further processing into battery-grade nickel used by companies like Panasonic and Toyota.",https://news.mongabay.com/2025/11/green-energy-transition-leaves-a-dirty-trail-in-the-philippines-nickel-belt/,nickel production and capacity,nickel,2025-11-14T05:15:36.195912
Indonesia limits new nickel permits to add value to production,Mining.com,"November 13, 2025","Indonesia, the world's largest nickel producer, has stopped approving new permits for nickel plants producing certain intermediate products without plans for further processing. This move aims to push the industry up the value chain and address oversupply, potentially causing delays or cancellations of new projects. The regulation affects plants finishing after 2027 and emphasizes investment in downstream processing for electric vehicle battery materials.",https://www.mining.com/web/indonesia-limits-new-nickel-permits-to-add-value-to-production/,nickel production and capacity,nickel,2025-11-14T05:15:36.195933
Fathom Nickel expands Gochager Lake footprint,Mining.com.au,"November 13, 2025","Fathom Nickel is advancing exploration at its Gochager Lake Project in Saskatchewan, Canada, aiming to establish a significant nickel district. Recent soil geochemistry and portable x-ray fluorescence results indicate expanding scale, with further assay results expected soon. Winter conditions favor upcoming drilling activities supported by infrastructure development like ice roads.",https://mining.com.au/fathom-nickel-expands-gochager-lake-footprint/,nickel production and capacity,nickel,2025-11-14T05:15:36.195945
"Homeland Nickel Enters Agreement with USA Company, Amplifying Exposure to Strategic Holdings",TheNewswire,"November 13, 2025","Homeland Nickel Inc. announced the formation of Patriot Nickel Corp, a U.S.-based company aimed at building domestic nickel supply in Southern Oregon. Homeland will option key nickel properties to Patriot and receive a 20% equity stake, enhancing shareholder value and aligning with the 'America First' trend in critical mineral supply. The partnership is expected to facilitate regulatory progress and investor interest in the U.S. nickel sector.",https://investingnews.com/homeland-nickel-enters-agreement-with-usa-company-amplifying-exposure-to-strategic-holdings/,nickel production and capacity,nickel,2025-11-14T05:15:36.195956
"On November 14, the price range for SMM #1 refined nickel was",Metal.com,"November 14, 2025","The price range for SMM #1 refined nickel on November 14, 2025, was between 117,400 and 121,800 yuan per metric ton, averaging 119,600 yuan/mt, marking a decrease of 1,050 yuan/mt. This reflects current market pricing trends for refined nickel in China.",https://news.metal.com/newscontent/103621443/,nickel production and capacity,nickel,2025-11-14T05:15:36.195965
Recycling technology achieves 99% purity of nickel and cobalt,TechXplore,November 2025,"A research team from UNIST has developed an innovative electrochemical recycling technology that recovers over 95% of nickel and cobalt from waste batteries with 99% purity. The breakthrough method uses a multifunctional special solvent and selective electrochemical separation, minimizing chemical usage and wastewater production while enabling efficient metal recovery in a single environmentally friendly step.",https://techxplore.com/news/2025-11-recycling-technology-purity-nickel-cobalt.html,nickel technology innovation sustainability,nickel,2025-11-14T05:15:45.178315
New EV battery recycling process recovers 99% pure nickel and cobalt,Interesting Engineering,November 2025,Researchers have developed an eco-friendly recycling technology that extracts 99 percent pure nickel and cobalt from waste batteries. This advancement represents a significant breakthrough in sustainable battery recycling for the electric vehicle industry.,https://interestingengineering.com/energy/recycling-nickel-cobalt-ev-batteries,nickel technology innovation sustainability,nickel,2025-11-14T05:15:45.178331
Canada's Nickel Processing Innovation for Clean Energy,Discovery Alert,2025,"Canadian nickel processing facilities are implementing advanced sustainability innovations including renewable energy integration, closed-loop water systems achieving 85-95% reuse rates, and carbon sequestration technologies. These comprehensive environmental frameworks support net-zero emission processing and circular economy integration through multi-metal recovery and tailings repurposing.",https://discoveryalert.com.au/canada-nickel-processing-revolution-global-clean-energy-2025/,nickel technology innovation sustainability,nickel,2025-11-14T05:15:45.178340
"Italy's Tenaris posts surprise 2% rise in sales on stable US, Canada drilling",Investing.com,"October 29, 2025","Italian steel pipe maker Tenaris reported a 2% increase in third-quarter net sales to $2.98 billion, driven by stable drilling activity in the US and Canada, offsetting weakness in other regions. The company warned that margins will be affected by the full impact of tariff costs, with EU steel producers operating at reduced capacity due to rising imports and tariffs.",https://www.investing.com/news/stock-market-news/italys-tenaris-posts-surprise-2-rise-in-sales-on-stable-us-canada-drilling-4317727,Tenaris news steel italy,steel,2025-11-14T05:16:07.344893
Tenaris Announces 2025 Third Quarter Results,GlobeNewswire,"October 29, 2025","Tenaris reported stable sales of tubular products and services in Q3 2025, supported by steady activity in the US and Canada and some early shipments in the Middle East. Margins held up but have yet to fully reflect recent tariff increases. The company expects Q4 sales to remain close to Q3 levels but anticipates cost and margin pressures from tariffs.",https://www.globenewswire.com/news-release/2025/10/29/3176915/0/en/Tenaris-Announces-2025-Third-Quarter-Results.html,Tenaris news steel italy,general,2025-11-14T05:16:07.344911
Tenaris Launches $600M Second Tranche Under $1.2B Buyback,StockTitan,"November 3, 2025","Tenaris commenced the second tranche of its $1.2 billion share buyback program, with $600 million allocated for purchases between November 3, 2025, and April 30, 2026. Shares bought back will be cancelled. The buyback is authorized by shareholders and complies with EU market abuse regulations.",https://www.stocktitan.net/news/TS/tenaris-to-commence-a-usd-600-million-second-tranche-of-its-usd-1-2-3uvfs8tfk3a1.html,Tenaris news steel italy,general,2025-11-14T05:16:07.344918
Tenaris Announces Second Tranche of USD 600 Million Share Buyback Program,Quiver Quant,"November 2, 2025","Tenaris announced the initiation of the second tranche of its $1.2 billion share buyback program, with a non-discretionary agreement to purchase up to $600 million of shares from November 3, 2025, to April 30, 2026. The shares will be cancelled, and the program is authorized by the May 2025 shareholder meeting. The company highlighted risks related to oil and gas price fluctuations.",https://www.quiverquant.com/news/Tenaris+Announces+Second+Tranche+of+USD+600+Million+Share+Buyback+Program,Tenaris news steel italy,general,2025-11-14T05:16:07.344927
Tenaris discusses maximizing hydrogen storage vessel lifecycle in Tech Talk,Tenaris Official Website,2025 (exact date not specified),"Tenaris released a Tech Talk video discussing the design, maintenance, and long-term performance of steel vessels for hydrogen storage. The video covers factors like fatigue, hydrogen embrittlement, and inspection cycles, emphasizing how Tenaris's proprietary THera® technology supports durable and scalable hydrogen storage solutions.",https://www.tenaris.com/en/news/2025/tenaris-discusses-maximizing-hydrogen-storage-vessel-lifecycle-in-tech-talk,Tenaris news steel italy,steel,2025-11-14T05:16:07.344936
Copper Cables: Antitrust Launches Investigation into Alleged Cartel,First Online,"November 13, 2025","The Italian Antitrust Authority has launched an investigation into major low voltage copper cable manufacturers in Italy, including Prysmian, for alleged price fixing since 2005. Inspections were conducted at company offices and distributors, impacting Prysmian's stock price negatively, though analysts believe the investigation will have negligible impact on Prysmian's overall revenues.",https://www.firstonline.info/en/copper-cables-antitrust-launches-investigation-into-alleged-cartel-prysmian-and-nexans-stock-market-drops/,Prysmian news copper cables italy,copper,2025-11-14T05:16:23.636423
Italian Expertise Fuels Prysmian Innovation,Prysmian Official Website,"November 13, 2025",Prysmian is advancing its R&D activities in Italy with over €5.5 million funding from Italian authorities for projects focused on high-voltage terrestrial and submarine transmission systems and renewable energy integration. The company is also involved in national initiatives like the Green New Deal and the RESTART Extended Partnership to drive innovation in energy and telecommunications.,https://www.prysmian.com/en/media/press-releases/italian-expertise-fuels-prysmian-innovation,Prysmian news copper cables italy,general,2025-11-14T05:16:23.636446
BofA Sees Growth Potential for Prysmian from US Tariffs,Alliance News via MarketScreener,"November 9, 2025","Bank of America projects that US copper tariffs could benefit Prysmian significantly, potentially increasing 2026 EBITDA by up to EUR1 billion due to Prysmian's US-based copper cable production and local sourcing. The tariffs may allow Prysmian to raise copper cable prices by 10%, with positive effects especially in medium- and low-voltage segments.",https://ae.marketscreener.com/news/bofa-sees-growth-potential-for-prysmian-from-us-tariffs-ce7d59dddf88f323,Prysmian news copper cables italy,copper,2025-11-14T05:16:23.636455
World's Top Cable Maker Sees US Copper Tariff as Opportunity,Mining.com,"No specific date in past 24 hours, recent","Prysmian, the world's largest copper cable maker, views the US copper tariff as an opportunity to strengthen its local supply chain and competitive position. The company benefits from sourcing copper domestically and is in close contact with US authorities regarding the tariff implementation.",https://www.mining.com/web/worlds-top-cable-maker-sees-us-copper-tariff-as-opportunity/,Prysmian news copper cables italy,copper,2025-11-14T05:16:23.636461
