title,source,date,summary,url,query,category,fetched_at
Aluminum - Price - Chart - Historical Data - News,Trading Economics,"December 28, 2025","Aluminum prices rose to 2,956.95 USD/T on December 24, 2025, up 0.32% from the previous day, with a 5.16% increase over the past month and 15.51% year-over-year. UK aluminum futures reached $2,950 per tonne in December, near three-year highs amid low supply concerns. China prioritizes preventing overcapacity to curb deflationary pressures.",https://tradingeconomics.com/commodity/aluminum,aluminum prices and market trends,aluminum,2025-12-29T05:22:36.016825
Aluminum Rises to 3½-Year Highs,Trading Economics,2025-12-22,"Aluminum futures climbed toward $2,970 per tonne, the highest since May 2022, following South32's announcement to place its Mozal smelter under care and maintenance by March 2026 due to power issues. Supply tightens with disruptions at Iceland’s Grundartangi smelter and declining Japanese inventories. Prices have risen nearly 17% this year, supported by China's output cap.",https://tradingeconomics.com/commodity/aluminum/news/511743,aluminum prices and market trends,aluminum,2025-12-29T05:22:36.016844
"Copper, Aluminium Prices Gain on Supply Concerns Amid Mixed U.S. Data",IndexBox,"December 17, 2025","Aluminum prices rose with Shanghai gaining 0.55% to 21,915 yuan per ton and London benchmark up 0.26% to $2,884 a ton, driven by South32's Mozal smelter shutdown. Analysts expect low global inventories and further upside next year. This occurs amid broader metal market movements and supply concerns.",https://www.indexbox.io/blog/copper-aluminium-prices-gain-on-supply-concerns-amid-mixed-us-data/,aluminum prices and market trends,aluminum,2025-12-29T05:22:36.016854
Novelis Wins German Ecodesign Award for Recycled Aluminium Automotive Sheet,PR Newswire,"December 2, 2025","Novelis received the German Ecodesign Award for a production-ready aluminium alloy made using 100% recycled end-of-life automotive scrap, demonstrating technically and economically feasible car-to-car aluminium recycling and advancing its Novelis 3x30 circularity strategy. The company says the innovation can significantly reduce CO₂ emissions compared with primary aluminium by leveraging closed-loop recycling and higher shares of end-of-life material in automotive alloys.",https://www.prnewswire.com/news-releases/novelis-wins-german-ecodesign-award-for-recycled-aluminium-automotive-sheet-302630683.html,aluminum technology innovation sustainability,aluminum,2025-12-29T05:22:51.414758
"Market trends, policy signals and innovation together suggest a recalibration within the global aluminium downstream industry",ALCircle,December 2025,"ALCircle's industry roundup highlights leadership, policy and innovation shaping the aluminium downstream sector ahead of 2026, and reports on several technology developments including Nagoya University researchers' new aluminium alloys that retain strength at high temperatures and are highly recyclable and suitable for metal 3D printing. The piece frames these innovations alongside policy tools such as CBAM and market signals affecting downstream competitiveness and decarbonisation.",https://www.alcircle.com/news/market-trends-policy-signals-and-innovation-together-suggest-a-recalibration-within-the-global-aluminium-downstream-industry-116723,aluminum technology innovation sustainability,aluminum,2025-12-29T05:22:51.414778
Aluminum-air long-duration generation technology selected by Net Zero Innovation Hub for Data Centers,Net Zero Data Centers (press),December 2025,"The Net Zero Innovation Hub for Data Centers selected aluminium-air long-duration generation technology (from Phinergy) for a funded project to scale clean backup energy systems to MW-level and deploy them in live data centers, aiming to replace diesel generators and accelerate net-zero operations. The announcement positions aluminium-air systems as a promising clean backup energy option for sustainable digital infrastructure.",https://www.netzerodatacenters.com/aluminum-air-long-duration-generation-technology-selected-by-net-zero-innovation-hub-for-data-centers-for-groundbreaking-clean-backup-energy-initiative-in-data-centers,aluminum technology innovation sustainability,aluminum,2025-12-29T05:22:51.414783
"Alcoa, Ball and Unilever pilot 'carbon-free' smelting technology in personal and home care packaging",Packaging Europe,2025 (December),"Alcoa, Ball and Unilever are piloting the Elysis carbon-free smelting technology to produce aluminium for personal and home care packaging, advancing efforts to decarbonise primary aluminium production by eliminating direct carbon emissions from the smelting process. The pilot represents collaboration between major producers and end-users to test low-carbon supply chain solutions for packaging.",https://packagingeurope.com/news/alcoa-ball-and-unilever-pilot-carbon-free-smelting-technology-in-personal-and-home-care-packaging/13602.article,aluminum technology innovation sustainability,aluminum,2025-12-29T05:22:51.414787
Steel industry urges FBR to seek advance tax guarantees on duty-free Chinese imports via Sost,Profit Pakistan Today,"December 29, 2025",Pakistan's steel producers have urged the Federal Board of Revenue to require advance tax guarantees from importers of duty-free Chinese steel products via the Sost Dry Port to prevent diversion to taxable areas. The industry highlights Pakistan's surplus steel production capacity and opposes tax exemptions on finished steel goods. They suggest limiting exemptions to raw materials or scrap to protect local production.,https://profit.pakistantoday.com.pk/2025/12/29/steel-industry-urges-fbr-to-seek-advance-tax-guarantees-on-duty-free-chinese-imports-via-sost/,steel production and capacity,steel,2025-12-29T05:23:00.026967
"Business sentiment for January pessimistic over slump in construction, steel sectors: Poll",Korea JoongAng Daily,"December 29, 2025","South Korea's business sentiment index for January signals pessimism, particularly in the steel and construction sectors, with the steel sector reading at 85.2 below the 100 benchmark. The Federation of Korean Industries attributes the slump to weak performance dragging down related industries like metal processing. Experts call for government support in restructuring steel and reducing financial burdens on raw materials.",https://koreajoongangdaily.joins.com/news/2025-12-29/business/economy/Business-sentiment-for-January-pessimistic-over-slump-in-construction-steel-sectors-Poll/2488134,steel production and capacity,steel,2025-12-29T05:23:00.026979
Technological Innovation Leads the Global Steel Industry into a Low-Carbon Era,Sumec Metal,2025-12-29T05:23:05.223457,"The 2025 global steel industry is driven by technological innovations promoting low-carbon, intelligent, and high-end development. Key advancements include Ansteel’s world-first green electricity and green hydrogen fluidized bed hydrogen metallurgy pilot line, achieving 95% metallization with near-zero carbon emissions, and Shougang’s selection as a global Lighthouse Factory. These technologies address high emissions and energy consumption, fostering green transformation and high-quality industry growth.",https://www.sumecmetal.com/news/global-steel-industry-new-era/,steel technology innovation sustainability,steel,2025-12-29T05:23:05.223450
"Reflecting on 2025: Circularity, Sustainability and Transformation for Steel Manufacturing",NZ Manufacturer,2025-12,"As 2025 ends, New Zealand's steel manufacturing sector highlights progress in circularity and sustainability, led by the announcement of an Electric Arc Furnace (EAF) at New Zealand Steel for lower-carbon production from recycled scrap. Initiatives include digital material passports for lifecycle traceability to enhance reuse and recycling, alongside the development of a national hub for advanced manufacturing and circular innovation in a 6-star greenstar building. These efforts demonstrate steel's role in sustainable construction with over 50% carbon emission reductions through design and material choices.",https://nzmanufacturer.co.nz/2025/12/reflecting-on-2025-circularity-sustainability-and-transformation-for-steel-manufacturing/,steel technology innovation sustainability,steel,2025-12-29T05:23:05.223466
"Copper surges to record near $13,000 in London after a 7% jump",CNBC TV18,"Dec 26, 2025","Copper prices on the London Metal Exchange surged nearly 7% to an all-time high near $13,000 per tonne after reopening following a two-day hiatus. The metal hit as high as $12,960 per tonne, driven by expectations of massive flows to the US leaving global shortages. Aluminium and zinc also rose by 0.6% and 0.9% respectively.",https://www.cnbctv18.com/market/commodities/copper-surges-to-record-near-13000-in-london-after-a-7-jump-19805731.htm,copper prices and market trends,aluminum,2025-12-29T05:23:33.245393
"Copper Price Rally Nears All-Time High of $12,000 a Ton in 2025",IndexBox,2025-12-29T05:23:33.245411,"Copper prices edged towards $12,000 a ton on the London Metal Exchange, up 0.4% amid supply setbacks and tariff-related trade issues fueling a rally. The metal is on track for its largest annual gain since 2009, with prices up 37% this year due to US-bound flows draining global inventories. Analysts note rising prices driven by sentiment despite soft demand.",https://www.indexbox.io/blog/copper-nears-12000-a-ton-approaching-all-time-high-in-2025-rally/,copper prices and market trends,copper,2025-12-29T05:23:33.245409
"Copper Prices, Charts, Analysis & Forecast | SMM Metals Market",Metal.com,"Dec 29, 2025","Copper prices have surged strongly since mid-September 2025, repeatedly hitting record highs, with SHFE.CU2602 at CNY/mt 101,380. High-grade copper traded around USD 12,316.7 per mt as of Dec 26. Rising prices are driving up motor costs and supply chain pressures.",https://www.metal.com/Copper,copper prices and market trends,copper,2025-12-29T05:23:33.245419
Copper prices hit record as investors bet on tighter times coming ...,Taipei Times,2025/12/29,"Copper prices hit records in Shanghai and rallied in New York, with Shanghai futures nearing 100,000 yuan per tonne and Comex up 5.6% to $5.8075 a pound. Investors anticipate tighter global supplies next year amid a weaker US dollar and energy transition demand. The rally caps a 42% yearly gain for copper.",https://www.taipeitimes.com/News/biz/archives/2025/12/29/2003849659,copper prices and market trends,copper,2025-12-29T05:23:33.245425
Copper on fire: Why prices are at record highs and what's next,Economic Times,2025-12-29T05:23:33.245433,"Copper prices reached record highs in late 2025, driven by US Federal Reserve easing, trade policy arbitrage, supply disruptions, and demand from electrification and AI. A persistent deficit is expected, with India's strong domestic demand contributing to record local prices. The surge reflects robust global industrial trends.",https://economictimes.com/markets/commodities/views/copper-on-fire-why-prices-are-at-record-highs-and-whats-next/articleshow/126224498.cms,copper prices and market trends,copper,2025-12-29T05:23:33.245432
"DRC Suspends Handmade Copper Business, SHFE Copper Rose Sharply Last Friday [SMM Copper Morning Meeting Minutes]",Metal News (SMM),"Monday, December 29, 2025","The Democratic Republic of Congo ordered a suspension of all manual copper and cobalt processing operations pending proof of legal and traceable ore sources, a move likely to disrupt local small- and medium-sized processors and tighten supply chains. Shanghai Futures Exchange (SHFE) copper prices rose sharply, with trading volumes increasing and spot premiums weakening ahead of the New Year holiday.[1]",https://news.metal.com/newscontent/103693872/DRC-Suspends-Handmade-Copper-Business-SHFE-Copper-Rose-Sharply-Last-Friday-%5BSMM-Copper-Morning-Meeting-Minutes%5D,copper production and capacity,copper,2025-12-29T05:23:50.545963
"Copper hits US$12,000 for first time as tariff trade upends market",Financial Post,December 2025,"Copper rose above US$12,000 a tonne amid mine outages, trade dislocations and falling inventories, driving one of the largest annual gains since 2009 and prompting warnings of a potential major supply deficit next year. Several large projects suffered setbacks (including Kamoa-Kakula and Codelco operations), and banks warn of tightening markets that could push prices higher.[2]",https://financialpost.com/commodities/mining/copper-hits-12000,copper production and capacity,copper,2025-12-29T05:23:50.545978
Trigon exits battle via Kombat Mine sale,Mining.com.au,"29 December, 2025","Trigon Resources sold the Kombat copper mine as part of exiting a long-running dispute, in a market environment where copper futures have climbed to multi-month highs driven by supply concerns and strong demand. The article notes recent copper futures around US$5.48–5.50 per pound and situates the transaction amid broader market strength.[3]",https://mining.com.au/trigon-exits-battle-via-kombat-mine-sale/,copper production and capacity,copper,2025-12-29T05:23:50.545990
Copper Hits Five-Month Peak; Prices Rise on Tight Supply and Strong Demand,Trading Economics (news summary),"Dec 26, 2025","Copper futures hit five-month highs (around $5.7 per pound) as tight supply, robust US economic activity and structural demand from EVs, renewables and AI infrastructure underpinned prices; the page also reports recent national production figures for Chile and Peru. The report highlights inventory pressures and continued price appreciation through late December.[4]",https://tradingeconomics.com/commodity/copper,copper production and capacity,copper,2025-12-29T05:23:50.545997
Copper prices hit record as investors bet on tighter times coming,Taipei Times,"December 29, 2025","Shanghai and New York copper prices surged to record or near-record levels as investors priced in tighter global supplies next year, aided by a weaker US dollar and large annual gains; the piece links price strength to trade dislocations and the energy transition boosting long-term demand. The article reports SHFE copper trading near 100,000 yuan/tonne and Comex copper reaching intraday highs above $5.80/lb.[5]",https://www.taipeitimes.com/News/biz/archives/2025/12/29/2003849659,copper production and capacity,copper,2025-12-29T05:23:50.546004
Copper on fire: Why prices are at record highs and what's next,Economic Times (Analysis),Late December 2025,"An analysis of record-high copper prices attributes the rally to a combination of Federal Reserve easing expectations, trade policy arbitrage, major supply disruptions and rising demand from electrification and AI. The piece discusses outlooks from major banks and the potential for persistent deficits supporting further price gains.[6]",https://economictimes.com/markets/commodities/views/copper-on-fire-why-prices-are-at-record-highs-and-whats-next/articleshow/126224498.cms,copper production and capacity,copper,2025-12-29T05:23:50.546011
Can the sizzling rally in ASX 200 copper stocks boost BHP shares in 2026?,The Motley Fool Australia,"December 29, 2025","The article examines how the rally in copper is benefiting ASX-listed miners and notes BHP's record FY25 copper production of 2,017 kt, driven by stronger performances across operated assets and projects that could deliver ~2 Mtpa of attributable copper production during the 2030s. It contextualizes producer-level capacity increases amid the broader market rally.[7]",https://www.fool.com.au/2025/12/29/can-the-sizzling-rally-in-asx-200-copper-stocks-boost-bhp-shares-in-2026/,copper production and capacity,copper,2025-12-29T05:23:50.546017
Nickel Futures Rebound as Indonesia Signals Output Cuts for 2026,Trading Economics,"December 2025 (report referencing December 29, 2025)","Nickel futures rose to around $15,200 per tonne, the highest in nearly two months, after Indonesia signalled a large reduction in planned nickel output for 2026 which could tighten supply and support prices; analysts noted Indonesia accounts for a large share of the global surplus and that proposed policy changes to ore pricing and royalties may further restrict exports and byproduct flows.",https://tradingeconomics.com/commodity/nickel/news/511782,nickel prices and market trends,nickel,2025-12-29T05:24:12.000088
"On December 29, the SMM #1 refined nickel price was ...",Metal News (SMM),"December 29, 2025","Shanghai Metals Market reported the SMM #1 refined nickel price range and an average price for December 29, 2025, showing an intraday rise (average price 131,700 yuan/mt, up 2,000 yuan/mt from the prior period), reflecting local refined-nickel market moves amid supply tightness in Indonesia and year-end dynamics.",https://news.metal.com/newscontent/103694778/,nickel prices and market trends,nickel,2025-12-29T05:24:12.000107
SMM Nickel Flash — December 29: Indonesia’s ore market remains tight as 2025 closes,Metal News (SMM),"December 29, 2025","A rapid market note summarised December 29 developments, stating Indonesia's nickel ore market remains structurally tight and describing downward price pressure from weak demand in some segments while noting policy and supply shifts that could alter near-term balances.",https://news.metal.com/newscontent/103694014,nickel prices and market trends,nickel,2025-12-29T05:24:12.000122
Viewpoint: Indonesia's MHP surge to hit nickel prices,Argus Media,2025 (analysis referencing 2025 market trends),"Argus analysts argued that nickel prices will likely stay depressed in the low-$15,000s per tonne in 2026 as supply expansion outpaces demand, with Indonesia’s mixed high-phosphate (MHP) output dynamics and a cooling EV demand growth cited as key factors weighing on prices despite intermittent tightness.",https://www.argusmedia.com/en/news-and-insights/latest-market-news/2767821-viewpoint-indonesia-s-mhp-surge-to-hit-nickel-prices,nickel prices and market trends,nickel,2025-12-29T05:24:12.000135
Nickel inches down ahead of Fed's decision,Economies.com,December 2025 (market note),"A market brief reported nickel edging lower amid a firmer US dollar and a bearish research outlook from a major US bank projecting lower metal prices into 2026, noting macro drivers (FX and rate expectations) and analyst forecasts that contributed to near-term softening in nickel prices.",https://www.economies.com/commodities/steel-news/nickel-inches-down-ahead-of-feds-decision-47634,nickel prices and market trends,nickel,2025-12-29T05:24:12.000145
