title,source,date,summary,url,query,category,fetched_at
Talon Metals Completes Previously Announced Acquisition of Lundin Mining's Eagle Mine and Humboldt Mill Operations Creating a Multi-Asset U.S. Nickel-Copper Company,Talon Metals,"December 18, 2025 (transaction close referenced)","Talon Metals completed its acquisition of Lundin Mining's Eagle Mine and Humboldt Mill, the only primary nickel mine operating in the U.S., creating a multi-asset nickel-copper company. The deal positions Talon to extend Eagle Mine's life, accelerate exploration, and advance the Tamarack Nickel-Copper-Cobalt Project. This supports U.S. critical minerals self-sufficiency with high-grade assets in Michigan and Minnesota.",https://talonmetals.com/talon-metals-completes-previously-announced-acquisition-of-lundin-minings-eagle-mine-and-humboldt-mill-operations-creating-a-multi-asset-u-s-nickel-copper-company/,nickel production and capacity,copper,2026-01-27T05:22:00.243589
SPC Nickel sharpens Muskox drill targeting,Mining.com.au,2026-01-27T05:22:00.243602,"SPC Nickel’s mobile magnetotelluric survey at the Muskox Project in Nunavut identified a 27km conductive horizon and multiple high-conductivity anomalies prospective for copper-nickel-PGM sulphide mineralization. These targets, open at depth, enhance subsurface understanding and prioritize drill testing for 2026. The project covers 496km² of greenfield polymetallic assets.",https://mining.com.au/spc-nickel-sharpens-muskox-drill-targeting/,nickel production and capacity,copper,2026-01-27T05:22:00.243600
"Indonesia cuts 2026 nickel quota, global prices jump immediately",IDN Financials,2026-01-27T05:22:00.243611,"Indonesia reduced its 2026 nickel production quota, immediately fueling global supply concerns and driving up nickel prices. This policy shift aims to support higher prices amid Indonesia's dominant production role.",https://www.idnfinancials.com/news/60514/indonesia-cuts-2026-nickel-quota-global-prices-jump-immediately,nickel production and capacity,nickel,2026-01-27T05:22:00.243609
Indonesia Nickel Production Limits Drive Market Rally,Discovery Alert,January 2026,"Indonesia's nickel production limits propelled prices to $18,905 per ton by January 2026, a 32.7% increase over six weeks. The restrictions address oversupply perceptions and tighten physical balances.",https://discoveryalert.com.au/nickel-market-indonesia-production-limits-2026/,nickel production and capacity,nickel,2026-01-27T05:22:00.243618
"INTERVIEW: Nickel Industries to add battery products, grow ore throughput fivefold by 2026-27",S&P Global,2026-01-27T05:22:06.838695,"Nickel Industries plans to expand its product mix to include nickel cathode and sulfate for EV batteries, alongside growing ore output to 25 million mt in 2026 from 19 million mt in 2024. The company is commissioning a new HPAL plant and second mine to boost mixed hydroxide precipitate and cobalt production. This positions them to capitalize on growing demand for battery-grade nickel from major manufacturers like CATL.",https://www.spglobal.com/energy/en/news-research/latest-news/metals/091125-interview-nickel-industries-to-add-battery-products-grow-ore-throughput-fivefold-by-2026-27,nickel technology innovation sustainability,copper,2026-01-27T05:22:06.838685
Greener method recovers critical metals from spent batteries,TechXplore,January 2026,"Researchers at Monash University developed a sustainable method using deep eutectic solvents to recover over 95% of high-purity nickel, cobalt, manganese, and lithium from spent lithium-ion batteries, including complex black mass. This greener alternative avoids high temperatures and hazardous chemicals, promoting a circular economy for critical metals. The process shows promise for industrial-scale recycling and reducing environmental impact from battery waste.",https://techxplore.com/news/2026-01-greener-method-recovers-critical-metals.html,nickel technology innovation sustainability,nickel,2026-01-27T05:22:06.838706
"Can nickel prices hit $25,000 in 2026?",The Oregon Group,Early January 2026,"Nickel prices surged to $16,500–$18,500 per ton in early January 2026 amid discussions of potential rallies to $25,000, driven by EV demand despite supply from Indonesia. The article highlights the strategic importance of high-grade, low-carbon nickel sulphide projects like Canada Nickel's Crawford in Ontario for secure supply chains. Indonesia's focus on onshore processing and rising costs may support higher prices for non-Indonesian sources.",https://theoregongroup.substack.com/p/can-nickel-prices-hit-25000-in-2026,nickel technology innovation sustainability,nickel,2026-01-27T05:22:06.838721
Indonesia's massive captive coal plans are putting climate targets and economy at risk: study,Eco-Business,2026-01-27T05:22:06.838732,"Indonesia's captive coal capacity for nickel processing has tripled to 31 GW since 2023, risking climate goals, public health, and economic stability. This growth powers nickel smelters critical for EV batteries but emits toxic pollution, potentially causing 27,000 air pollution deaths and $20 billion in costs. Studies warn of environmental degradation eroding economic gains in nickel hubs by 2030.",https://www.eco-business.com/news/indonesias-massive-captive-coal-plans-are-putting-climate-targets-and-economy-at-risk-study/,nickel technology innovation sustainability,nickel,2026-01-27T05:22:06.838731
Challenges and opportunities of the EU battery and raw materials industries,Public Affairs Bruxelles,January 27,"An event on January 27 discusses EU strategies for a domestic EV battery value chain, emphasizing nickel and other raw materials for sustainability and reducing China dependency. Speakers from the Nickel Institute highlight opportunities in battery recycling and secure supply chains via initiatives like RESourceEU. The focus is on metals' role in green mobility and the twin transition.",https://www.pubaffairsbruxelles.eu/event/challenges-and-opportunities-of-the-eu-battery-and-raw-materials-industries-january-27/,nickel technology innovation sustainability,nickel,2026-01-27T05:22:06.838741
PRYSMIAN TO ACQUIRE SUBMARINE CABLE SURVEY & INSTALLATION SOLUTIONS LEADER ACSM,Prysmian,"January 23, 2026","Prysmian plans to acquire Spain-based ACSM, a submarine cable installation company, for €169 million ($198 million). The acquisition will bring subsea surveying, seabed preparation, and installation capabilities in-house, with the transaction expected to close by February.",https://www.prysmian.com/en,Prysmian news copper cables italy,general,2026-01-27T05:22:20.940797
"Prysmian, Versalis Launch Chemical Recycling Chain for Plastic Cable Waste in Italy",ESG News,Not specified,"Prysmian and Versalis have established a strategic partnership for chemical recycling of plastic cable insulation. The pilot project will begin in Italy in the second half of 2026, using Versalis's Hoop® technology to recover up to 60% of difficult-to-recycle XLPE insulation.",https://esgnews.com/prysmian-versalis-launch-chemical-recycling-chain-for-plastic-cable-waste-in-italy/,Prysmian news copper cables italy,general,2026-01-27T05:22:20.940817
AGCM Inspection,Prysmian,Not specified,The Italian Competition Authority (AGCM) conducted an inspection at Prysmian's Italian subsidiary regarding a possible anti-competitive arrangement involving price coordination and commercial sales conditions in the Italian low-voltage copper cable market.,https://www.prysmian.com/en/media/press-releases/agcm-inspection,Prysmian news copper cables italy,copper,2026-01-27T05:22:20.940826
