title,source,date,summary,url,query,category,fetched_at
Torchlight and Innovation Mining Unite as RZOLV Technologies,Newsfile Corp.,"October 23, 2025","Torchlight Innovations Inc. has merged with Innovation Mining to form RZOLV Technologies, marking a significant step in clean-technology mining. RZOLV offers a non-toxic, water-based process as an alternative to cyanide and smelting, reducing environmental impact. The company has commenced trading on the TSX Venture Exchange.",https://www.barchart.com/story/news/35649525/torchlight-and-innovation-mining-unite-as-rzolv-technologies-on-the-tsxv-with-disruptive-new-mining-technology,copper technology innovation sustainability,general,2025-10-24T05:14:50.593819
Copper Ore Concentrate & Refining Process: Top Innovations,Farmonaut,Recent,"The copper industry is adopting advanced technologies like AI monitoring, satellite imaging, and closed-loop systems to enhance sustainability and efficiency. Innovations include bioleaching for low-grade ores and blockchain for traceability. These advancements aim to reduce environmental impact while improving operational efficiency.",https://farmonaut.com/mining/copper-ore-concentrate-refining-process-top-innovations,copper technology innovation sustainability,copper,2025-10-24T05:14:50.593830
Robert Friedland Warns of Copper Crisis,Canadian Mining Journal,October 2025,"Robert Friedland has warned that the global economy faces a copper crisis due to accelerating demand that may outstrip supply within two decades. Copper is crucial for economic growth and national security, but current prices are insufficient to justify new mine developments. Friedland suggests that copper prices need to reach $15,000 per tonne to stimulate production.",https://www.canadianminingjournal.com/news/robert-friedland-says-global-economy-faces-copper-crisis/,copper technology innovation sustainability,copper,2025-10-24T05:14:50.593839
"LME nickel prices rebound on Oct 24, boosted by higher demand in China",Yieh.com,"October 24, 2025","LME nickel futures prices rebounded on October 24, closing at US$22,248/ton, up by US$299. The spot price also rose by US$302, reaching US$22,151/ton, driven by increased demand in China.",https://yieh.com/en/News/lme-nickel-prices-rebound-on-oct-24-boosted-by-higher-demand-in-china/137254,nickel prices and market trends,nickel,2025-10-24T05:15:05.181591
Nickel Futures Fall to Over 1-Month Low Amid Oversupply from Indonesia,Trading Economics,"October 24, 2025","Nickel prices fell to around $15,241 per tonne on October 24, down 0.61% from the previous day, with futures dropping below $15,100 per tonne—the lowest in over a month. The decline is attributed to oversupply from Indonesia, which has pushed LME inventories to a record high of 308,000 tons.",https://tradingeconomics.com/commodity/nickel,nickel prices and market trends,nickel,2025-10-24T05:15:05.181613
[SMM Nickel Daily Review] Nickel Prices Rebounded on October 24 as the Fourth Plenary Session Sent Positive Signals,Metal.com,"October 24, 2025","On October 24, the SMM #1 refined nickel price averaged 122,900 yuan/mt, up 750 yuan/mt from the previous day. The rebound in nickel prices was influenced by positive signals from the Fourth Plenary Session.",https://news.metal.com/newscontent/103586265/%5BSMM-Nickel-Daily-Review%5D-Nickel-Prices-Rebounded-on-October-24-as-the-Fourth-Plenary-Session-Sent-Positive-Signals,nickel prices and market trends,nickel,2025-10-24T05:15:05.181621
Nickel Price Collapse Forces Market Repricing as Oversupply and Weak Demand Challenge Producers,Crux Investor,October 2025,"Nickel prices collapsed to approximately US$15,000 per tonne in mid-2025 due to oversupply and weak demand. Additional pressures include US dollar strength and tariffs on imports from major producers like Indonesia and Russia, causing supply chain realignment and pricing bifurcation.",https://www.cruxinvestor.com/posts/nickel-price-collapse-forces-market-repricing-as-oversupply-weak-demand-challenge-producers,nickel prices and market trends,nickel,2025-10-24T05:15:05.181629
"Philippines poised to gain as nickel steadies, gold peaks in 2026",Philstar,"October 24, 2025","Nickel prices are expected to remain subdued in the near term before recovering later in the decade. The Philippines is positioned to benefit from this trend, while gold prices are projected to reach record highs in 2026.",https://www.philstar.com/business/2025/10/24/2482003/philippines-poised-gain-nickel-steadies-gold-peaks-2026,nickel prices and market trends,nickel,2025-10-24T05:15:05.181636
Russia's Nornickel maintains 2025 nickel production forecast,Reuters,2025-10-23,"Nornickel reaffirmed its nickel production forecast for 2025 at 196,000 to 204,000 tons despite challenges from equipment modernization and import substitution programs. The company reported an 18% increase in nickel production in Q3 compared to Q2, attributing earlier declines to a transition to new mining equipment and seasonal port disruptions.",https://energynews.oedigital.com/mineral-resources/2025/10/23/russias-nornickel-maintains-2025-nickel-production-forecast,nickel production and capacity,nickel,2025-10-24T05:15:32.904372
Nornickel Nickel Production Forecast: 196-204K Tons 2025,Discovery Alert,2025-10-23,"Nornickel confirmed its 2025 nickel production target of 196,000 to 204,000 metric tons amid ongoing equipment modernization challenges. The company is undergoing a gradual replacement of Western mining equipment to ensure operational independence, causing temporary production adjustments but expected to improve long-term efficiency.",https://discoveryalert.com.au/news/nornickel-2025-production-outlook-market-confidence/,nickel production and capacity,nickel,2025-10-24T05:15:32.904389
SPC Nickel evaluates Lockerby East's potential,Mining.com.au,2025-10-24,"SPC Nickel has started a 1,000m diamond drilling program at the Lockerby East Project in Ontario, Canada, to assess potential new nickel-copper-platinum group metals discoveries. The project targets high-quality Sudbury-style massive sulphide mineralization with promising grades and proximity to past producing mines.",https://mining.com.au/spc-nickel-evaluates-lockerby-easts-potential/,nickel production and capacity,copper,2025-10-24T05:15:32.904397
"Philippines poised to gain as nickel steadies, gold peaks in 2026",Philstar,2025-10-24,"Nickel prices are expected to remain subdued in the near term but recover later in the decade, positioning the Philippines to benefit from steady nickel production. The outlook also notes gold prices are projected to reach record highs in 2026.",https://www.philstar.com/business/2025/10/24/2482003/philippines-poised-gain-nickel-steadies-gold-peaks-2026,nickel production and capacity,nickel,2025-10-24T05:15:32.904404
"Vale Indonesia (INCO) Targets 71,234 Tons of Nickel Production in 2025",Djakarta Mining Club,2025-10-23,"Vale Indonesia aims to produce approximately 71,234 tons of nickel-in-matte in 2025, exceeding its 2024 target. This production increase reflects the company's growth plans in the nickel sector.",https://www.djakarta-miningclub.com/news/vale-indonesia-inco-targets-71234-tons-of-nickel-production-in-2025,nickel production and capacity,nickel,2025-10-24T05:15:32.904411
Unleashing sustainable nickel production for a net zero future,Innovation News Network,"October 24, 2025","This article explores how optimizing nickel production, particularly through High Pressure Acid Leaching (HPAL), can reduce environmental impact and carbon footprint, supporting a sustainable battery industry globally. It highlights efforts in pollution prevention, biodiversity conservation, energy efficiency, and supply chain transparency to improve nickel production sustainability.",https://www.innovationnewsnetwork.com/unleashing-sustainable-nickel-production-for-a-net-zero-future/34671/,nickel technology innovation sustainability,nickel,2025-10-24T05:15:59.842294
Nickel Supply Woes: Innovations Steering a Sustainable EV Future,Carbon Credits,"October 24, 2025","The article discusses trends in battery technology emphasizing nickel's role and strategies to manage nickel demand sustainably. It covers material innovation like low-nickel batteries, battery recycling to create a circular economy, and boosting domestic battery production and mining capacities supported by financial incentives such as the U.S. Inflation Reduction Act.",https://carboncredits.com/nickel-supply-woes-innovations-steering-a-sustainable-ev-future-aemc/,nickel technology innovation sustainability,nickel,2025-10-24T05:15:59.842315
Nornickel Nickel Production Forecast: 196-204K Tons 2025,Discovery Alert,"October 24, 2025","Nornickel maintains its 2025 nickel production forecast despite equipment modernization challenges, signaling confidence in operational stability amid growing demand for battery metals. The company is undergoing a transition to domestic mining equipment to improve long-term efficiency and reduce reliance on Western suppliers.",https://discoveryalert.com.au/news/nornickel-2025-production-outlook-market-confidence/,nickel technology innovation sustainability,nickel,2025-10-24T05:15:59.842325
US and Australia Launch Critical Minerals Partnership for 2025,Discovery Alert,"October 24, 2025","The US and Australia have formed a $1 billion partnership to enhance critical minerals supply chains, focusing on increasing battery material recycling efficiency to 40% by 2030 and advancing circular economy principles. The partnership also targets market transparency, fair trading practices, and innovation in alternative materials to reduce supply risks.",https://discoveryalert.com.au/news/us-australia-critical-minerals-partnership-2025-2/,nickel technology innovation sustainability,general,2025-10-24T05:15:59.842335
Powering the future: advances in nickel-based batteries,Nickel Institute,October 2025,"This article highlights recent technological advances in nickel-based lithium-ion batteries, including increased nickel content in NMC cathodes and the adoption of the 4680 battery format. These innovations improve energy density and vehicle range, reinforcing nickel's critical role in electric vehicle battery development.",https://nickelinstitute.org/en/blog/2024/october/powering-the-future-advances-in-nickel-based-batteries/,nickel technology innovation sustainability,copper,2025-10-24T05:15:59.842344
New Technology Set to Revolutionize Nickel Pollution Cleanup,Albanian Minerals,"October 24, 2025","A new technology has been developed to significantly improve nickel pollution cleanup, aiming to enhance environmental protection related to nickel mining and processing. This innovation supports cleaner air and water by addressing nickel contamination more effectively.",https://albanian-minerals.com/new-technology-set-to-revolutionize-nickel-pollution-cleanup/,nickel technology innovation sustainability,nickel,2025-10-24T05:15:59.842352
Cogne Acciai Speciali Launches Pilot Phase of Green Hydrogen Project,SteelOrbis,Recent,"Cogne Acciai Speciali has launched the pilot phase of its green hydrogen project in Aosta, Italy. The project aims to reduce carbon emissions by using electrolysis to produce green hydrogen. The project is supported by funding from Italy's National Recovery and Resilience Plan.",https://www.steelorbis.com/steel-news/latest-news/cogne-acciai-speciali-launches-pilot-phase-of-green-hydrogen-project-1410354.htm,Cogne Acciai Speciali news aluminum steel italy,general,2025-10-24T05:16:05.728633
Cogne Acciai Speciali to Benefit from Enhanced Energy Performance,Cogne Acciai Speciali Press Release,Recent,Cogne Acciai Speciali will enhance its energy performance and reduce environmental impact through a Memorandum of Understanding with CVA. This agreement supports regional decarbonization targets and improves economic competitiveness.,https://www.cogne.com/en/post/press-release-24,Cogne Acciai Speciali news aluminum steel italy,general,2025-10-24T05:16:05.728649
Continuous Casting Machine Modernization at Cogne Acciai Speciali,Marketscreener,Recent,"Cogne Acciai Speciali has contracted Danieli Service for a modernization project at its works in Aosta, Italy. The project focuses on modernizing a continuous casting machine.",https://uk.marketscreener.com/quote/stock/DANIELI-C-OFFICINE-MECCAN-69524/news/Danieli-C-Officine-Meccaniche-S-p-A-Continuous-casting-machine-modernization-at-Cogne-Acciai-Spe-47435416/,Cogne Acciai Speciali news aluminum steel italy,general,2025-10-24T05:16:05.728656
"Tenaris to showcase its strong presence, advanced product solutions at OMC 2023",Tenaris,"October 24-26, 2023","Tenaris is highlighting its advanced portfolio of solutions at the OMC Med Energy Conference and Exhibition in Ravenna, Italy, emphasizing its support for complex energy projects in Europe and the Mediterranean with high-quality OCTG and line pipe products, as well as services for low carbon energy applications.",https://www.tenaris.com/en/news/2023/tenaris-to-showcase-its-strong-presence-advanced-product-solutions-at-omc-2023,Tenaris news steel italy,general,2025-10-24T05:16:19.478329
Tenaris is a worldsteel Sustainability Champion for eighth consecutive year,Tenaris,2025,"Tenaris has been recognized as a worldsteel Sustainability Champion for the eighth year in a row, reflecting its leadership in sustainable practices across environmental, social, and governance metrics. The company continues to invest in decarbonization, renewable energy, and operational efficiency across its global facilities, including in Italy.",https://www.tenaris.com/en/news/2025/tenaris-is-a-worldsteel-sustainability-champion-for-eighth-consecutive-year,Tenaris news steel italy,steel,2025-10-24T05:16:19.478345
Tenaris hosts panel on nuclear energy and Italy's boilermaking future,Tenaris,2025,"Tenaris recently hosted a panel in Italy on the future of nuclear energy and boilermaking, bringing together industry and institutional experts to discuss nuclear's role in Europe's energy transition. The company's Italian mill has also received accreditation to supply materials for nuclear facilities, meeting the highest international standards.",https://www.tenaris.com/en/news/2025/tenaris-hosts-panel-on-nuclear-energy-and-italy-s-boilermaking-future,Tenaris news steel italy,general,2025-10-24T05:16:19.478354
Prysmian Awarded The Italy-Tunisia Interconnection,Prysmian Official Website,2025-09-26,Prysmian has been awarded the tender by Terna S.p.A. and STEG for the construction of a submarine power interconnection between Italy and Tunisia under the Elmed Project. The contract could reach a value of around €460 million and aims to create an energy bridge between Europe and Africa to enhance energy security. Installation will be carried out by the Prysmian Monna Lisa vessel along the Strait of Sicily.,https://www.prysmian.com/en/media/press-releases/prysmian-awarded-the-italy-tunisia-interconnection,Prysmian news copper cables italy,general,2025-10-24T05:16:30.779070
Prysmian Secures €460m Contract For Italy–Tunisia Subsea Power Link,Wire News,2025-09-26,Prysmian announced winning a $536.59 million contract to build a submarine power cable connecting Italy and Tunisia. This project is part of the Elmed Project to enhance energy interconnection between the two countries.,https://www.wireworld.com/wirenews/prysmian-secures-460m-contract-for-italytunisia-subsea-power-link.html,Prysmian news copper cables italy,general,2025-10-24T05:16:30.779092
Prysmian Named As Preferred Bidder For Major UK High Voltage Energy Interconnection Project,Prysmian Official Website,2025-09-30,"Prysmian was named preferred bidder for a major UK high voltage energy interconnection project, reflecting its leadership in submarine cable technology. Although this is UK-focused, it highlights Prysmian's ongoing global expansion and technological investments, including in Italy.",https://www.prysmian.com/en,Prysmian news copper cables italy,general,2025-10-24T05:16:30.779103
Raul Gil: Submarine cables and high-tech solutions to counter low-tech attacks,Cable Technology News,2025-10-23,"At the Italian Energy Summit 2025, Raul Gil, EVP Transmission at Prysmian, discussed the importance of security and innovative technologies in submarine cables. This underscores Prysmian's commitment to advancing cable technology and protecting critical infrastructure in Italy and beyond.",https://www.cabletechnologynews.co.uk/prysmian-raul-gil-submarine-cables-and-high-tech-solutions-to-counter-low-tech-attacks/,Prysmian news copper cables italy,general,2025-10-24T05:16:30.779113
