title,source,date,summary,url,query,category,fetched_at
Aluminum - Price - Chart - Historical Data - News,Trading Economics,"December 21, 2025","Aluminum prices rose to 2,958.90 USD/T on December 19, 2025, up 1.47% from the previous day, with a 5.20% increase over the past month and 16.35% year-over-year. UK aluminum futures hovered around $2,890 per tonne near a one-month high, supported by improving demand prospects, tight global supply, and China's fresh stimulus measures against its property crisis.",https://tradingeconomics.com/commodity/aluminum,aluminum prices and market trends,aluminum,2025-12-22T05:18:26.732442
"Global aluminum ingot prices tumble in Q2 2025 amid tariffs, oversupply and weak demand",MySteel,"Dec 22, 2025","The Asia-Pacific Aluminium Ingot Price Index fell 8.1% in Q2 2025 due to weak downstream demand and steady supply, with North America seeing an 18% drop from tariffs and oversupply. Recent regional price updates include Hangzhou, Nanchang, and Foshan on Dec 22. Looking ahead, LME aluminum prices are forecasted to rise 6.3% year-on-year to around USD 2,573 per tonne amid potential supply shortfalls and demand from EVs and infrastructure.",https://www.mysteel.net/news/5096284-global-aluminum-ingot-prices-tumble-in-q2-2025-amid-tariffs-oversupply-and-weak-demand,aluminum prices and market trends,aluminum,2025-12-22T05:18:26.732457
"SHFE and LME aluminium prices strengthen in sync, and insufficient fundamental support awaits observation",AlCircle,"December 19, 2025","LME aluminium closed at USD 2,955.5 per tonne after hitting a high of USD 2,960, while SHFE aluminium 2602 contract closed up 0.27% at RMB 22,245 per tonne. Central China market saw weakening sentiment with tepid downstream buying, though some trader purchases occurred. Secondary aluminium alloy prices rose 0.59%, but volatility suppresses demand.",https://www.alcircle.com/press-release/shfe-and-lme-aluminium-prices-strengthen-in-sync-and-insufficient-fundamental-support-awaits-observation-116667,aluminum prices and market trends,aluminum,2025-12-22T05:18:26.732463
Aluminum Hovers Near 1-Month High,Trading Economics,"December 19, 2025","Aluminum futures in the UK hovered around $2,890 per tonne, close to the one-month high reached on December 5th, supported by improving demand prospects and tight global supply. China has signaled fresh stimulus measures to combat its property crisis, which could boost demand for industrial metals. The world's top producer is expected to approach its 45-million-ton annual cap, leaving limited room for further production growth.",https://tradingeconomics.com/commodity/aluminum,aluminum production and capacity,aluminum,2025-12-22T05:18:39.049065
A Pivotal Week Hints at How the Aluminium Value Chain May Be Reshaped,AL Circle,December 2025,"IB2 opened its first large-scale aluminium production factory in Liulin, Shanxi, China, with innovative technology that transforms low-grade bauxite into high-quality feedstock. Vedanta Aluminium expanded its Lanjigarh alumina refinery in Odisha to a capacity of 5 million tonnes per annum, making it the second-largest alumina refinery outside of China. China saw a 14 percent drop in imports of unwrought aluminium and aluminium products in November 2025 compared to the same month last year.",https://www.alcircle.com/news/a-pivotal-week-hints-at-how-the-aluminium-value-chain-may-be-reshaped-116662,aluminum production and capacity,aluminum,2025-12-22T05:18:39.049079
Nonferrous Metals Surge Over 75% Year-to-Date; U.S. Rate Cut Impacts,SunSirs,"December 19, 2025","Capacity utilization rates for primary aluminum are nearing full production limits, with mainstream social stockpiles of primary aluminum at a historically low level of 584,000 metric tons on December 11. Aluminum demand remains resilient in new energy and power sectors, with sustained demand release in sectors like air conditioner heat exchangers and new energy vehicle battery trays. Aluminum prices are likely to recover alongside copper as supply-demand dynamics tighten.",https://www.sunsirs.com/uk/detail_news-28993.html,aluminum production and capacity,aluminum,2025-12-22T05:18:39.049084
"2025 Aluminum Scrap Market Review: Tariffs, Fires, and a Challenging Year",IndexBox,December 2025,"The U.S. aluminum scrap market faced significant challenges in 2025 due to tariff increases and supply disruptions, including multiple fires at the Novelis aluminum plant in Oswego, New York, which produces over a billion pounds of aluminum sheet annually. The Section 232 tariff increase from 25 percent to 50 percent drove the Midwest premium to historical levels and changed supply/demand balances. Industry outlook for 2026 suggests early catch-up time for mills with hopes for stability by the end of the first quarter.",https://www.indexbox.io/blog/2025-aluminum-scrap-market-review-tariffs-fires-and-a-challenging-year/,aluminum production and capacity,aluminum,2025-12-22T05:18:39.049088
What Technological Innovations Will the Aluminum Industry See in 2025?,Aluminium China,"February 22, 2025","The aluminum industry is experiencing significant technological breakthroughs in 2025, with inert anode technology leading the way. This innovation replaces traditional carbon anodes with inert anodes in aluminum electrolysis, emitting oxygen instead of greenhouse gases and achieving complete decarbonization. RUSAL has successfully employed this technology to produce high-purity aluminum with carbon emissions of less than 0.01 tons of CO₂ equivalent per ton of aluminum.",https://www.aluminiumchina.com/en-gb/news-center/industry-news/2025/2/22.html,aluminum technology innovation sustainability,aluminum,2025-12-22T05:18:54.751990
Aluminum's Impact on Sustainable Development Goals,Discovery Alert,2025-12-22T05:18:54.752021,"This article explores how aluminum drives sustainable development through recycling innovation and energy efficiency, with particular focus on electric vehicle applications. The analysis projects 5-15% price premiums for verified sustainable aluminum products and identifies key investment opportunities in recycling infrastructure, technology innovation, and renewable energy integration for aluminum production.",https://discoveryalert.com.au/aluminum-critical-enabler-sustainable-growth-2025/,aluminum technology innovation sustainability,aluminum,2025-12-22T05:18:54.752003
ELYSIS Hits Milestone: First Inert Anode Aluminum Cell,Mirage News,2025-12-22T05:18:54.752029,"ELYSIS announced the successful startup of its 450 kiloampere inert anode cell at Rio Tinto's smelter in Alma, Quebec, marking the first commercial-scale implementation of this technology. This breakthrough enables high-amperage aluminum production with no direct carbon emissions from the smelting process while improving worker safety, reducing costs, and enhancing productivity.",https://www.miragenews.com/elysis-hits-milestone-first-inert-anode-1569913/,aluminum technology innovation sustainability,aluminum,2025-12-22T05:18:54.752027
Startup makes game-changing breakthrough that could transform aluminum recycling,The Cool Down,2025-12-22T05:18:54.752035,"Sortera, an Indiana-based tech company, secured $45 million in funding to expand its aluminum recycling operations with a new facility in Tennessee. The company uses artificial intelligence and advanced sensors to sort mixed aluminum scrap with over 95% accuracy without requiring pre-melting, significantly improving recycling efficiency and enabling the creation of high-purity recycled metal feedstocks.",https://www.thecooldown.com/green-tech/sortera-aluminum-recycling-startup-facility/,aluminum technology innovation sustainability,aluminum,2025-12-22T05:18:54.752034
Building reuse into the materials around us,MIT News,"December 18, 2025","MIT researchers highlight advances in aluminum recycling through automated sensor-based sorting, machine learning, and robotics that enable aluminum scrap to be directed into higher-value applications including aerospace components and structural automotive parts. The research demonstrates how advancements in circular economy practices can extract value from industrial waste while reducing energy consumption in alloy production.",https://news.mit.edu/2025/building-reuse-materials-around-us-diran-apelian-1218,aluminum technology innovation sustainability,aluminum,2025-12-22T05:18:54.752039
Aluminum-air long-duration generation technology selected by Net Zero Innovation Hub for Data Centers,Net Zero Data Centers,2025-12-22T05:18:54.752044,"Phinergy's aluminum-air backup energy technology was selected from over 70 proposals to provide clean, scalable backup power systems for data centers. The technology will be scaled to the megawatt level and deployed in live environments at hub member data centers as a sustainable alternative to diesel generators.",https://www.netzerodatacenters.com/aluminum-air-long-duration-generation-technology-selected-by-net-zero-innovation-hub-for-data-centers-for-groundbreaking-clean-backup-energy-initiative-in-data-centers,aluminum technology innovation sustainability,aluminum,2025-12-22T05:18:54.752043
AKFA Aluminum to Build First U.S. Facility in Kentucky,Environment & Energy Leader,2025-12-22T05:18:54.752049,"AKFA Aluminum announced an $80 million investment to build its first U.S. facility in Kentucky, creating 331 jobs and introducing new aluminum extrusion, anodizing, and finishing capacity. The facility will operate as a full-cycle production hub integrating recycled aluminum billets and energy-efficient equipment to support a lower-carbon supply chain.","https://www.environmentenergyleader.com/stories/akfa-aluminum-to-build-first-us-facility-in-kentucky,108086",aluminum technology innovation sustainability,aluminum,2025-12-22T05:18:54.752047
Aluminium at Climate Week NYC 2025,International Aluminium,"September 22, 2025","The aluminum sector participated in Climate Week NYC 2025, with industry leaders including Alcoa CEO Bill Oplinger discussing industrial strategy in an era of geopolitical and climate uncertainty. The sector emphasized that decarbonizing primary aluminum production and scaling up recycling are essential to achieving net zero goals.",https://international-aluminium.org/aluminium-at-climate-week-nyc-2025/,aluminum technology innovation sustainability,aluminum,2025-12-22T05:18:54.752052
Aluminum giants hit major milestone with low-carbon production,Canary Media,2025-12-22T05:18:54.752057,"Elysis, a joint venture of Alcoa and Rio Tinto, announced a breakthrough in scaling its carbon-free inert anode technology to commercial viability. This milestone represents a major step forward in reducing carbon emissions from primary aluminum production at scale.",https://www.canarymedia.com/articles/clean-aluminum/alcoa-riotinto-hit-low-carbon-production-milestone,aluminum technology innovation sustainability,aluminum,2025-12-22T05:18:54.752055
U.S. Recycled Steel Prices Rise in December 2025 After Subdued Period,Scrap Monster,2025-12-17,"U.S. recycled steel prices increased in December 2025 following a subdued market from May through November. Davis Index reported a $10 per ton price increase for prime and prompt grades, with some shredded, plate, structural, and heavy melting steel grades rising $20 per ton. Severe weather disruptions in late November and early December contributed to construction slowdowns and material flow interruptions.",https://www.scrapmonster.com/news/metal-recycling/u.s.-recycled-steel-prices-rise-in-december-2025-after-subdued-period-2025-12-17/98018,steel prices and market trends,steel,2025-12-22T05:19:04.310354
Steel Market Update - Price Movements and Chinese Production Data,Trading Economics,2025-12-19,"Steel prices fell to 3,069 CNY/T on December 19, 2025, down 0.49% from the previous day, though prices have risen 0.07% over the past month. Steel rebar futures climbed above CNY 3,080 per ton as expectations of improving steel margins among Chinese producers lifted sentiment, supported by falling input costs for coal and coke.",https://tradingeconomics.com/commodity/steel,steel prices and market trends,steel,2025-12-22T05:19:04.310368
Global Iron and Steel Prices and Market Analysis,SteelRadar,2025-12-21,"SteelRadar provides comprehensive global iron and steel price tracking across major exchanges including Shanghai Futures, Turkey, China, Europe, and North America. The platform tracks rebar and billet prices with recent reports noting gradual declines in Turkey's long products market as of December 18, 2025.",https://www.steelradar.com/en/,steel prices and market trends,steel,2025-12-22T05:19:04.310374
Hot-Rolled Coil Prices Strengthen with Coke Price Reductions,Metal News,2025-12-22,"Hot-rolled coil prices strengthened this week with price reductions announced for wet-quenched coke (50 yuan/mt) and dry-quenched coke (55 yuan/mt), effective from December 22, 2025. The most-traded HRC contract gained 0.85% and settled at 3,305 yuan/mt.",https://news.metal.com/newscontent/103681619/,steel prices and market trends,general,2025-12-22T05:19:04.310382
"U.S. Raw Steel Output Rises in Mid-December 2025, Says AISI Report",Scrap Monster,2025-12-16,"U.S. raw steel production increased to 1.753 million net tons in the week ending December 13, 2025, up 5.3% year-on-year from 1.665 million tons, with capability utilization at 76.5%. Year-to-date production through that week reached 85.881 million net tons at 76.8% utilization. The Southern district led output at 815,000 tons, followed by Great Lakes and Midwest regions.",https://www.scrapmonster.com/news/steel/u.s.-raw-steel-output-rises-in-mid-december-2025-says-aisi-report-2025-12-16/98012,steel production and capacity,steel,2025-12-22T05:19:11.525834
Domestic Steel Industry Dynamics 2026 & Falling LME ...,Inox Tân Đạt (YouTube),"Dec 22, 2025","The stainless steel market bulletin discusses dynamics entering late December 2025, with nickel prices on the LME dropping to around $14,500 per ton, easing cost pressures temporarily. It highlights policy, supply-demand, and raw material impacts shaping trends into early 2026. The update covers industrial metal price adjustments amid cautious investor sentiment.",https://www.youtube.com/watch?v=zDozQJEMfDM,steel production and capacity,steel,2025-12-22T05:19:11.525849
"CHAMPION IRON TO LAUNCH CASH TENDER OFFER TO ACQUIRE RANA GRUBER, RECEIVES FINANCIAL SUPPORT FROM LA CAISSE AND A TERM LOAN COMMITMENT FROM SCOTIABANK",Champion Iron Newsroom,"Dec 21, 2025","Champion Iron announced a cash tender offer to acquire Rana Gruber, a producer of high-grade iron ore concentrate (upgraded to 65% Fe) primarily for European steel production. The deal is expected to boost revenue, EBITDA, and cash flows accretively while maintaining financial leverage, supporting decarbonization in steel via quality resources. Rana Gruber produced 1,867 thousand metric tons of iron ore in the prior year at a cash cost of $565 per ton.","https://newsroom.championiron.com/2025-12-21-CHAMPION-IRON-TO-LAUNCH-CASH-TENDER-OFFER-TO-ACQUIRE-RANA-GRUBER,-RECEIVES-FINANCIAL-SUPPORT-FROM-LA-CAISSE-AND-A-TERM-LOAN-COMMITMENT-FROM-SCOTIABANK",steel production and capacity,steel,2025-12-22T05:19:11.525857
"December 22, 2025，Liberty Steel has successfully restarted the blast furnace at its Whyalla steelworks",Metal.com,"December 22, 2025",Liberty Steel successfully restarted its blast furnace at the Whyalla steelworks in Australia after a strategic three-week pause. This resumption supports ongoing steel production capacity at the facility. The update falls under ferrous metals news coverage.,https://news.metal.com/newscontent/103682391/,steel production and capacity,steel,2025-12-22T05:19:11.525867
SAIL Turns to Danieli For IISCO Plant Expansion,Association for Iron & Steel Technology (AIST),19 December 2025,"Danieli announced it will supply key technologies for the Steel Authority of India Ltd.'s (SAIL) IISCO Steel Plant expansion in Burnpur, West Bengal. This upgrade supports modern steel production advancements amid sustainability pressures in the industry. The project aligns with ongoing innovations in steel technology for efficiency and reduced emissions.",https://www.aist.org/steel-news,steel technology innovation sustainability,steel,2025-12-22T05:19:16.373972
Danieli to Upgrade voestalpine Wire Rod Austria’s Mill,Association for Iron & Steel Technology (AIST),19 December 2025,"Danieli has been selected to upgrade voestalpine Wire Rod Austria’s mill in Donawitz, Austria. The upgrade involves key technologies enhancing production capabilities. It contributes to steel industry innovations focusing on efficiency and sustainability.",https://www.aist.org/steel-news,steel technology innovation sustainability,steel,2025-12-22T05:19:16.373990
Copper Price Forecast for Next Week (22nd - 26th December 2025),Choice India,"December 22, 2025","Copper prices rose 2.71% to $11,880 per metric ton amid expectations of U.S. interest rate cuts and 50% tariffs on refined copper causing arbitrage and shortages in Europe and Asia. A mudslide at Indonesia’s Grasberg mine is expected to limit 300,000-500,000 tons of supply until mid-2026. MCX Copper shows a bullish trend, with forecasts for a moderately bullish week ahead.",https://choiceindia.com/blog/copper-price-forecast-for-next-week,copper prices and market trends,copper,2025-12-22T05:19:24.700969
Copper - Price - Chart - Historical Data - News,Trading Economics,"December 22, 2025","Copper rose to 5.46 USD/Lbs on December 22, up 0.98% daily and 9.45% monthly, supported by strong demand from China and the US in sectors like electric vehicles, energy infrastructure, and AI investments. Futures held above $5.4 per pound near multi-month highs. Recent updates note rises on December 19 and earlier fluctuations.",https://tradingeconomics.com/commodity/copper,copper prices and market trends,copper,2025-12-22T05:19:24.700985
"Copper Prices Surge Despite Economic Slowdown, Structural Factors Cited",Chosun,"December 22, 2025","LME copper prices rose to $11,886.23 per ton on December 19, up 37% year-over-year, driven by supply disruptions, low refining fees, and inventory distortions rather than manufacturing recovery. Experts highlight mine issues, tariffs, and limited new supply development. Citi forecasts $13,000-$15,000 per ton in early 2026 amid AI demand.",https://www.chosun.com/english/market-money-en/2025/12/22/JT3YSIGCABHJHB4AOEHKGNHFRA/,copper prices and market trends,copper,2025-12-22T05:19:24.700993
The Bank of Japan raised interest rates by 25 basis points as expected and LME copper fluctuated and closed higher last Friday [SMM Copper Morning Meeting Minutes],Metal News,"December 22, 2025","LME copper closed at $11,870.5/mt on Friday, up 1.22%, after fluctuating between $11,785.5 and $11,928/mt, while SHFE copper rose 0.91% to 93,560 yuan/mt. Bank of Japan rate hike and hawkish US Fed views tempered gains amid loose spot supply and cautious downstream demand. Prices face limited upside potential.",https://news.metal.com/newscontent/103681971/The-Bank-of-Japan-raised-interest-rates-by-25-basis-points-as-expected-and-LME-copper-fluctuated-and-closed-higher-last-Friday-%5BSMM-Copper-Morning-Meeting-Minutes%5D,copper prices and market trends,copper,2025-12-22T05:19:24.701000
Chinese copper smelter and Antofagasta agree to record low fees,The Edge Markets,"December 22, 2025","A Chinese smelter and Antofagasta agreed to record low processing fees for copper concentrate in 2026, signaling tight supply conditions. This deal underscores ongoing pressures in the copper market amid global trends.",http://www.theedgemarkets.com/my/node/786741,copper prices and market trends,copper,2025-12-22T05:19:24.701023
"Copper nears US$12,000 a tonne as base metals rally",KLSE Screener,"December 22, 2025","Copper prices rallied up to 1.3% to $11,928 a tonne, approaching an all-time high and nearing $12,000, as part of a broader base metals surge. This reflects strong market momentum in industrial metals.",https://www.klsescreener.com/v2/news/view/1640829/copper-nears-us-12-000-a-tonne-as-base-metals-rally,copper prices and market trends,copper,2025-12-22T05:19:24.701029
"Copper Prices Surge Despite Economic Slowdown, Structural Factors Cited",Chosun,"December 22, 2025","International copper prices have hit record highs, rising to $11,886.23 per ton on December 19th, marking a 37% increase from the end of last year. The surge is driven by supply disruptions, AI infrastructure demand, and limited development of new mines, with Goldman Sachs and Citi maintaining bullish outlooks projecting prices between $13,000-$15,000 per ton in early 2026.",https://www.chosun.com/english/market-money-en/2025/12/22/JT3YSIGCABHJHB4AOEHKGNHFRA/,copper production and capacity,copper,2025-12-22T05:19:35.692903
Copper Rebounds on Short Covering,Trading Economics,"December 22, 2025","Copper rose to 5.46 USD/Lbs on December 22, 2025, up 0.98% from the previous day, with prices remaining near multi-month highs. Strong demand from China and the US, driven by electric vehicles, energy infrastructure, and AI-driven investment, continues to support prices despite weak Chinese industrial data.",https://tradingeconomics.com/commodity/copper,copper production and capacity,copper,2025-12-22T05:19:35.692921
The Bank of Japan raised interest rates by 25 basis points as expected and LME copper fluctuated and closed higher last Friday,Metal News,"December 22, 2025","LME copper closed at $11,870.5/mt on Friday with a 1.22% increase, while Chinese copper smelters and Antofagasta finalized 2026 copper concentrate long-term contract benchmark TC at record low fees. Global refined copper inventories reached a 35-year low of 1,451 thousand tons as of November 30, with supply constraints becoming increasingly prominent.",https://news.metal.com/newscontent/103681971/The-Bank-of-Japan-raised-interest-rates-by-25-basis-points-as-expected-and-LME-copper-fluctuated-and-closed-higher-last-Friday-%5BSMM-Copper-Morning-Meeting-Minutes%5D,copper production and capacity,copper,2025-12-22T05:19:35.692931
Nonferrous Metals Surge Over 75% Year-to-Date; U.S. Rate Cut,Sunsirs,"December 22, 2025","Copper production capacity has been constrained by output reductions at Indonesia's Grasberg mine and production disruptions at Chilean copper companies, contributing to historically low global refined copper inventories. New energy vehicles and AI computing infrastructure construction have emerged as major growth drivers, with copper demand from EVs and charging piles growing significantly in 2025.",https://www.sunsirs.com/uk/detail_news-28993.html,copper production and capacity,copper,2025-12-22T05:19:35.692940
Nickel Prices Continue to Rebound,SMM - Metal Market,"December 22, 2025","Nickel prices continued their rebound momentum, with LME select nickel 3-month contracts rising to $14,935/mt, up $35 from the previous session. The strong recovery began on Wednesday, with the most-traded SHFE nickel contract 2601 settling at 117,180 yuan/mt on December 19, gaining 1.27% week-over-week.",https://www.metal.com/Nickel,nickel prices and market trends,nickel,2025-12-22T05:19:47.042563
"Nickel Rose to 14,916.25 USD/T",Trading Economics,"December 22, 2025","Nickel rose to $14,916.25 per ton on December 22, 2025, up 0.11% from the previous day. Over the past month, nickel prices have risen 1.26%, though the metal remains 2.93% lower than a year ago.",https://tradingeconomics.com/commodity/nickel,nickel prices and market trends,nickel,2025-12-22T05:19:47.042578
Nickel Price Extends Rebound After Indonesia Signals Mine Output Cut,Mining.com,"December 19, 2025","Nickel advanced for a third consecutive day, extending its rebound from an eight-month low after Indonesia proposed cutting nickel ore production in 2026 from 379 million tons to approximately 250 million tons. The metal rose as much as 1.5% on Friday, gaining more than 3% since closing at $14,263 on Tuesday, with analysts suggesting nickel is likely to outperform other base metals in 2026 if the production cut materializes.",https://www.mining.com/web/nickel-price-extends-rebound-after-indonesia-signals-mine-output-cut/,nickel prices and market trends,nickel,2025-12-22T05:19:47.042588
Nickel price extends rebound after Indonesia signals mine output cut,Mining.com,"December 20, 2025","Indonesia, the world's top nickel producer, has proposed cutting nickel ore production to 250 million tons in 2026, down from 379 million tons this year, in response to a significant slump in nickel prices. The metal rose 1.5% on Friday following this announcement, extending a rebound from an eight-month low. Nickel prices have declined roughly 50% over the past three years due to oversupply from Indonesia and China outpacing global demand.",https://www.mining.com/web/nickel-price-extends-rebound-after-indonesia-signals-mine-output-cut/,nickel production and capacity,nickel,2025-12-22T05:19:55.175135
Eagle Mine sold,The Mining Gazette,"December 19, 2025","Lundin Mining Corporation announced the sale of the Eagle Mine and Humboldt mill in Marquette County to Talon Metals Corp in an all-stock deal expected to close in early January. Eagle is currently the only primary U.S. nickel mine and produces nickel and copper concentrates, with the transaction allowing Talon to use cash flow from the mine to fund exploration and development of future mining operations.",https://www.mininggazette.com/news/front-page/2025/12/eagle-mine-sold/,nickel production and capacity,copper,2025-12-22T05:19:55.175152
