title,source,date,summary,url,query,category,fetched_at
"LME aluminium holds steady at USD 2,854/t and alumina platts stays flat at USD 313.5/t",AL Circle,2025-12-04,"On December 4, 2025, the London Metal Exchange (LME) aluminium price remained steady at USD 2,854 per tonne with no change from the previous day’s close. The 3-month bid and offer prices rose slightly, while inventory levels showed a decline in opening stock and cancelled warrants but stable live warrants.",https://www.alcircle.com/news/lme-aluminium-holds-steady-at-usd-2-854-t-and-alumina-platts-stays-flat-at-usd-313-5-t-116453,aluminum prices and market trends,aluminum,2025-12-05T05:13:44.964126
"In December, Aluminum Prices Rose, Driving Up Aluminum Scrap Prices",Metal.com,2025-12-02,"Aluminum futures opened higher and fluctuated near 21,100 yuan/mt, with increased market participation. Primary aluminum spot prices rose significantly, pushing aluminum scrap prices up as well. Tight supply, environmental crackdowns, and transportation restrictions are contributing to cautious market sentiment and expected price volatility.",https://www.metal.com/en/newscontent/103649214,aluminum prices and market trends,aluminum,2025-12-05T05:13:44.964142
Aluminum Prices Soar,Interactive Brokers Traders' Insight,2025-12-03,"Aluminum prices reached their highest levels in three years, trading around USD 2,880–2,920 per ton, driven by production constraints in China and supply limits. The recent rally suggests a structural supply deficit beginning to materialize, with forecasts indicating potential further upside if prices hold above USD 2,800.",https://www.interactivebrokers.com/campus/traders-insight/securities/macro/chart-advisor-aluminum-prices-soar/,aluminum prices and market trends,aluminum,2025-12-05T05:13:44.964149
Aluminum Hits 4-week Low,Trading Economics,2025-11-18,"Aluminum prices decreased to USD 2,784 per tonne, the lowest since October 2025, but have gained 1.52% over the past four weeks and 7.8% over the last 12 months. Prices have shown some volatility but remain elevated compared to previous years.",https://tradingeconomics.com/commodity/aluminum,aluminum prices and market trends,aluminum,2025-12-05T05:13:44.964153
Aluminum Prices Hit 3-Year High: Is It the Next Key Metal in the Clean Energy Shift?,Carbon Credits,2025-12-04,"Aluminum prices surged to a three-year high near USD 2,800 per tonne, driven by rising demand from electric vehicles, solar, and grid upgrades. Supply concerns include China's production caps, environmental regulations, and geopolitical risks affecting bauxite imports from Guinea.",https://carboncredits.com/aluminum-prices-hit-3-year-high-is-it-the-next-key-metal-in-the-clean-energy-shift/,aluminum prices and market trends,aluminum,2025-12-05T05:13:44.964157
SMM Weekly Survey: Aluminum Processing Industry Strained by Off-Season and High Aluminum Prices with Structural Divergence Persisting,SMM (Shanghai Metals Market),"December 4, 2025","The operating rate of domestic aluminum downstream processing enterprises fell slightly due to high aluminum prices suppressing spot order transactions. Primary aluminum alloy production remained stable, but demand was cautious with structural divergence across sectors. Export orders show promise, but domestic operations remain constrained by price fluctuations and weak year-end stockpiling.",https://news.metal.com/newscontent/103655695/smm-weekly-survey-aluminum-processing-industry-strained-by-off-season-and-high-aluminum-prices-with-structural-divergence-persisting-,aluminum production and capacity,aluminum,2025-12-05T05:14:01.407819
Metalysis Begins Commercial Production of High Scandium Loading Aluminium Scandium Alloy Powder,SMT Today,"December 4, 2025","Metalysis has started commercial production of high-purity aluminium scandium alloy powder, addressing critical needs in semiconductor, aerospace, and defense sectors. The company is scaling production from Gen 2 units to larger Gen 3 and Gen 4 units to meet growing market demand, driven by Western supply chain diversification away from China.",https://smttoday.com/2025/12/04/metalysis-begins-commercial-production-of-high-scandium-loading-aluminium-scandium-al%E2%82%83sc-alloy-powder/,aluminum production and capacity,aluminum,2025-12-05T05:14:01.407833
"LME Aluminium Holds Steady at USD 2,854/t and Alumina Platts Stays Flat at USD 313.5/t",Al Circle,"December 5, 2025","LME aluminium prices remained steady at around USD 2,854 per tonne on December 4, with minor fluctuations in 3-month bids and offers. Alumina prices also stayed flat at USD 313.5 per tonne. Inventory levels saw slight decreases, indicating stable market conditions.",https://www.alcircle.com/news/lme-aluminium-holds-steady-at-usd-2-854-t-and-alumina-platts-stays-flat-at-usd-313-5-t-116453,aluminum production and capacity,aluminum,2025-12-05T05:14:01.407837
Tracking the Impact of U.S. Tariffs on Five Targeted Canadian Industries,RBC Economics,"December 4, 2025","Despite 25% U.S. tariffs on Canadian aluminum imports, Canadian aluminum production only declined modestly by 2% through September 2025, with employment in aluminum manufacturing increasing by 5%. High global demand and prices have helped offset production drops, while the U.S. has limited capacity to replace Canadian aluminum imports.",https://www.rbc.com/en/economics/canadian-analysis/featured-analysis/insights/tracking-the-impact-of-u-s-tariffs-on-five-targeted-canadian-industries/,aluminum production and capacity,aluminum,2025-12-05T05:14:01.407841
NioCorp Acquires Scandium Alloy Assets to Support Potential First Ever Vertically Integrated U.S. Scandium Mine-to-Markets Supply Chain,NioCorp Press Release,"December 4, 2025","NioCorp completed the acquisition of FEA Materials' assets and IP to produce aluminum-scandium master alloy in the U.S., aiming to establish a vertically integrated scandium supply chain. This move supports growing market demand in defense and commercial sectors and complements NioCorp's Elk Creek Project for critical minerals.",https://www.niocorp.com/niocorp-acquires-scandium-alloy-assets-to-support-potential-first-ever-vertically-integrated-u-s-scandium-mine-to-markets-supply-chain/,aluminum production and capacity,aluminum,2025-12-05T05:14:01.407845
China's Total Aluminum Production Flat WoW but Up 3% YoY,AAStocks (Citi Research),"December 4, 2025","China's aluminum production from November 27 to December 3 was 856,000 metric tons, unchanged week-over-week but increased 3% year-over-year. This reflects steady output amid market conditions, according to Citi research.",http://www.aastocks.com/en/mobile/news.aspx?newsid=NOW.1488705&newstype=61&newssource=AAFN,aluminum production and capacity,aluminum,2025-12-05T05:14:01.407848
ALUPCO pioneers sustainable aluminium for the energy transition era,OGN News,"Mon, 01 Dec 2025","ALUPCO is advancing sustainable aluminium production through technological upgrades like automation and Industry 4.0 tools, strategic partnerships, and recycling programs producing 'green billets'. The company focuses on energy-efficient processes, water recycling, and low-VOC chemicals, aligning with circular economy principles and LEED standards. An upcoming IPO aims to fund expansion in solar-frame and low-carbon extrusion lines, positioning ALUPCO as a global leader in low-carbon aluminium solutions.",https://ognnews.com/Article/47986/ALUPCO_pioneers_sustainable_aluminium_for_the_energy_transition_era,aluminum technology innovation sustainability,aluminum,2025-12-05T05:14:14.378683
Aluminum's Impact on Sustainable Development Goals,Discovery Alert,2025,"This article highlights aluminum's role in sustainable development through recycling innovation, energy efficiency, and economic growth. It emphasizes aluminum's recyclability enabling closed-loop manufacturing and the use of AI to improve recycling efficiency and quality control. Market projections indicate strong growth driven by automotive electrification and construction, with investment opportunities in recycling infrastructure, renewable energy integration, and supply chain optimization.",https://discoveryalert.com.au/aluminum-critical-enabler-sustainable-growth-2025/,aluminum technology innovation sustainability,aluminum,2025-12-05T05:14:14.378696
Aluminum Recycling Market to Reach US$91.3 Billion by 2032 as Global Demand for Low-Carbon Metals & Circular Manufacturing Surges,PR Newswire,2025,"The aluminum recycling industry is expanding rapidly due to technological innovation, policy support, and market demand for low-carbon metals. Recycling aluminum uses 95% less energy than primary production, driving investments in advanced sorting and smelting technologies. The industry is moving towards hydrogen-powered remelting and AI-guided scrap sorting, with OEM mandates increasing recycled aluminum content in electric vehicles to 60-70%.",https://www.prnewswire.com/news-releases/aluminum-recycling-market-to-reach-us91-3-billion-by-2032-as-global-demand-for-low-carbon-metals--circular-manufacturing-surges-302630210.html,aluminum technology innovation sustainability,aluminum,2025-12-05T05:14:14.378699
Decarbonizing Aluminum - RMI,Rocky Mountain Institute (RMI),2025,"RMI collaborates with aluminum producers, buyers, and financiers to decarbonize the aluminum sector, which accounts for about 2-3% of global greenhouse gas emissions. The initiative includes carbon accounting at the product level, promoting low-emission technologies like smelting, and a finance framework called Sustainable Aluminum Principles to support investments aligned with a 1.5°C climate pathway. Increasing post-consumer recycling and emissions transparency are key strategies.",https://rmi.org/decarbonizing-aluminum/,aluminum technology innovation sustainability,aluminum,2025-12-05T05:14:14.378708
RUSAL Goes Greener: Innovative Aluminium Can made from 75% Recycled Aluminium and ALLOW INERTA to Appear Soon,RUSAL Press Center,3 December 2025,"RUSAL announced the development of an innovative aluminum can made from 75% recycled aluminum, enhancing sustainability in packaging. This innovation supports circular economy principles by significantly increasing recycled content in aluminum products, reducing environmental impact and resource consumption.",https://rusal.ru/en/press-center/press-releases/rusal-goes-greener-innovative-aluminium-can-made-from-75-recycled-aluminium-and-allow-inerta-to-appe/,aluminum technology innovation sustainability,aluminum,2025-12-05T05:14:14.378711
[SMM Analysis] Analysis of Steel Price Trends in December,Metal.com,"December 4, 2025","Steel prices have shown a volatile trend recently with slight declines in hot metal production but high levels overall. Inventory is expected to continue declining in December, though destocking for sheets and plates remains slow. Macro expectations around domestic policy meetings may provide limited upside for steel prices, but persistent destocking pressure and weak sales could constrain price increases.",https://www.metal.com/en/newscontent/103643800,steel prices and market trends,steel,2025-12-05T05:14:26.326921
Steel prices hit five-year low; weak trend likely to persist in near term,Economic Times,"October 27, 2025","Domestic steel prices have fallen to a five-year low due to weak export demand, rising imports, and global oversupply. Despite the drop in finished steel prices, raw material costs like iron ore and coking coal remain relatively stable, pressuring mill margins. Steel prices are expected to stay subdued in the near term because of high inventories, sluggish demand, and seasonal weakness, with potential production cuts if prices fall further.",https://economictimes.com/industry/indl-goods/svs/steel/steel-prices-hit-five-year-low-weak-trend-likely-to-persist-in-near-term-bigmint/articleshow/124776337.cms,steel prices and market trends,steel,2025-12-05T05:14:26.326937
HRC Steel Hits 15-week High,Trading Economics,"December 3, 2025","Hot-Rolled Coil (HRC) steel prices rose to $906 per ton, marking a 15-week high and a 6.84% increase over the past month. The price is also up 32.07% compared to the same period last year, reflecting a positive trend in the benchmark steel market despite recent volatility.",https://tradingeconomics.com/commodity/hrc-steel,steel prices and market trends,steel,2025-12-05T05:14:26.326942
American steel producers are gradually raising prices for rolled products,GMK Center,"December 4, 2025","In the US market, steel producers are gradually increasing prices for Hot-Rolled Coil (HRC) products, with current market prices ranging from $825 to $865 per short ton. Delivery times for spot orders remain within 3-5 weeks, indicating steady demand and supply conditions.",https://gmk.center/en/news/american-steel-producers-are-gradually-raising-prices-for-rolled-products/,steel prices and market trends,steel,2025-12-05T05:14:26.326947
U.S. Steel to restart second blast furnace in Granite City,St. Louis Public Radio,2025-12-04,"U.S. Steel announced it will restart its second blast furnace at Granite City Works, aiming to hire 400 new workers. This move reverses previous idling decisions and is seen as a positive development for the facility amid ongoing ownership changes and investment plans excluding Granite City.",https://www.stlpr.org/economy-business/2025-12-04/u-s-steel-restart-second-blast-furnace-granite-city-works,steel production and capacity,steel,2025-12-05T05:14:38.236765
Steelmaking decarbonisation,BHP,2025-12-05,"BHP highlights the ongoing challenge of decarbonising steel production as demand rises globally. The company supports multiple technology pathways, including carbon capture and renewable energy, to achieve near zero emissions steel production, despite project delays due to high costs.",https://www.bhp.com/news/bhp-insights/2025/12/steelmaking-decarbonisation,steel production and capacity,steel,2025-12-05T05:14:38.236779
World's First General Design Approval (GDA) for Developed Steel and Post-Weld Heat Treatment (PWHT) Exemption based on ECA for Low-pressure LCO2 Tanks,Mitsubishi Heavy Industries,2025-12-05,Mitsubishi Shipbuilding and Nippon Steel received the world's first General Design Approval for a new high-strength steel that allows exemption from post-weld heat treatment in large low-pressure LCO2 tanks. This innovation is expected to reduce costs and improve productivity in steel manufacturing for CO2 transport.,https://www.mhi.com/news/251205.html,steel production and capacity,steel,2025-12-05T05:14:38.236785
The President of the Treasury Board will highlight measures to protect and transform Canada's steel and lumber industries,Government of Canada,2025-12-04,"The Canadian government announced upcoming measures to support and transform the steel and lumber industries, with an event scheduled at Brannon Steel to highlight these initiatives aimed at protecting the sector.",https://www.canada.ca/en/treasury-board-secretariat/news/2025/12/the-president-of-the-treasury-board-will-highlight-measures-to-protect-and-transform-canadas-steel-and-lumber-industries.html,steel production and capacity,steel,2025-12-05T05:14:38.236790
U.S. Steel fined for leaking oil into Monongahela River,Tribune-Review,2025-12-04,"U.S. Steel was fined $135,000 and required to implement stronger pollution controls after environmental regulators found the company leaked oil into the Monongahela River at its West Mifflin facility.",https://triblive.com/business/u-s-steel-fined-for-leaking-oil-into-monongahela-river/,steel production and capacity,steel,2025-12-05T05:14:38.236795
AI Startup Leads UK Steel Towards Net Zero,AZoM,2025-12-05,"Deep.Meta, a UK manufacturing startup, demonstrated it can reduce steel production emissions by nearly 10% at Spartan UK's steel plant, advancing efforts toward net zero emissions in the steel industry.",https://www.azom.com/news.aspx?newsID=65086,steel production and capacity,steel,2025-12-05T05:14:38.236799
Hydrogen-Based Ironmaking Technology: Green Steel Guide,Discovery Alert,2025-12-04,"Hydrogen-based ironmaking technology offers a revolutionary method to cut steel production emissions by 95% through clean chemical reduction processes. This innovation could transform global steel production by enabling decarbonisation, supported by renewable energy, advanced electrolyser technologies, AI-driven process control, and material science advances.",https://discoveryalert.com.au/hydrogen-based-ironmaking-technology-2025-decarbonisation/,steel technology innovation sustainability,steel,2025-12-05T05:14:51.911501
AI Startup Deep.Meta Pushes UK Steel Toward Lower Emissions,ESG News,2025-12-04,"Deep.Meta's AI-driven simulations have achieved nearly a 10% emissions reduction at Spartan UK, the country's only steel plate producer. The company is advancing its Deep.Optimiser PhyX system with government support, aiming to optimize steel production processes, reduce energy use, and support net zero goals across global steel markets.",https://esgnews.com/ai-startup-deep-meta-pushes-uk-steel-toward-lower-emissions/,steel technology innovation sustainability,steel,2025-12-05T05:14:51.911516
Steelmaking decarbonisation - BHP,BHP,2025-12-05,"BHP is supporting multiple technology pathways to reduce greenhouse gas emissions in steelmaking, including carbon capture and renewable energy integration. The company aims to help the industry achieve a 30% reduction in emissions intensity relative to conventional blast furnace steelmaking, with widespread adoption expected after 2030.",https://www.bhp.com/news/bhp-insights/2025/12/steelmaking-decarbonisation,steel technology innovation sustainability,steel,2025-12-05T05:14:51.911522
World's First General Design Approval (GDA) for Developed Steel and Post-Weld Heat Treatment (PWHT) Exemption based on ECA for Low-pressure LCO2 Tanks,Mitsubishi Heavy Industries,2025-12-05,Mitsubishi Shipbuilding and Nippon Steel have achieved the world's first General Design Approval for a new steel and manufacturing process exempting post-weld heat treatment for large low-pressure liquid CO2 tanks. This breakthrough enhances economic viability and productivity while supporting carbon neutrality goals through advanced steel solutions.,https://www.mhi.com/news/251205.html,steel technology innovation sustainability,steel,2025-12-05T05:14:51.911528
Copper Price Surge Drives 34% Rally Amid Supply Constraints,Discovery Alert,"December 4, 2025","Copper prices have surged 34% year-to-date in 2025, reaching US$5.33 per pound, a four-month high driven by supply constraints, energy transition demand, and disruptions in Chile and Chinese smelters. The rally accelerated in the final quarter with a 13% gain since late August and a 5% jump in the first week of December, with forecasts suggesting prices could reach $16,000 per tonne under favorable conditions.",https://discoveryalert.com.au/copper-price-rally-2025-record-surge-demand-supply/,copper prices and market trends,copper,2025-12-05T05:15:08.320130
Copper Hits All-Time Highs! Scrap Prices Surge Heading Into December 2025,YouTube - iScrap App,"December 4, 2025","Copper futures have broken all-time price records due to speculative buying and algorithm-driven trades, despite weak mill demand in major markets. The rapid price increase of about 5% in days is driven primarily by investor flows and thin inventories, raising volatility concerns for scrappers and recyclers.",https://www.youtube.com/watch?v=N_Bbz3_wyiU,copper prices and market trends,copper,2025-12-05T05:15:08.320149
Copper prices hit new record high,The Brussels Times,"December 2, 2025","Copper prices reached a new record high of $11,294.50 per ton in London’s futures market, driven by supply chain challenges and uncertainty over US tariffs. Demand continues to grow with significant shipments to the US as traders await clarity on import duties.",https://www.brusselstimes.com/1863278/copper-prices-hit-new-record-high,copper prices and market trends,copper,2025-12-05T05:15:08.320162
"Copper price won't stay above $11,000 for long, says Goldman",Mining.com,"December 4, 2025","Goldman Sachs cautions that copper’s recent rally above $11,000 per ton is unlikely to be sustained as current fundamentals show adequate supply despite market optimism. They highlight that the rally is driven by expectations of future tightness rather than present demand, with a global surplus expected until at least 2029 and potential demand slump in China.",https://www.mining.com/copper-price-wont-stay-above-11000-for-long-says-goldman/,copper prices and market trends,copper,2025-12-05T05:15:08.320175
Copper hits record high after Citi lifts price outlook,TradingView (Reuters),"December 4, 2025","Copper reached a record high following Citi's upgraded price outlook, fueled by supply concerns and optimistic market sentiment. The rally reflects ongoing worries about supply disruptions amid strong demand expectations.","https://www.tradingview.com/news/reuters.com,2025:newsml_L1N3XB02W:0-copper-hits-record-high-after-citi-lifts-price-outlook/",copper prices and market trends,copper,2025-12-05T05:15:08.320183
Copper Prices Surge Amid Bullish Outlook and Supply Concerns,GuruFocus,"December 4, 2025","Copper prices surged 1.2% to $11,581.50 per ton, surpassing earlier highs this week. Analysts from Citigroup predict continued strength driven by supply concerns and a bullish market outlook.",https://www.gurufocus.com/news/3235236/copper-prices-surge-amid-bullish-outlook-and-supply-concerns,copper prices and market trends,copper,2025-12-05T05:15:08.320190
The Alumbrera mine is expected to commence production in 2028,Metal.com,"December 5, 2025","The Alumbrera mine is slated to start production in 2028. Kamoa-Kakula set copper production targets of 380,000 to 420,000 mt for 2026 and 500,000 to 540,000 mt for 2027, maintaining a medium-term target of 550,000 mt. The Kamoa-Kakula copper smelter began operations on December 1, 2025, with copper sales in 2026 expected to exceed production due to inventory reductions.",https://news.metal.com/newscontent/103655842/The-Alumbrera-mine-is-expected-to-commence-production-in-2028-Overnight-LME-copper-fluctuated-and-closed-lower-%5BSMM-Copper-Morning-Meeting-Minutes%5D,copper production and capacity,copper,2025-12-05T05:15:23.047390
Glencore eyes $2.4b copper push,The Australian Mining Review,"December 5, 2025","Glencore announced plans to increase copper output to about 1 million tonnes by 2029 and 1.6 million tonnes by 2035, up from 850,000–875,000 tonnes in 2025. The company plans a $2.4 billion capital investment for a project expected to yield 880,000 tonnes of copper over 21 years, with a final investment decision expected in the first half of 2027. This expansion is driven by rising copper prices and demand from electric vehicles and data centers.",https://australianminingreview.com.au/news/glencore-eyes-2-4b-copper-push/,copper production and capacity,copper,2025-12-05T05:15:23.047412
"Copper price won't stay above $11,000 for long, says Goldman",Mining.com,"December 5, 2025","Goldman Sachs analysts predict that despite recent supply disruptions tightening copper availability, global demand growth has softened, and they do not foresee a global copper shortage until at least 2029. Copper prices recently hit a record high due to supply concerns and US-bound shipments ahead of potential tariffs, but demand weakness, especially in China, may limit price sustainability.",https://www.mining.com/copper-price-wont-stay-above-11000-for-long-says-goldman/,copper production and capacity,copper,2025-12-05T05:15:23.047420
BHP becomes global copper barometer,Australian Resources & Investment,"December 5, 2025","BHP shares rose over 3% amid signs of a tentative rebound in Chinese copper demand, with Chinese producers increasing operating rates in November. Despite high copper prices causing some substitution with aluminum, BHP remains a key indicator of global copper activity, producing over two million tonnes in FY25 and contributing nearly 45% of group EBITDA. The company’s valuation is closely tied to Chinese market movements and copper demand.",https://www.australianresourcesandinvestment.com.au/2025/12/05/bhp-becomes-global-copper-barometer/,copper production and capacity,aluminum,2025-12-05T05:15:23.047427
"Adani, Hindalco seek Peru copper assets as demand surges",Economic Times,"December 5, 2025","India's copper imports rose 4% to 1.2 million metric tons in the fiscal year ending March 2025, with demand expected to climb to 3-3.3 million tons. In response, Indian companies Adani and Hindalco are seeking copper assets in Peru to secure supply amid surging demand.",https://economictimes.com/industry/indl-goods/svs/metals-mining/adani-hindalco-seek-peru-copper-assets-as-demand-surges/articleshow/125780821.cms,copper production and capacity,copper,2025-12-05T05:15:23.047434
Rio Tinto's Nuton Technology: A Game-Changer in Low-Carbon Copper Production,Ainvest,"December 4, 2025","Rio Tinto's Nuton bioleaching technology significantly reduces carbon emissions and water use by 60-80% compared to traditional copper production methods. It produces 99.99% pure copper at mine sites with a carbon footprint far below global averages, supporting the growing demand for sustainable copper in renewable energy and electric vehicles.",https://www.ainvest.com/news/rio-tinto-nuton-technology-game-changer-carbon-copper-production-2512/,copper technology innovation sustainability,copper,2025-12-05T05:15:38.978172
