title,source,date,summary,url,query,category,fetched_at
Gunnison Copper Announces That Rio Tinto's Nuton Technology Produces First Copper,Newsfile,"December 4, 2025","After over 30 years of R&D, Rio Tinto's Nuton bioleaching technology produced its first copper cathode at Gunnison Copper's Johnson Camp mine. The technology achieves up to 80% less water usage and 60% lower carbon emissions than conventional methods, aiming to produce copper with the lowest carbon footprint in the U.S.",https://www.newsfilecorp.com/release/276917/Gunnison-Copper-Announces-That-Rio-Tintos-Nuton-Technology-Produces-First-Copper,copper technology innovation sustainability,copper,2025-12-05T05:15:38.978191
Rio Tinto's Nuton tech makes first-ever copper cathode at Gunnison mine,Mining.com,"December 4, 2025","Nuton's proprietary bioleaching technology produced the first copper cathode at Gunnison Copper's Johnson Camp mine, demonstrating cleaner, faster, and more efficient copper production at industrial scale. The technology reduces water use by up to 80% and carbon emissions by up to 60%, while shortening supply chains by producing copper cathode directly at the mine.",https://www.mining.com/rio-tintos-nuton-tech-makes-first-ever-copper-cathode-at-gunnison-mine/,copper technology innovation sustainability,copper,2025-12-05T05:15:38.978200
"Vale–Glencore Sudbury Venture Aims to Unlock 880,000-Ton Copper Volume for North America",CarbonCredits.com,"December 4, 2025","Vale and Glencore plan to deepen and extend an existing mine shaft in Canada's Sudbury Basin to unlock about 880,000 metric tons of copper over 21 years. This brownfield approach reduces environmental impacts and capital expenses, supporting North America's critical minerals supply for clean energy technologies and the global low-carbon transition.",https://carboncredits.com/vale-glencore-sudbury-venture-aims-to-unlock-880000-ton-copper-volume-for-north-america/,copper technology innovation sustainability,copper,2025-12-05T05:15:38.978216
High cash flow enables dividend uplift: Aurubis confirms sustainable growth strategy,Aurubis,"December 4, 2025","Aurubis started production of phase one of its Richmond project in the US, the first secondary smelter for complex multimetal recycling in North America. The plant will process around 180,000 tons of complex recycling materials annually once phase two is completed, contributing to sustainable copper supply and reducing reliance on imports in the US market.",https://www.aurubis.com/en/media/press-releases/press-releases-2025/high-cash-flow-enables-dividend-uplift-aurubis-confirms-sustainable-growth-strategy,copper technology innovation sustainability,copper,2025-12-05T05:15:38.978225
Nickel price hits 4-year low as gloom offsets potential Indonesia cuts,Mining.com,"December 4, 2025","Nickel prices fell to their lowest level since November 2020, dropping as much as 2.3% on the London Metal Exchange due to a pessimistic outlook from the Federal Reserve and expectations of fewer interest-rate cuts in 2025. Despite Indonesia considering deep cuts to nickel mining quotas to support prices, the metal has declined about 8% this year amid new supply and slowing electric-vehicle sales.",https://www.mining.com/web/nickel-price-hits-4-year-low-as-gloom-offsets-potential-indonesia-cuts/,nickel prices and market trends,nickel,2025-12-05T05:15:49.246180
"On December 5, the SMM #1 refined nickel price was ...",Metal News,"December 5, 2025","The SMM #1 refined nickel price ranged between 117,400 and 122,700 yuan per metric ton on December 5, with an average price of 120,050 yuan/mt, marking a decrease of 350 yuan/mt from the previous day.",https://news.metal.com/newscontent/103656760/,nickel prices and market trends,nickel,2025-12-05T05:15:49.246196
"LME nickel price rebounds above $14,900 on weak US dollar expectations",Yieh,"December 1, 2025","Nickel futures on the London Metal Exchange rebounded above $14,900 per ton on December 1, reaching a one-week high, driven by expectations of a weaker US dollar.",https://yieh.com/en/News/lme-nickel-price-rebounds-above-14900-on-weak-us-dollar-expectations/158101,nickel prices and market trends,nickel,2025-12-05T05:15:49.246203
[SMM Nickel Flash] SMM December 5: Domestic high-grade NPI ex-factory price observed,Metal News,"December 5, 2025","According to SMM, the domestic high-grade nickel pig iron (NPI) ex-factory price was recently observed at 910-920 yuan per nickel unit on December 5, reflecting current market conditions.",https://news.metal.com/newscontent/103657371/,nickel prices and market trends,nickel,2025-12-05T05:15:49.246210
First Atlantic Nickel Expands Phase 2X Drilling at Pipestone XL Nickel Alloy Project,Investing News,"December 4, 2025","First Atlantic Nickel is expanding its Phase 2X drilling program at the Pipestone XL project, targeting a 1.4-kilometer strike length and 850-meter width at the RPM zone. The project aims to provide a secure, low-energy, and environmentally sustainable nickel supply chain for North America by bypassing traditional smelting and roasting processes. Updates on recovery and concentrate products for nickel, chromium, and cobalt are expected in early 2026.",https://investingnews.com/first-atlantic-nickel-expands-phase-2x-drilling-at-pipestone-xl-nickel-alloy-project-four-additional-holes-targeting-1-4-kilometer-strike-length-and-850-meter-width-at-rpm-zone/,nickel production and capacity,nickel,2025-12-05T05:16:02.525991
US Minerals Projects Seek 'Industrial Vision' from Washington to Compete with China,Reuters via Mining.com,"December 4, 2025","Executives from US minerals companies are urging the government to develop a comprehensive industrial plan to build a critical minerals supply chain including nickel. They advocate for pressuring Indonesia to limit nickel production, which currently accounts for about 60% of global supply and has depressed prices. The goal is to support domestic nickel refining capacity, such as Westwin Elements' planned refinery in Oklahoma, and stabilize nickel prices.",https://www.mining.com/web/us-minerals-projects-seek-industrial-vision-from-washington-to-compete-with-china/,nickel production and capacity,nickel,2025-12-05T05:16:02.526009
USGS Director Champions Domestic Mining,North of 60 Mining News,"December 5, 2025",The US Geological Survey director emphasized the importance of domestic mining to meet the growing demand for critical minerals including nickel. Expanding mining capacity is essential to support the generation and transmission infrastructure needed for energy and technology sectors.,https://www.miningnewsnorth.com/story/2025/12/05/news/usgs-director-champions-domestic-mining/9388.html,nickel production and capacity,nickel,2025-12-05T05:16:02.526017
"Vale Foresees Higher Iron Ore, Copper & Nickel Production Next Year",Industrial Info,"December 4, 2025","Vale projects a 10% increase in nickel production for the upcoming year, alongside modest increases in iron ore and copper output. This forecast reflects the company's plans to expand its mining operations and meet growing demand for nickel in various industries.",https://www.industrialinfo.com/news/article.jsp?newsitemID=350106,nickel production and capacity,steel,2025-12-05T05:16:02.526023
The Art of the Critical Minerals Deal: The United States and Australia Framework to Secure Reliable Rare Earths Supplies,Clayton Utz,December 2025,"The United States and Australia have agreed to accelerate the secure supply of critical minerals including nickel through joint financing and project development. The framework includes at least US $1 billion in near-term financing to support projects delivering critical minerals for defense, advanced manufacturing, and energy transition technologies.",https://www.claytonutz.com/insights/2025/december/the-art-of-the-critical-minerals-deal-the-united-states-and-australia-framework-to-secure-reliable-rare-earths-supplies,nickel production and capacity,nickel,2025-12-05T05:16:02.526032
TECH Project high-grade nickel is primed to fuel the global green transition,Innovation News Network,"December 4, 2025","Queensland Pacific Metals’ TECH Project aims to become the world’s premier source of high-grade, ethically derived nickel to support the green transition. The project uses an environmentally-friendly DNi Process with over 98% nitric acid recycling and no tailings dam requirements, promising a carbon-negative, sustainable nickel production for EV batteries and energy storage industries.",https://www.innovationnewsnetwork.com/tech-project-high-grade-nickel-is-primed-to-fuel-the-global-green-transition/32893/,nickel technology innovation sustainability,nickel,2025-12-05T05:16:18.926053
Outlook for the Nickel Industry in the 15th Five-Year Plan Period,SunSirs,"December 4, 2025","The global nickel market currently faces structural oversupply, with a shift in industry focus from scale expansion to high-quality development emphasizing technology, cost efficiency, and sustainability. The plan highlights green manufacturing, vertical integration, and industrial cluster development as key to enhancing competitiveness and reducing carbon emissions in nickel production.",https://www.sunsirs.com/uk/detail_news-28500.html,nickel technology innovation sustainability,nickel,2025-12-05T05:16:18.926070
"Nickel Industry News, Views and Commentary - Chronickels",Nickel Institute,"December 4, 2025","NOVONIX’s patented all-dry, zero-waste cathode synthesis technology is expected to reduce costs and environmental impact in nickel-based cathode production. The article discusses nickel’s sustainability potential across its value chain, emphasizing the importance of responsible mining, manufacturing, and recycling to support the expanding electric vehicle battery market.",https://nickelinstitute.org/en/blog/,nickel technology innovation sustainability,copper,2025-12-05T05:16:18.926082
China Built Indonesia's Nickel Boom: Market Analysis,Discovery Alert,"December 4, 2025","China controls about 75% of Indonesia’s nickel operations, crucial for EV battery supply chains. The article highlights shifts in battery chemistry preferences, supply chain diversification away from China, and the growing importance of sustainable nickel production methods as key factors shaping the global nickel market and energy transition.",https://discoveryalert.com.au/indonesia-nickel-strategy-geopolitical-2025-china/,nickel technology innovation sustainability,nickel,2025-12-05T05:16:18.926093
Carrascal Nickel Corporation Strengthens Its Position as a Responsible Mining Leader in APAC Through Sustainability and Community-Focused Initiatives,Vietnam News,"December 4, 2025","Carrascal Nickel Corporation, a Philippine mining company, emphasizes responsible mining, environmental sustainability, and community partnership in its nickel and iron ore operations. The company is reinforcing its commitment to sustainable practices in the Asia-Pacific region.",https://vietnamnews.vn/media-outreach/1731104/carrascal-nickel-corporation-strengthens-its-position-as-a-responsible-mining-leader-in-apac-through-sustainability-and-community-focused-initiatives.html,nickel technology innovation sustainability,steel,2025-12-05T05:16:18.926099
Climate-friendly metals can come from deep-sea ores,Tech Xplore,"December 4, 2025","A new process using hydrogen reduction to extract nickel, cobalt, and copper from deep-sea ores significantly reduces CO2 emissions by over 90% compared to carbon-based methods. This innovative approach requires less energy and fewer steps, offering a more sustainable alternative for sourcing critical metals needed for batteries and clean technologies.",https://techxplore.com/news/2025-11-climate-friendly-metals-deep-sea.html,nickel technology innovation sustainability,copper,2025-12-05T05:16:18.926107
Cogne Acciai Speciali: 94% of the energy used comes from renewable sources and 93% of employees have permanent contracts,Cogne Acciai Speciali Official Website,"June 5, 2025","On World Environment Day 2025, Cogne Acciai Speciali released its first Group Sustainability Report highlighting that over 94% of the electricity used by the Group comes from certified renewable sources. The company emphasizes sustainability as a core part of its corporate strategy and reports that 93% of its employees have permanent contracts, reinforcing its commitment to responsible industrial practices.",https://www.cogne.com/en/post/press-release-23,Cogne Acciai Speciali news aluminum steel italy,general,2025-12-05T05:16:30.286223
Italy's Cogne Acciai Speciali launches green hydrogen pilot plant,Yieh.com,Not explicitly dated but recent,"Cogne Acciai Speciali has started operations at a green hydrogen pilot plant in Aosta, northern Italy, marking a significant step towards sustainable steel production. This initiative aligns with the company's ongoing commitment to innovation and environmental responsibility in the steel sector.",https://yieh.com/en/News/italys-cogne-acciai-speciali-launches-green-hydrogen-pilot-plant/156769,Cogne Acciai Speciali news aluminum steel italy,steel,2025-12-05T05:16:30.286239
Cogne Acciai Speciali finalises a 200 million euro share capital increase and the acquisition of Special Melted Products in UK,Cogne Acciai Speciali Official Website,Recent (2025),"Cogne Acciai Speciali completed a €200 million share capital increase to support growth and acquisitions, including the purchase of Special Melted Products in the UK. This move is part of the company's strategy to expand its footprint and strengthen its position in the specialty steel market.",https://www.cogne.com/en/blog,Cogne Acciai Speciali news aluminum steel italy,steel,2025-12-05T05:16:30.286250
Cogne Acciai Speciali signs Memorandum of Understanding for long term molybdenum supply,Greenland Resources Inc. Offering Document,"May 20, 2025","Cogne Acciai Speciali entered into a non-binding memorandum of understanding for long-term molybdenum supply with Greenland Resources, reflecting its strategic sourcing efforts for critical raw materials essential to steel production.","https://greenlandresources.ca/data/news/Greenland_Resources_Inc._-_LIFE_Offering_Document_-_Aug_5,_2025_FINAL.pdf",Cogne Acciai Speciali news aluminum steel italy,steel,2025-12-05T05:16:30.286256
Tenaris Reports 7% Drop in Quarterly Net Sales Amid Weakness in Europe and Brazil,MarketScreener,"December 4, 2025","Italian steel pipe manufacturer Tenaris posted a 7% decline in net sales for the second quarter of 2025, mainly due to lower deliveries in Europe and Brazil. The report highlights challenges in the European market impacting the company's performance.",https://www.marketscreener.com/news/tenaris-reports-7-drop-in-quarterly-net-sales-amid-weakness-in-europe-and-brazil-ce7c5fdcd18af421,Tenaris news steel italy,steel,2025-12-05T05:16:37.991405
"Tenaris Acquires isOplus Oil and Gas Division in $10M Deal, Expands Pipe Coating Business",Pipeline Journal,"December 4, 2025","Tenaris completed a $10 million acquisition of isOplus's oil and gas division, gaining ownership of pre-insulated pipeline systems used for district heating and anti-corrosion applications. This strategic move expands Tenaris's pipe coating business in the energy sector.",https://pipeline-journal.net/news/tenaris-acquires-isoplus-oil-and-gas-division-10m-deal-expands-pipe-coating-business,Tenaris news steel italy,general,2025-12-05T05:16:37.991430
"Edison Energia, Prysmian in 150MW Italy Solar PV PPA",PV Tech,"December 4, 2025","Prysmian signed a multi-year corporate power purchase agreement (PPA) with Edison Energia to purchase power from a 150MWp solar PV plant in Viterbo, Italy. This deal will supply about 25% of Prysmian's annual electricity consumption in Italy, supporting its sustainability goals and stable energy costs amid Italy's growing utility-scale solar market.",https://www.pv-tech.org/edison-energia-prysmian-in-150mw-italy-solar-pv-ppa/,Prysmian news copper cables italy,general,2025-12-05T05:16:49.912330
Northern Sun Energy and PowerFlex Announce Solar + Storage Behind-the-Meter Project for Prysmian Manufacturing,PR Newswire,"December 3, 2025","Northern Sun Energy and PowerFlex are developing a 7.5 MWp solar array with 1MW battery storage to power Prysmian's cable manufacturing plant in Du Quoin, Illinois. The facility produces copper medium voltage cables used in renewable energy, and the project will generate 50% of the plant's energy needs, reducing grid reliance and enhancing sustainability.",https://www.prnewswire.com/news-releases/northern-sun-energy-and-powerflex-announce-solar--storage-behind-the-meter-project-for-prysmian-manufacturing-302631434.html,Prysmian news copper cables italy,copper,2025-12-05T05:16:49.912348
"Prysmian Group speeds up innovation with the support of EIB and undertakes new projects in the areas of ultra-rapid telecom networks and smarter, more sustainable power grids",European Investment Bank (EIB),2022 (latest update),"Prysmian Group secured €135 million financing from the EIB to support innovation in submarine and land power transmission cables, dynamic cables for offshore renewables, e-mobility cable solutions, and smart cable systems for power grids. This investment aligns with Prysmian's strategy to promote digitalization and energy transition in Italy and Europe.",https://www.eib.org/en/press/all/2022-069-prysmian-group-speeds-up-innovation-with-the-support-of-eib-and-undertakes-new-projects-in-the-areas-of-ultra-rapid-telecom-networks-and-smarter-more-sustainable-power-grids,Prysmian news copper cables italy,general,2025-12-05T05:16:49.912364
