title,source,date,summary,url,query,category,fetched_at
Aluminum - Price - Chart - Historical Data - News,Trading Economics,"February 4, 2026","Aluminum prices fell to 3,052.15 USD/T on February 4, 2026, down 1.71% from the previous day, and also reported at 3,074 USD/T, down 1.00%. Over the past month, prices have declined slightly but remain 17.08% higher than a year ago. Recent news highlights aluminum hitting a 4-week low at 3031.00 USD/T on February 2, 2026.",https://tradingeconomics.com/commodity/aluminum,aluminum prices and market trends,aluminum,2026-02-05T05:49:14.104351
Aluminum Hits 4-week Low,Trading Economics,2026-02-02,"Aluminum decreased to 3031.00 USD/T, marking the lowest since January 2026. Over the past 4 weeks, prices gained 4.06%, and in the last 12 months, increased 20.13%. This reflects recent market volatility in the commodity.",https://tradingeconomics.com/commodity/aluminum,aluminum prices and market trends,aluminum,2026-02-05T05:49:14.104367
What Contractors Need to Know About Metal Prices Right Now - February 2026 Metal Roofing Market Update,YouTube (Thad Barnette),February 2026,"The update discusses tight aluminum supply leading to four-year price highs in the US, driven by global deficits worsened in 2026 and US constraints. It covers impacts from ingot values, premiums, energy costs, and winter weather on production. Contractors are advised on risk mitigation amid lean inventories and pricing volatility.",https://www.youtube.com/watch?v=GSDOsWpFCO8,aluminum prices and market trends,aluminum,2026-02-05T05:49:14.104373
US ALUMINUM: Extruders remain cautious for 2026 after an up-and-down 2025,S&P Global,2026-02-05T05:49:20.208228,"US aluminum extruders are cautious heading into 2026 following a mixed 2025 where early demand surges faded by mid-year, leading to drops in new business and shipments. Higher billet and tolling costs are expected, amid competition from imports and hopes for tariff reforms to boost demand. The Aluminum Association reports new orders up 5.1% but shipments down 1.4% through late 2025.",https://www.spglobal.com/energy/en/news-research/latest-news/metals/013026-us-aluminum-extruders-remain-cautious-for-2026-after-an-up-and-down-2025,aluminum production and capacity,aluminum,2026-02-05T05:49:20.208216
"Aluminum Prices Soar to Four-Year High, Creating a Divide in U.S. Industry",NAI500,"Feb 4, 2026","Aluminum prices on the LME have reached four-year highs, with US premiums exceeding $1 per pound, benefiting upstream producers like Alcoa and Century Aluminum while straining downstream manufacturers. Century Aluminum's Mt. Holly facility will add only 50,000 tons of capacity soon, insufficient to ease the supply deficit. Chinese producers profit from exports amid global tightness.",https://nai500.com/blog/2026/02/aluminum-prices-soar-to-four-year-high-creating-a-divide-in-u-s-industry/,aluminum production and capacity,aluminum,2026-02-05T05:49:20.208235
"AISIN, Toyota Tsusho and Minth Agree to Establish a Joint Venture to Produce Aluminum Body Frame Parts in North America",AISIN,"Feb. 5, 2026","AISIN, Toyota Tsusho, and Minth are forming ATM Automotive Parts Inc. in Ontario, Canada, to produce aluminum body frame parts for BEVs and PHEVs using extrusion technology. The venture aims to strengthen North American supply amid rising demand for lightweighting and electrification. Ownership is split 40% AISIN, 20% Toyota Tsusho, 40% Minth.",https://www.aisin.com/en/news/2026/010484.html,aluminum production and capacity,aluminum,2026-02-05T05:49:20.208241
Uzbekistan Launches Its First Aluminum Can Plant with IFC Support to Drive Sustainable Production,Funds for NGOs,"February 2, 2026","Uzbekistan's East Can Solutions, with $18 million in IFC financing, has launched the country's first greenfield aluminum can production plant in Tashkent. The facility will produce up to 1.1 billion fully recyclable aluminum cans annually, create over 200 direct jobs, and use energy-efficient equipment to reduce emissions while strengthening domestic supply and reducing import reliance.",https://news.fundsforngos.org/2026/02/02/uzbekistan-launches-its-first-aluminum-can-plant-with-ifc-support-to-drive-sustainable-production/,aluminum technology innovation sustainability,aluminum,2026-02-05T05:49:26.234572
Can-ification: Aluminium's Role in Circular Packaging,What They Think,"February 5, 2026","This article discusses aluminum cans as trusted solutions for sustainable beverage packaging, emphasizing their role in circular economy initiatives and sustainable packaging practices.",https://whattheythink.com/news/129149-can-ification-aluminiums-role-circular-packaging/,aluminum technology innovation sustainability,aluminum,2026-02-05T05:49:26.234587
HRC Steel - Price - Chart - Historical Data - News,Trading Economics,"February 5, 2026","HRC Steel fell to 971.06 USD/T on February 5, 2026, down 0.51% from the previous day. Over the past month, prices have risen 4.08%. Forecasts indicate trading at 986.72 USD/T by quarter-end and 1065.02 USD/T in 12 months.",https://tradingeconomics.com/commodity/hrc-steel,steel prices and market trends,steel,2026-02-05T05:49:33.701894
Steel Prices Rising Again? February 2026 Metal Market Update,Sheffield Metals,February 2026,"Steel prices continue to rise with extended lead times at mills, influenced by energy costs and winter weather. Inventory levels remain lean across the supply chain. Contractors are advised to manage risks for Q1 and Q2 projects amid pricing volatility.",https://sheffieldmetals.com/learning-center/video/steel-prices-rising-again-february-2026-metal-roofing-market-update-video/,steel prices and market trends,steel,2026-02-05T05:49:33.701910
"Feb 2026 Metals Market: Pricing, Supply & Buyer Insights",Continental Steel & Tube,February 2026,Carbon and alloy steel markets remain balanced with spot pricing stable at ±2–4%. Price volatility of 3–8% has occurred since Q4 2025 due to energy costs and supply decisions. Buyers should evaluate Q2–Q3 needs amid tight inventories.,https://continentalsteel.com/blog/feb-2026-metals-market-insights/,steel prices and market trends,steel,2026-02-05T05:49:33.701924
Global Iron and Steel Prices and News 05.02.2026,SteelRadar,"February 5, 2026","Daily updates on global iron and steel prices, including Shanghai Futures Rebar terms and regional futures for Turkey, China, Europe, and North America as of February 3-4, 2026. Provides indices, analyses, and market comments.",https://www.steelradar.com/en/,steel prices and market trends,steel,2026-02-05T05:49:33.701930
What Contractors Need to Know About Metal Prices Right Now,The Metal Roofing Channel (YouTube),"February 2, 2026","Steel market prices continue to rise at domestic mills with slightly increased production. Discussion covers rising steel prices, extended lead times, energy impacts, and lean inventories. Advice for contractors on managing projects and margins amid volatility.",https://www.youtube.com/watch?v=GSDOsWpFCO8,steel prices and market trends,steel,2026-02-05T05:49:33.701936
"US raw steel production is down 1.1 percent - week 5, 2026",SteelOrbis,"Week ending January 31, 2026","US raw steel production was 1.758 million net tons for the week ending January 31, 2026, down 1.1% from the prior week at 76.0% capacity utilization. Year-to-date production is up 3.4% from 2025.",https://www.steelorbis.com/steel-news/latest-news/us-raw-steel-production-is-down-11-percent-week-5-2026-1433506.htm,steel prices and market trends,steel,2026-02-05T05:49:33.701941
"US raw steel production is down 1.1 percent - week 5, 2026",SteelOrbis,"Week ending January 31, 2026","US domestic raw steel production for the week ending January 31, 2026, was 1.758 million net tons at a capacity utilization rate of 76.0 percent, down 1.1 percent from the previous week. This represents a 3.4 percent increase from the same week in 2025. Adjusted year-to-date production through January 31, 2026, was 7.774 million net tons at 76.0 percent capacity utilization, up 3.4 percent year-over-year.",https://www.steelorbis.com/steel-news/latest-news/us-raw-steel-production-is-down-11-percent-week-5-2026-1433506.htm,steel production and capacity,steel,2026-02-05T05:49:39.922351
What Contractors Need to Know About Metal Prices Right Now - February 2026 Metal Roofing Market Update,YouTube (Metal Roofing Expert Thad Barnette),February 2026,"The video discusses rising steel mill prices, extended lead times, tight aluminum supply, and impacts from energy costs and winter weather on production. It highlights lean inventory levels across the supply chain and backlogs affecting steel delivery in January 2026. Contractors are advised to monitor the market closely for upcoming demand signals and pricing volatility.",https://www.youtube.com/watch?v=GSDOsWpFCO8,steel production and capacity,aluminum,2026-02-05T05:49:39.922365
MEPS's global steel production and capacity round-up,MEPS International,Recent (references February 2026 decision),"The article provides a global overview of steel production and capacity updates. It mentions a pending decision in February 2026 on certain measures, effective from April 1, and proposals by the TRA to narrow the scope of investigations. This round-up covers key developments in the steel sector.",https://mepsinternational.com/gb/en/news/meps-s-global-steel-production-and-capacity-round-up-20,steel production and capacity,steel,2026-02-05T05:49:39.922371
"Copper Prices Pull Back Sharply, Downstream Users Replenish Stocks Moderately, Spot Premiums Rise Significantly [SMM Southern China Spot Copper]",SMM (metal.com),Feb. 5,"Spot copper prices in Guangdong fell sharply, with #1 copper cathode averaging 101,565 yuan/mt, down 3,075 yuan/mt from the previous day. Downstream users moderately replenished stocks amid the pullback, while traders actively purchased for arbitrage, leading to improved trading and significantly higher spot premiums. Guangdong inventory increased slightly due to higher arrivals.",https://news.metal.com/en/newscontent/103756613-Copper-Prices-Pull-Back-Sharply-Downstream-Users-Replenish-Stocks-Moderately-Spot-Premiums-Rise-Significantly-SMM-Southe,copper prices and market trends,copper,2026-02-05T05:49:48.828817
Copper Prices Retreat Amid Demand Concerns,Sharecafe,2026/02/05,"Copper prices reversed earlier gains amid signs of softening demand, with LME inventories rising in Asian warehouses and extra spot cargoes moving from Africa to China. China's Nonferrous Metals Industry Association forecasts a 5% increase in refined copper output this year, dampening investor enthusiasm despite calls for strategic reserves. This bearish sentiment overshadows initial positive reactions to reserve-boosting suggestions.",https://www.sharecafe.com.au/2026/02/05/copper-prices-retreat-amid-demand-concerns/,copper prices and market trends,copper,2026-02-05T05:49:48.828836
"Latest updates on metals prices worldwide at 0200 GMT, Feb. 5",Xinhua (english.news.cn),2026-02-05,"London Stock Exchange Group reported copper prices at 5.83 USD at 0200 GMT on Feb. 5. This update includes prices for other metals like gold at 4,988.00 USD and iron ore at 102.17 USD. The data reflects the latest worldwide metals pricing snapshot.",https://english.news.cn/20260205/160dd22086d442a9bd90369d375f7a63/c.html,copper prices and market trends,steel,2026-02-05T05:49:48.828843
Refined copper output growth to slow in 2026: ICSG,MINING.COM,"February 05, 2026","Copper output growth is expected to slow to 0.9% in 2026, down from 3.4% in 2025, according to Paul White at the World Copper Conference. World copper mine production is forecast to rise by 2.3%, while refined copper usage grows by 2.1%, leading to a 150,000-metric ton market deficit.",https://www.mining.com/web/refined-copper-output-growth-to-slow-in-2026-icsg/,copper production and capacity,copper,2026-02-05T05:49:54.363386
Physical Copper Gains Attention as Investors Seek Stability Amid Market Volatility,EIN Presswire,"February 05, 2026, 05:31","Physical copper is gaining investor interest due to its role in electrification, renewables, EVs, and data centers amid supply constraints. Demand is rising with energy transition, while new mining projects face 10-15 year delays and declining ore grades. Analysts highlight risks of supply bottlenecks as structural demand surges.",https://www.einpresswire.com/article/889411025/physical-copper-gains-attention-as-investors-seek-stability-amid-market-volatility,copper production and capacity,copper,2026-02-05T05:49:54.363405
Copper Prices Retreat Amid Demand Concerns,Sharecafe,2026/02/05,"Copper prices reversed gains due to softening demand signals, rising LME inventories in Asia, and extra supply from Africa to China. China's Nonferrous Metals Industry Association forecasts a 5% increase in refined copper output this year. This offsets earlier positivity from calls to boost strategic reserves.",https://www.sharecafe.com.au/2026/02/05/copper-prices-retreat-amid-demand-concerns/,copper production and capacity,copper,2026-02-05T05:49:54.363413
Creation of a Leading Gold and Copper Producer,Foran Mining,"February 2, 2026","Eldorado and Foran announce a transaction to combine into a leading gold and copper producer, with world-class projects like McIlvenna Bay and Skouries entering commercial production in mid-2026. The combined entity highlights high-margin free cash flow, strong balance sheet, and enhanced copper exposure from long-life assets. Emerging scanning technologies and orebody knowledge studies are redefining near-mine opportunities at McIlvenna Bay.",https://foranmining.com/wp-content/uploads/2026/02/Eldorado-and-Foran-Transaction-Investor-Presentation-2-Feb-26-5.pdf,copper technology innovation sustainability,copper,2026-02-05T05:50:02.082998
Teck Announces 2025 Production and Sales Update and Reaffirms Outlook,Teck,2026 (Q4 2025 update),"Teck reports 2025 annual copper production of 453,500 tonnes, in line with guidance, supported by strong Q4 performance at Quebrada Blanca despite inventory buildup from weather delays. The company reaffirms 2026-2028 production guidance for operated sites, with updated zinc guidance for Antamina but unchanged copper production outlook. Focus remains on operational stability and progress toward steady-state production.",https://www.teck.com/news/news-releases/2026/teck-announces-2025-production-and-sales-update-and-reaffirms-outlook,copper technology innovation sustainability,copper,2026-02-05T05:50:02.083016
Rio Tinto and Amazon Web Services collaborate to bring low-carbon Nuton copper to U.S. data centres,Rio Tinto,Early 2026,"Rio Tinto and AWS enter a two-year agreement for AWS to use the first Nuton copper produced in U.S. data center components, emphasizing low-carbon production technology. Nuton represents an innovative approach to copper extraction aimed at sustainability. This collaboration supports sustainable supply chains for critical tech infrastructure.",https://www.riotinto.com/en/news/releases/2026/rio-tinto-and-amazon-web-services-collaborate-to-bring-low-carbon-nuton-copper-to-u-s--data-centres,copper technology innovation sustainability,copper,2026-02-05T05:50:02.083025
It All Comes Back to Supply Chains,Cleantech Group,Early 2026,"The article discusses supply chain challenges in cleantech, highlighting Amazon Web Services' early 2026 strategic agreement with Rio Tinto to secure copper from Nuton technology. This deal underscores efforts to ensure sustainable, low-carbon copper supplies for data centers amid growing demand. It ties into broader themes of innovation and sustainability in critical mineral supply chains.",https://cleantech.com/it-all-comes-back-to-supply-chains/,copper technology innovation sustainability,copper,2026-02-05T05:50:02.083034
[SMM Nickel Midday Review] Nickel Prices Drop Slightly on February 5 as US January ADP Employment Data Falls Short of Expectations,news.metal.com,"February 5, 2026","On February 5, SMM #1 refined nickel prices averaged 139,850 yuan/mt, down 1,750 yuan/mt from the previous day, amid weak US ADP employment data. The SHFE nickel futures contract (2603) closed at 133,510 yuan/mt, down 1.79%. Despite macro pressures, expectations for reduced nickel ore quotas in Indonesia suggest potential future rebounds.",https://news.metal.com/en/newscontent/103757330-SMM-Nickel-Midday-Review-Nickel-Prices-Drop-Slightly-on-February-5-as-US-January-ADP-Employment-Data-Falls-Short-of-Expe,nickel prices and market trends,nickel,2026-02-05T05:50:07.840979
Nickel prices surge on Feb 5 amid concerns over trade war ease,yieh.com,"February 5, 2026","LME nickel futures rose by US$265/ton to close at US$15,535/ton on February 5. The nickel spot price also increased amid easing concerns over trade wars. This surge reflects positive market sentiment in the nickel sector.",https://www.yieh.com/en/News/nickel-prices-surge-on-feb-5-amid-concerns-over-trade-war-ease/152734,nickel prices and market trends,nickel,2026-02-05T05:50:07.840996
[SMM Analysis] Nickel Sulphate Prices Edge Down as Chinese New Year Approaches Amid Weak Market Sentiment,news.metal.com,"February 5, 2026","The SMM battery-grade nickel sulphate index stood at 31,939 yuan/mt as of Thursday, with prices edging down ahead of Chinese New Year. Weak market sentiment contributed to the decline in nickel sulphate quotations. This reflects broader softening in nickel-related products.",https://news.metal.com/en/newscontent/103757592-SMM-Analysis-Nickel-Sulphate-Prices-Edge-Down-as-Chinese-New-Year-Approaches-Amid-Weak-Market-Sentiment,nickel prices and market trends,nickel,2026-02-05T05:50:07.841005
Nornickel sees 2026 nickel output broadly in line with previous year,Mining.com,"February 5, 2026","Russia's Nornickel, the world's largest palladium producer and major nickel producer, expects 2026 nickel output of 193,000–203,000 metric tons, broadly in line with 2025 production of 198,521 tons. The company attributes recent production declines to ore reserve depletion and Western sanctions restricting equipment access, but expects recovery by 2028 through development of the Oktyabrskoye deposit.",https://www.mining.com/web/nornickel-sees-2026-nickel-output-broadly-in-line-with-previous-year/,nickel production and capacity,nickel,2026-02-05T05:50:16.386763
Nickel Futures Rise from 1-Month Low,Trading Economics,February 2026,"Nickel futures rebounded to around $17,500 per tonne from a one-month low of $17,000, driven by tightening global supply conditions. Indonesia, the world's largest nickel ore producer, confirmed it will cut mining permits to 260 million wet tons in 2026 from 379 million tons in 2025, signaling reduced nickel feedstock availability.",https://tradingeconomics.com/commodity/nickel/news/522891,nickel production and capacity,nickel,2026-02-05T05:50:16.386781
Nickel Market at Inflection Point as Government Support Accelerates Western Projects,Crux Investor,February 2026,"Ardea Resources and Canada Nickel are advancing large-scale nickel development projects with government backing, with 2026-2027 construction milestones targeted. These Western projects aim to address supply constraints from Indonesia and reduce Chinese dominance in nickel supply chains, with Ardea's Goongarrie Hub alone holding 1.2 million tons of nickel reserves.",https://www.cruxinvestor.com/posts/nickel-market-at-inflection-point-as-government-support-accelerates-western-projects,nickel production and capacity,nickel,2026-02-05T05:50:16.386791
Robin Zeng: Unlocking the Sustainable Energy Era with Zero Carbon Technology,PRNewswire,"February 4, 2026","Dr. Robin Zeng, Chairman and CEO of CATL, discussed the future of sustainable energy, highlighting renewable energy applications and grid-forming energy storage technology. CATL has achieved industry-leading recovery rates of 99.6% for nickel and cobalt, and 96.5% for lithium, demonstrating commitment to circular economy principles in zero-carbon energy systems.",https://www.prnewswire.com/news-releases/robin-zeng-unlocking-the-sustainable-energy-era-with-zero-carbon-technology-302679261.html,nickel technology innovation sustainability,nickel,2026-02-05T05:50:22.882190
"Rare Earth Newsletter (February 2, 2026) - A Weekly Intelligence Brief",Energy Central,"February 2, 2026","This intelligence brief covers the U.S. critical minerals sector, noting 100% import reliance for 12 minerals and highlighting nickel's market volatility as a financing risk. The report identifies opportunities in stockpiling, diversification, and demand growth potential, with storage technology expected to outperform through 2030.",https://www.energycentral.com/energy-biz/post/rare-earth-newsletter-february-2-2026-a-weekly-intelligence-brief-on-txLNuvk9NGz33kD,nickel technology innovation sustainability,nickel,2026-02-05T05:50:22.882210
The first Energy Release contract in the Aosta Valley is underway: agreement signed between the CVA Group and Cogne Acciai Speciali,Cogne Acciai Speciali - Press Release,Not specified,"CVA will construct four new photovoltaic plants in Sicily with over 20 MW capacity, expected to produce 593,600 MWh fully operational by 2026. This marks the first Energy Release agreement in the Aosta Valley and supports the region's green energy transition and European Green Deal goals. Cogne Acciai Speciali will benefit from enhanced energy performance and reduced environmental impact through this partnership.",https://www.cogne.com/en/post/press-release-24,Cogne Acciai Speciali news aluminum steel italy,general,2026-02-05T05:50:30.948324
Cogne Strengthens Market Position with Acquisition of Mannesmann Stainless Tubes for Seamless Stainless Steel Pipes,Tube Trade Fair,"November 1, 2025","Cogne Acciai Speciali completed the €135 million acquisition of Mannesmann Stainless Tubes from German steelmaker Salzgitter. The acquisition significantly expands Cogne's market presence in seamless stainless steel and nickel alloy tubes, with facilities in Germany, France, Italy, and the USA being rebranded as DMV.",https://www.tube-tradefair.com/en/Media_News/News/Industry_News/Cogne_Strengthens_Market_Position_with_Acquisition_of_Mannesmann_Stainless_Tubes_for_Seamless_Stainless_Steel_Pipes,Cogne Acciai Speciali news aluminum steel italy,steel,2026-02-05T05:50:30.948351
Tenaris in Italy achieves ASME certification for the supply of materials for the nuclear sector,Tenaris.com,2026-02-05T05:50:37.408332,"Dalmine, Tenaris's seamless steel pipe mill in Italy, has obtained ASME III certification for supplying materials to nuclear facilities. This accreditation enables Tenaris to participate in both new nuclear plant constructions and maintenance of existing ones globally. The certification supports the nuclear sector's role in low-carbon energy transition amid increasing decarbonization efforts.",https://www.tenaris.com/en/news/2025/tenaris-in-italy-achieves-asme-certification-for-the-supply-of-materials-for-the-nuclear-sector,Tenaris news steel italy,steel,2026-02-05T05:50:37.408321
"Tenaris Acquires isOplus Oil and Gas Division in $10M Deal, Expands Pipe Coating Business",Pipeline Journal,2026-02-05T05:50:37.408347,"Tenaris acquired the oil and gas division of isOplus for $10 million, gaining pre-insulated pipeline systems and anti-corrosion coatings expertise in Europe. The unit has been rebranded as Tenaris Coating Italy, allowing coatings to be applied at Tenaris facilities in Italy, Mexico, Argentina, and Brazil. This move aims to reduce delivery times, ensure quality, cut costs, and lower environmental impact for the offshore market.",https://pipeline-journal.net/news/tenaris-acquires-isoplus-oil-and-gas-division-10m-deal-expands-pipe-coating-business,Tenaris news steel italy,general,2026-02-05T05:50:37.408345
Pipe producer tightens its grip on giant Black Sea project with double contract win,Offshore Energy,"February 4, 2026",Tenaris secured a double contract win for the Sakarya Gas Project in the Black Sea. The contracts involve providing advanced tubular and pipeline solutions for Phase 3 development in ultra-deepwater conditions. This strengthens Tenaris's involvement in Turkey's major offshore gas initiative.,https://www.offshore-energy.biz/pipe-producer-tightens-its-grip-on-giant-black-sea-project-with-double-contract-win/,Tenaris news steel italy,general,2026-02-05T05:50:37.408357
Tenaris wins supply deal for third phase of Sakarya gas field project,Yieh.com,2026-02-05T05:50:37.408368,Tenaris won a supply deal to provide essential equipment and services for Phase 3 of the Sakarya gas field project in the Black Sea's ultra-deep waters. The contract supports scaling production and extending the field's development. It includes offshore drilling casing with Dopeless dry-lubricant technology for improved efficiency and safety.,https://yieh.com/en/News/tenaris-wins-supply-deal-for-third-phase-of-sakarya-gas-field-project/159048,Tenaris news steel italy,general,2026-02-05T05:50:37.408366
