title,source,date,summary,url,query,category,fetched_at
"Nickel Asia Q3 profit jumps to P3.09B on higher ore prices, exports",BusinessWorld,"November 13, 2025","Nickel Asia Corporation (NAC) reported a 10.95% increase in share price following a Q3 profit of P3.09 billion, driven by higher nickel ore prices and exports. The company sold 13.89 million WMT of nickel ore in the first nine months, with export prices rising 51.66% amid tight supply due to stricter Indonesian production permit policies. NAC is also diversifying into copper and gold through its joint venture and expanding renewable energy projects.",https://www.bworldonline.com/corporate/2025/11/13/711926/nickel-asia-q3-profit-jumps-to-p3-09b-on-higher-ore-prices-exports/,nickel production and capacity,copper,2025-11-13T05:16:07.086216
PE eyes BHP's Nickel West as China tightens rare earth grip,Forbes (via Markets Group),"November 13, 2025","Private equity firms are showing renewed interest in BHP's Nickel West amid China's tightening control over rare earth exports. Nickel prices have halved over three years due to Indonesian low-cost production, but nickel's strategic importance in electric vehicle batteries is increasing. Japanese companies have acquired stakes in Australian nickel projects to diversify supply chains, while potential buyers face high rehabilitation costs at Nickel West.",https://www.marketsgroup.org/news/pe-eyes-bhps-nickel-west-as-china-tightens-rare-earth-grip,nickel production and capacity,nickel,2025-11-13T05:16:07.086235
"On November 13, the SMM #1 refined nickel price was ...",Metal News,"November 13, 2025","The Shanghai Metals Market (SMM) reported that the #1 refined nickel price ranged from 118,600 to 122,700 yuan per metric ton on November 13, with an average price of 120,650 yuan/mt, marking a slight increase of 200 yuan/mt from the previous day.",https://news.metal.com/newscontent/103618599/,nickel production and capacity,nickel,2025-11-13T05:16:07.086243
"Nickel mine, hydroelectric project to be added to major projects list",Energy Now,"November 13, 2025","Canada plans to add the Crawford Nickel Project in Ontario and a hydroelectric project in Nunavut to its major projects list, highlighting the growing importance of nickel mining and renewable energy infrastructure in the country.",https://energynow.ca/2025/11/nickel-mine-hydroelectric-project-to-be-added-to-major-projects-list/,nickel production and capacity,nickel,2025-11-13T05:16:07.086250
Aqua Metals and Westwin Elements Sign LOI for U.S.-Produced Nickel Carbonate Supply,GlobeNewswire,2025-11-10,"Aqua Metals and Westwin Elements have signed a Letter of Intent to supply up to 1,000 metric tons of recycled nickel carbonate annually, marking a significant step toward a sustainable and secure domestic supply chain for battery-grade nickel in the U.S. The collaboration leverages Aqua Metals' AquaRefining™ technology to produce high-purity, low-carbon nickel carbonate from lithium-ion battery black mass.",https://www.globenewswire.com/news-release/2025/11/10/3184463/36806/en/Aqua-Metals-and-Westwin-Elements-Sign-LOI-for-U-S-Produced-Nickel-Carbonate-Supply.html,nickel technology innovation sustainability,nickel,2025-11-13T05:16:16.517250
Recycling technology achieves 99% purity of nickel and cobalt,TechXplore,2025-11-10,"A research team at UNIST has developed a new recycling method that recovers over 95% of nickel and cobalt from spent batteries with a purity exceeding 99%. The process uses a selective electrochemical separation technique with a multifunctional solvent, reducing chemical use and wastewater compared to traditional wet recycling.",https://techxplore.com/news/2025-11-recycling-technology-purity-nickel-cobalt.html,nickel technology innovation sustainability,nickel,2025-11-13T05:16:16.517268
New recycling tech recovers nearly pure nickel and cobalt from old batteries,Interesting Engineering,2025-11-10,"Researchers have unveiled an eco-friendly recycling technology that extracts 99% pure nickel and cobalt from used electric vehicle batteries. The method is more sustainable and efficient than conventional processes, minimizing chemical waste and supporting a greener battery recycling ecosystem.",https://interestingengineering.com/energy/recycling-nickel-cobalt-ev-batteries,nickel technology innovation sustainability,nickel,2025-11-13T05:16:16.517276
"Valbruna, esplode la rabbia dei sindacati: «La questione è politica»",Corriere dell'Alto Adige,2025-11-09,"The article discusses labor union concerns at Valbruna steelworks in Bolzano, with references to Cogne Acciai Speciali as a potential model for how the Valle d'Aosta region successfully managed a similar industrial transition. The government has indicated it may use special powers to protect Valbruna's strategic status in national steel production.",https://corrieredellaltoadige.corriere.it/notizie/politica/25_novembre_09/valbruna-esplode-la-rabbia-dei-sindacati-la-questione-e-politica-c-e-chi-vuole-cacciare-le-acciaierie-da-bolzano-86647200-ec5a-498c-a813-b5579765exlk.shtml,Cogne Acciai Speciali news aluminum steel italy,steel,2025-11-13T05:16:24.332162
"Italy's Tenaris posts surprise 2% rise in sales on stable US, Canada drilling",Investing.com (Reuters),"October 29, 2025","Italian steel pipe maker Tenaris reported a 2% increase in third-quarter net sales to $2.98 billion, driven by stable drilling activity in the US and Canada, offsetting weakness in other regions. Despite the sales rise, the company warned that margins would be impacted by the full effect of tariff costs, with EU steel producers operating at reduced capacity due to rising imports and tariffs.",https://www.investing.com/news/stock-market-news/italys-tenaris-posts-surprise-2-rise-in-sales-on-stable-us-canada-drilling-4317727,Tenaris news steel italy,steel,2025-11-13T05:16:51.125001
Tenaris hosts panel on nuclear energy and Italy's boilermaking future,Tenaris Official News,November 2025 (exact date not specified),"Tenaris held a panel discussion in Italy focusing on the strategic role of nuclear energy in Europe's energy transition and Italy's boilermaking industry. The company highlighted its recent accreditation to supply certified materials for nuclear facilities, emphasizing its commitment to quality and safety standards aligned with international codes.",https://www.tenaris.com/en/news/2025/tenaris-hosts-panel-on-nuclear-energy-and-italy-s-boilermaking-future,Tenaris news steel italy,general,2025-11-13T05:16:51.125021
"Tenaris Acquires isOplus Oil and Gas Division in $10M Deal, Expands Pipe Coating Business",Pipeline Journal,November 2025 (exact date not specified),"Tenaris acquired the oil and gas division of isOplus for $10 million, gaining ownership of pre-insulated pipeline systems and anti-corrosion coatings in Europe. The acquisition strengthens Tenaris's offshore market offerings and allows application of anti-corrosion coatings at its facilities in Italy and other countries, improving delivery times and reducing environmental impact.",https://www.pipeline-journal.net/news/tenaris-acquires-isoplus-oil-and-gas-division-10m-deal-expands-pipe-coating-business,Tenaris news steel italy,general,2025-11-13T05:16:51.125031
Tenaris Launches $600M Second Tranche Under $1.2B Buyback,StockTitan.net,"November 3, 2025","Tenaris commenced the second tranche of its $1.2 billion share buyback program, worth $600 million, running from November 3, 2025, to April 30, 2026. The shares purchased under this program will be cancelled, and the buyback complies with EU market abuse regulations.",https://www.stocktitan.net/news/TS/tenaris-to-commence-a-usd-600-million-second-tranche-of-its-usd-1-2-3uvfs8tfk3a1.html,Tenaris news steel italy,general,2025-11-13T05:16:51.125039
Italy's Tenaris to invest US$200 million in Colombian mill,Yieh.com,November 2025 (exact date not specified),"Tenaris plans to invest $200 million to build a new heat treatment mill in Colombia, incorporating advanced technology for ultrasound inspection and finishing. This investment aims to enhance the production of sophisticated steel products for the energy sector.",https://yieh.com/en/News/italys-tenaris-to-invest-us200-million-in-colombian-mill/56956,Tenaris news steel italy,steel,2025-11-13T05:16:51.125044
Copper Cables: Antitrust Launches Investigation into Alleged Cartel,First Online,"November 12, 2025","The Italian Antitrust Authority has opened an investigation into major low voltage copper cable manufacturers in Italy, including Prysmian, for alleged price fixing since 2005. Inspections were conducted at company offices and distributors, impacting Prysmian's stock price negatively. Analysts believe the investigation will have a negligible impact on Prysmian due to the small market share of low voltage copper cables in its revenue.",https://www.firstonline.info/en/copper-cables-antitrust-launches-investigation-into-alleged-cartel-prysmian-and-nexans-stock-market-drops/,Prysmian news copper cables italy,copper,2025-11-13T05:17:01.561962
Prysmian lifts 2025 outlook after Q3 beat on strong transmission growth,Investing.com,"November 7, 2025","Prysmian raised its full-year 2025 guidance after reporting third-quarter revenue of €5.03 billion, exceeding expectations. Strong growth was driven by Renewable Transmission and Power Grids segments, with a stable high-voltage backlog of about €16 billion. Analysts note that benefits from copper tariffs are likely to be seen more in 2026.",https://www.investing.com/news/earnings/prysmian-lifts-2025-outlook-after-q3-beat-on-strong-transmission-growth-4317981,Prysmian news copper cables italy,copper,2025-11-13T05:17:01.561985
Prysmian further extends its leadership in optical fibre innovation with world’s first 160 micron bend insensitive fibre,Prysmian Official Website,"November 10, 2025","Prysmian announced the launch of the world's first 160 micron bend insensitive optical fibre, marking a significant advancement in network miniaturization. This innovation reinforces Prysmian's position as a leader in optical fibre technology and cable solutions globally.",https://www.prysmian.com/en,Prysmian news copper cables italy,general,2025-11-13T05:17:01.561997
