title,source,date,summary,url,query,category,fetched_at
Green Transition Ignites Demand While Supply Scarcity Fuels Volatility,Times Online,"November 14, 2025","Recent market trends show that the global energy transition is driving strong copper demand, while supply constraints are causing price volatility. The article emphasizes the need for accelerated investment in sustainable mining, recycling, and innovative technologies to meet future demand and secure ethical supply chains.",http://business.times-online.com/times-online/article/marketminute-2025-11-14-coppers-crucible-green-transition-ignites-demand-while-supply-scarcity-fuels-volatility,copper technology innovation sustainability,copper,2025-11-15T05:14:18.405079
Copper: Wired for the Future,Sprott,"November 15, 2025","Copper is central to the clean energy transition, with demand projected to reach 61% of global energy use by 2040. The article discusses the supply and demand imbalance, the importance of investment in sustainable mining, and the role of M&A activity in securing future copper supplies.",https://sprott.com/insights/copper-wired-for-the-future/,copper technology innovation sustainability,copper,2025-11-15T05:14:18.405085
Copper Ore Concentrate & Gold Copper Concentrate 2025,Farmonaut,"November 15, 2025","Technological innovations in copper concentrate processing are driving sustainability, with closed-loop water systems, reduced emissions, and improved tailings management. Satellite technology and digital solutions are also enhancing efficiency and transparency in mining operations.",https://farmonaut.com/mining/copper-ore-concentrate-gold-copper-concentrate-2025,copper technology innovation sustainability,copper,2025-11-15T05:14:18.405109
"Nickel prices fell sharply on November 14, as concerns over the US Fed's hawkish stance triggered cautious market sentiment",SMM/Buzz FX,2025-11-14,"Nickel prices dropped sharply on November 14 amid concerns about the US Federal Reserve's hawkish monetary policy, which led to cautious sentiment in the market. The decline reflects broader macroeconomic worries affecting commodity prices.","https://m.netdania.com/news/%5BSMM%20Nickel%20Midday%20Review%5D%20Nickel%20prices%20fell%20sharply%20on%20November%2014,%20as%20concerns%20over%20the%20US%20Fed's%20hawkish%20stance%20triggered%20cautious%20market%20sentiment.%20%7C%20SMM/Buzz%20FX/%7Bna:%5B%7Bt:%5B%22BUZZ_FX_GF%22%5D%7D%5D,hf:0%7D/tcnews/1dee7009fe486533b21694a605d8213917eb49e2@%7B%22Syms%22:%5B%5D,%22Inf%22:%7B%22PBL%22:%22Shanghai%20Metals%20Market%22%7D%7D/1763093721",nickel prices and market trends,nickel,2025-11-15T05:14:29.939608
Nickel - Price - Chart - Historical Data - News,Trading Economics,2025-11-14,"Nickel prices fell to 14,880 USD/T on November 14, down 0.53% from the previous day, with a 1.78% decline over the past month. The market remains oversupplied, especially due to increased output from Indonesia, and prices are significantly lower than last year.",https://tradingeconomics.com/commodity/nickel,nickel prices and market trends,nickel,2025-11-15T05:14:29.939625
Live Nickel Price per Metric Ton in USD,GoldPricez,2025-11-15,"The live nickel price per metric ton in USD is updated continuously, reflecting global market movements. Prices are influenced by EV battery demand, stainless steel output, and supply from Indonesia and the Philippines.",https://goldpricez.com/us/nickel,nickel prices and market trends,steel,2025-11-15T05:14:29.939630
The Market In Numbers - 15 Nov 2025,FNArena.com,2025-11-15,"Nickel prices showed a slight decline on November 15, with a 0.06% drop, continuing a trend of weakness over the past week and month. The broader market remains cautious amid ongoing oversupply concerns.",https://fnarena.com/index.php/2025/11/15/the-market-in-numbers-15-nov-2025/,nickel prices and market trends,nickel,2025-11-15T05:14:29.939637
FLASH: Indonesia restricts new nickel smelters to boost value-added production,Mysteel.net,"November 10, 2025","The Indonesian government has issued a regulation limiting the development of new nickel smelters, focusing on shifting investments from semi-finished nickel products to higher value-added finished products such as raw materials for electric vehicle batteries. This policy aims to support nickel prices and strengthen the domestic downstream processing industry.",https://www.mysteel.net/news/5103882-flash-indonesia-restricts-new-nickel-smelters-to-boost-value-added-production,nickel production and capacity,nickel,2025-11-15T05:14:44.734465
Energy Minister Tim Hodgson highlights Canada Nickel's Crawford mine,YouTube (CBC News),"November 13, 2025","Canada Nickel's Crawford mine in Ontario is being fast-tracked for approval as a major project, with a projected lifespan of over 40 years and potential to become one of the top 10 nickel producers globally. The project emphasizes low carbon emissions and plans expansions to produce other metals and develop nickel refining and stainless steel production.",https://www.youtube.com/watch?v=2nbgGz0_GzA,nickel production and capacity,steel,2025-11-15T05:14:44.734480
Fathom Nickel expands Gochager Lake footprint,Mining.com.au,"November 15, 2025","Fathom Nickel is advancing exploration at its Gochager Lake Project in Saskatchewan, Canada, with promising soil geochemistry and rock assay results indicating potential for a significant nickel district. The company is preparing for a drilling campaign supported by winter conditions and infrastructure development.",https://mining.com.au/fathom-nickel-expands-gochager-lake-footprint/,nickel production and capacity,nickel,2025-11-15T05:14:44.734489
Lifezone Metals raises US$15 million to advance work on Kabanga nickel project,African Mining Market,"November 14, 2025","Lifezone Metals has launched a $15 million direct share offering to fund advancement of its Kabanga nickel project in Tanzania, aiming to develop one of the world's largest undeveloped high-grade nickel sulfide deposits.",https://africanminingmarket.com/lifezone-metals-raises-usd15-million-to-advance-work-on-kabanga-nickel-project/24219/,nickel production and capacity,nickel,2025-11-15T05:14:44.734497
Indonesia reopens nickel mine in dive hotspot despite outcry,Macau Business,"November 9, 2025","The Indonesian government has permitted a nickel mining company to resume operations in an eastern archipelago dive hotspot, despite environmental concerns and public outcry. This move reflects Indonesia's ongoing prioritization of nickel production amid global demand.",https://www.macaubusiness.com/indonesia-reopens-nickel-mine-in-dive-hotspot-despite-outcry/,nickel production and capacity,nickel,2025-11-15T05:14:44.734504
The Future of Nickel Alloy Innovations in Sustainable Manufacturing,Eraum Alloy Blog,2025,"Nickel alloy innovations are advancing sustainable manufacturing by improving battery performance and longevity, reducing environmental footprints. New nickel alloys are lighter, stronger, and more corrosion-resistant, contributing to efficiency improvements in aerospace, automotive, and energy sectors. Challenges include cost-effective manufacturing and sustainable raw material sourcing.",https://www.eraumalloy.com/blog/nickel-alloy-innovations-in-sustainable-manufacturing/,nickel technology innovation sustainability,nickel,2025-11-15T05:14:57.700247
Canada's Nickel Processing Innovation for Clean Energy,Discovery Alert,2025,"Canada is pioneering sustainable nickel processing technologies that integrate renewable energy, closed-loop water systems, and carbon sequestration to achieve net-zero emissions. Innovations include advanced leaching chemistry, energy efficiency improvements, and circular economy practices such as multi-metal recovery and tailings repurposing. These efforts support clean energy applications and strengthen supply chain security for EV manufacturers.",https://discoveryalert.com.au/canada-nickel-processing-revolution-global-clean-energy-2025/,nickel technology innovation sustainability,nickel,2025-11-15T05:14:57.700265
"Genomines raises $45M to grow nickel from plants, not mines",AgTech Navigator,"October 7, 2025","French start-up Genomines secured $45 million to scale its innovative method of extracting nickel from plants instead of traditional mining. This approach offers higher purity nickel, faster deployment, and lower costs, with ongoing pilot projects involving major automakers. The technology aims to complement traditional mining by providing a cleaner, scalable nickel source.",https://www.agtechnavigator.com/Article/2025/10/07/genomines-raises-45m-to-grow-nickel-from-plants-not-mines/,nickel technology innovation sustainability,nickel,2025-11-15T05:14:57.700274
Recycling technology achieves 99% purity of nickel and cobalt from spent batteries,Tech Xplore,November 2025,"A research team at UNIST developed a novel recycling technology that recovers over 95% of nickel and cobalt from waste batteries with purity exceeding 99%. This electrochemical separation process uses a multifunctional solvent to minimize chemical use and wastewater, offering a sustainable and cost-effective solution for battery recycling.",https://techxplore.com/news/2025-11-recycling-technology-purity-nickel-cobalt.html,nickel technology innovation sustainability,nickel,2025-11-15T05:14:57.700282
Advancing the US EV battery supply chain with new nickel carbonate agreement,EV Engineering Online,2025,"Aqua Metals and Westwin Elements announced a non-binding Letter of Intent to supply up to 1,000 metric tons annually of recycled high-purity nickel carbonate for EV battery cathodes. This collaboration aims to enhance domestic nickel production using advanced refining technologies, supporting a sustainable and secure US supply chain with product delivery targeted for 2027.",https://www.evengineeringonline.com/advancing-the-us-ev-battery-supply-chain-with-new-nickel-carbonate-agreement/,nickel technology innovation sustainability,copper,2025-11-15T05:14:57.700290
Cogne Acciai Speciali launches pilot phase of green hydrogen project,SteelOrbis,2025-11-14,"Cogne Acciai Speciali has started the pilot phase of its green hydrogen production project at its plant in Aosta, Italy. The project uses a 1.008 MW Anion Exchange Membrane electrolyzer to produce 165 tons of green hydrogen annually, aiming to reduce carbon emissions and power one of its 70 furnaces entirely. This initiative is supported by €7.9 million funding from Italy’s National Recovery and Resilience Plan.",https://www.steelorbis.com/steel-news/latest-news/cogne-acciai-speciali-launches-pilot-phase-of-green-hydrogen-project-1410354.htm,Cogne Acciai Speciali news aluminum steel italy,general,2025-11-15T05:15:14.908737
Italy's Cogne Acciai Speciali launches green hydrogen pilot plant,Yieh.com,2025-11-14,"Cogne Acciai Speciali has commenced operations at a green hydrogen pilot plant in Aosta, northern Italy, as part of its efforts to reduce fossil fuel use in steel production. This pilot plant is a key step in the company’s sustainability strategy to cut carbon emissions in its manufacturing processes.",https://yieh.com/en/News/italys-cogne-acciai-speciali-launches-green-hydrogen-pilot-plant/156769,Cogne Acciai Speciali news aluminum steel italy,steel,2025-11-15T05:15:14.908755
Cogne Acciai Speciali: 94% of the energy used comes from renewable sources and 93% of employees have permanent contracts,Cogne.com,2025-06-05,"On World Environment Day 2025, Cogne Acciai Speciali released its first Group Sustainability Report highlighting that over 94% of its electricity consumption comes from certified renewable sources. The company emphasizes sustainability as a core part of its corporate strategy and long-term value creation, reinforcing its leadership in the Italian steel industry.",https://www.cogne.com/en/post/press-release-23,Cogne Acciai Speciali news aluminum steel italy,steel,2025-11-15T05:15:14.908763
Cogne Acciai Speciali SpA Announces Its Commitment to Sustainability with ResponsibleSteel™ Certification,Cogne.com,2025-11-14,"Cogne Acciai Speciali has embarked on the ResponsibleSteel™ certification process for its Aosta site, formalizing its commitment to sustainable steel production. The certification reflects the company’s dedication to environmental responsibility, transparency, and social challenges in the steel industry, aiming to create lasting value for employees, customers, and communities.",https://www.cogne.com/en/post/press-release-25,Cogne Acciai Speciali news aluminum steel italy,steel,2025-11-15T05:15:14.908773
Cogne sees double-digit revenue and volumes decline in 2023,Stainless.Club,2025-07-06,"After a record performance in 2022, Cogne Acciai Speciali experienced a 15% decline in revenue in 2023, reporting EUR 822 million amid a more complex market environment. The company faced challenges leading to decreased volumes and revenues compared to the previous year.",https://www.stainless.club/industry-news/read/cogne-sees-double-digit-revenue-decline-in-2023.html,Cogne Acciai Speciali news aluminum steel italy,general,2025-11-15T05:15:14.908780
Tenaris remains profitable in 2025,Recycling Today,"November 14, 2025","Tenaris reported a $37 million profit in Q3 2025, a 15.6% increase from the previous quarter but a 22.9% decrease compared to Q3 2024. Sales in North American oil and gas tubular products remained steady despite some reductions in drilling activity, with margins affected by recent tariff increases on steel imports.",https://www.recyclingtoday.com/news/tenaris-steel-oil-gas-market-earnings-q3-2025/,Tenaris news steel italy,steel,2025-11-15T05:15:30.165900
Tenaris S.A. Reports Shareholder Update on Ownership Stake and Planned Share Sales,Quiver Quantitative,"November 14, 2025","Tenaris's controlling shareholders plan to sell some shares while maintaining at least a 67% ownership stake, in response to the company's ongoing share repurchase program. The timing and amount of sales will depend on market conditions, with no current plans to reduce ownership below 67%.",https://www.quiverquant.com/news/Tenaris+S.A.+Reports+Shareholder+Update+on+Ownership+Stake+and+Planned+Share+Sales,Tenaris news steel italy,general,2025-11-15T05:15:30.165918
Tenaris to Commence a USD 600 million Second Tranche of its USD 1.2 billion Share Buyback Program,Business Insider Markets,"November 3, 2025","Tenaris announced the start of the second tranche of its $1.2 billion share buyback program, amounting to $600 million. This tranche will run from November 3, 2025, to no later than April 30, 2026, with trading decisions made by the bank managing the program.",https://markets.businessinsider.com/news/stocks/tenaris-to-commence-a-usd-600-million-second-tranche-of-its-usd-1-2-billion-share-buyback-program-1035471986,Tenaris news steel italy,general,2025-11-15T05:15:30.165926
Tenaris Announces 2025 Third Quarter Results,OTC Markets,"November 14, 2025","Tenaris released its financial and operational results for the third quarter of 2025, highlighting steady sales and profitability despite market challenges. The report reflects the company's resilience in the steel and energy sectors amid tariff impacts and fluctuating drilling activity.",https://www.otcmarkets.com/stock/TS/news/Tenaris-Announces-2025-Third-Quarter-Results?e&id=3342563,Tenaris news steel italy,steel,2025-11-15T05:15:30.165932
"Tenaris S A : Weekly Report (November 10, 2025 - November 14, 2025)",MarketScreener,"November 14, 2025","As of November 14, 2025, Tenaris held 33,065,400 ordinary shares in treasury, representing 3.08% of its total issued share capital. This report provides an update on the company's shareholding and treasury stock status during the week.",https://www.marketscreener.com/news/tenaris-s-a-weekly-report-november-10-2025-a-november-14-2025-on-the-ce7d5fd2d18cf42d,Tenaris news steel italy,general,2025-11-15T05:15:30.165939
Copper Cables: Antitrust Launches Investigation into Alleged Cartel,First Online,Recent (within past 24 hours),"Italian antitrust authorities have launched an investigation into major low voltage copper cable manufacturers, including Prysmian and Nexans, for allegedly fixing prices since 2005. Inspections were conducted at the offices of companies including Bruno Baldassari & F.lli Spa, General Cavi Spa, Icel Scpa, and others. The investigation caused Prysmian's stock to drop 1.26% and Nexans to fall 1.9%, though analysts believe the impact will be negligible as the Italian low voltage cable market represents less than 3% of Prysmian's revenues.",https://www.firstonline.info/en/copper-cables-antitrust-launches-investigation-into-alleged-cartel-prysmian-and-nexans-stock-market-drops/,Prysmian news copper cables italy,copper,2025-11-15T05:15:38.300877
Italian Expertise Fuels Prysmian Innovation,Cable Technology News / Market Screener,"November 13, 2025","Prysmian announced innovation initiatives as part of its 'Accelerating Growth' strategy, aiming to achieve over 55% growth targets. The company has been appointed to the Green New Deal funded by MIMIT for 2025-2028 R&D activities in submarine energy cable development.",https://www.cabletechnologynews.co.uk/italian-expertise-fuels-prysmian-innovation/,Prysmian news copper cables italy,general,2025-11-15T05:15:38.300897
