title,source,date,summary,url,query,category,fetched_at
Nickel prices outlook remains bearish as UBS warns of persistent surplus,Investing.com,This week (late January 2026),"UBS forecasts a persistent global nickel surplus through 2026 despite production cuts, as Indonesia continues adding capacity amid weak stainless steel and battery demand recovery. Supply adjustments like 250,000 tonnes of cuts are insufficient to rebalance the market, with surpluses adding to LME inventories. Demand growth is projected at 4-5% annually from 2025-2028.",https://www.investing.com/news/commodities-news/nickel-prices-outlook-remains-bearish-as-ubs-warns-of-persistent-surplus-93CH-4141292,nickel prices and market trends,steel,2026-01-28T05:23:14.400791
"Can nickel prices hit $25,000 in 2026?",The Oregon Group,Early January 2026,"Nickel prices surged to $16,500–$18,500 per ton in early January 2026, the highest in over two years, as Indonesia delays permits and cuts output quotas to support prices. Much of the prior surplus was a 'paper' illusion, with only 55% of approved capacity utilized in 2025. Prices could test $20,000–$22,000/t or even $25,000/t under tightening conditions.",https://theoregongroup.substack.com/p/can-nickel-prices-hit-25000-in-2026,nickel prices and market trends,nickel,2026-01-28T05:23:14.400804
Canada Nickel Revolutionises Zero-Carbon Production Through Advanced Mineralisation Technology,Discovery Alert,"January 27, 2026",Canada Nickel has achieved a breakthrough in zero-carbon nickel production using advanced mineralisation technology. This innovation aims to revolutionize sustainable nickel processing for battery applications. The development supports cleaner energy supply chains amid growing demand for low-emission metals.,https://discoveryalert.com.au/canada-nickel-zero-carbon-production-2026/,nickel technology innovation sustainability,nickel,2026-01-28T05:23:23.912352
Arca and Giga Metals sign exclusive agreement to explore carbon removal at B.C. nickel project,Environment Journal,"January 27, 2026",Arca Climate Technologies and Giga Metals have signed an exclusive agreement to explore carbon removal integration at a British Columbia nickel project. This partnership focuses on enhancing sustainability through carbon sequestration in nickel mining operations. It represents a step toward net-zero emissions in critical mineral production.,https://environmentjournal.ca/arca-and-giga-metals-sign-exclusive-agreement-to-explore-carbon-removal-at-b-c-nickel-project/,nickel technology innovation sustainability,nickel,2026-01-28T05:23:23.912370
"Nickel and cobalt out, CO2 in at Turnagain",Metal Tech News,"January 21, 2026",A potential mine at the Turnagain project could sequester over 200 million tons of atmospheric CO2 while producing nickel and cobalt. This innovative approach replaces traditional tailings with carbon mineralization for permanent storage. It advances sustainable mining technology by turning waste into a climate solution.,https://www.metaltechnews.com/story/2026/01/21/tech-bytes/nickel-and-cobalt-out-co2-in-at-turnagain/2613.html,nickel technology innovation sustainability,nickel,2026-01-28T05:23:23.912378
