title,source,date,summary,url,query,category,fetched_at
Nickel price hits 4-year low as gloom offsets potential Indonesia cuts,Mining.com,2025-11-27,"Nickel prices dropped to a four-year low on the London Metal Exchange, driven by a lackluster outlook from the Federal Reserve and concerns over higher financing costs, despite Indonesia considering significant reductions in nickel mining quotas. The metal, crucial for electric-vehicle batteries, has been one of the worst performers among industrial metals this year.",https://www.mining.com/web/nickel-price-hits-4-year-low-as-gloom-offsets-potential-indonesia-cuts/,nickel prices and market trends,nickel,2025-11-27T05:16:13.464734
LME nickel prices rise to 2-week high,Yieh Corp Steel News,2025-11-27,"Despite recent losses and a market closure, LME nickel futures rebounded, closing at $15,285 per ton, up $185 from the previous session. The recovery comes amid ongoing volatility and oversupply concerns in the nickel market.",https://www.yieh.com/en/News/lme-nickel-prices-rise-to-2-week-high/156449,nickel prices and market trends,nickel,2025-11-27T05:16:13.464751
Nickel Price Update: Q3 2025 in Review,Nasdaq,2025-11-27,"Nickel prices remained volatile in the first half of 2025 but stabilized in Q3, with ongoing oversupply concerns continuing to weigh on the market. The article reviews recent trends and factors influencing nickel prices over the past quarter.",https://www.nasdaq.com/articles/nickel-price-update-q3-2025-review,nickel prices and market trends,nickel,2025-11-27T05:16:13.464758
Nickel Falls to 7-Month Low,Trading Economics,2025-11-26,"Nickel futures in the UK dropped to $14,550 per tonne in November, marking the lowest level since April and reflecting a significant underperformance compared to other base metals due to mounting oversupply. The over-expansion of Indonesia's nickel sector since the 2020 ore export ban has contributed to ample output and downward price pressure.",https://tradingeconomics.com/commodity/nickel,nickel production and capacity,nickel,2025-11-27T05:16:24.261544
FLASH: Indonesia restricts new nickel smelters to boost value-added production,Mysteel,2025-11-18,"The Indonesian government has issued a new regulation limiting the development of new nickel smelters, aiming to shift investments toward higher value-added products rather than semi-finished goods. The move is intended to support nickel prices and strengthen the domestic downstream processing chain.",https://www.mysteel.net/news/5103882-flash-indonesia-restricts-new-nickel-smelters-to-boost-value-added-production,nickel production and capacity,nickel,2025-11-27T05:16:24.261565
SPC Nickel highlights Muskox's geological potential,Mining.com.au,2025-11-26,"SPC Nickel has released assay results from its 2025 exploration program at the Muskox Project in Nunavut, Canada, revealing high-grade copper-nickel-platinum group mineralization and significant exploration potential. The results reinforce Muskox as a leading exploration opportunity with the potential for multiple deposits.",https://mining.com.au/spc-nickel-highlights-muskoxs-geological-potential/,nickel production and capacity,copper,2025-11-27T05:16:24.261574
6K Additive Secures Approval for $27.4 Million EXIM Loan to assist with Critical Minerals Expansion in Pennsylvania,Laotian Times,2025-11-26,"6K Additive has secured a $27.4 million EXIM loan to expand its powder capacity in Pennsylvania, including nickel powders for additive manufacturing. The expansion will increase production capacity and support growing demand for critical minerals in defense and advanced manufacturing sectors.",https://laotiantimes.com/2025/11/26/6k-additive-secures-approval-for-27-4-million-exim-loan-to-assist-with-critical-minerals-expansion-in-pennsylvania-with-the-department-of-war/,nickel production and capacity,nickel,2025-11-27T05:16:24.261584
Unleashing sustainable nickel production for a net zero future,Innovation News Network,"November 27, 2025","This article explores how optimizing nickel production, particularly through High Pressure Acid Leaching (HPAL), can create a more sustainable battery industry with a lower carbon footprint. It highlights efforts in pollution prevention, biodiversity conservation, waste management, and stakeholder engagement to advance sustainable nickel production aligned with global net-zero goals.",https://www.innovationnewsnetwork.com/unleashing-sustainable-nickel-production-for-a-net-zero-future/34671/,nickel technology innovation sustainability,nickel,2025-11-27T05:16:41.711785
"Genomines raises $45M to grow nickel from plants, not mines",AgTech Navigator,"November 27, 2025","French start-up Genomines secured $45 million in Series A funding to scale its innovative method of extracting nickel from plants instead of traditional mining. This approach promises faster, cheaper, and cleaner nickel production with higher purity and productivity, and the company is piloting projects with major automakers and battery manufacturers.",https://www.agtechnavigator.com/Article/2025/10/07/genomines-raises-45m-to-grow-nickel-from-plants-not-mines/,nickel technology innovation sustainability,nickel,2025-11-27T05:16:41.711802
SGS Pioneers Innovative Technologies in Critical Battery Metals in North America,SGS,June 2024 (latest update),"SGS is advancing sustainable extraction technologies for critical battery metals including nickel, collaborating with The Metals Company to produce nickel and cobalt sulfates from seafloor sources. These efforts aim to support a sustainable US battery supply chain with lower carbon intensity and faster production timelines.",https://www.sgs.com/en/news/2024/06/sgs-pioneers-innovative-technologies-in-critical-battery-metals-in-north-america,nickel technology innovation sustainability,nickel,2025-11-27T05:16:41.711811
"Nickel Industry News, Views and Commentary - Chronickels",Nickel Institute,"November 4, 2025","This article discusses innovations in nickel production including NOVONIX’s patented zero-waste cathode synthesis technology, which reduces costs and environmental impact. It also covers the role of nickel-containing alloys in sustainable energy transitions and the importance of responsible supply chain management for nickel's sustainability.",https://nickelinstitute.org/en/blog/,nickel technology innovation sustainability,copper,2025-11-27T05:16:41.711825
Benchmark opens public consultation on changes to its Sustainable Lithium and Sustainable Nickel grades,Benchmark Minerals,"November 11, 2025","Benchmark Minerals has initiated a public consultation to update its criteria for Sustainable Lithium and Sustainable Nickel grades, aiming to better reflect environmental and social governance factors in the evaluation of these critical battery metals.",https://source.benchmarkminerals.com/article/benchmark-opens-public-consultation-on-changes-to-its-sustainable-lithium-and-sustainable-nickel-grades,nickel technology innovation sustainability,nickel,2025-11-27T05:16:41.711833
Cogne Acciai Speciali finalises a 200 million euro share capital increase and the acquisition of Special Melted Products in UK,Cogne Official Blog,2025-11-26,"Cogne Acciai Speciali completed a 200 million euro share capital increase to support growth and acquisitions, including the acquisition of Special Melted Products in the UK. This move is part of the company's strategy to expand its footprint in the stainless steel sector.",https://www.cogne.com/en/blog,Cogne Acciai Speciali news aluminum steel italy,steel,2025-11-27T05:16:50.990751
Italy's Cogne Acciai Speciali launches green hydrogen pilot plant,Yieh.com,2025-11-26,"Cogne Acciai Speciali has started operations at a green hydrogen pilot plant in Aosta, northern Italy. This initiative aligns with the company's commitment to sustainability and reducing carbon emissions in steel production.",https://yieh.com/en/News/italys-cogne-acciai-speciali-launches-green-hydrogen-pilot-plant/156769,Cogne Acciai Speciali news aluminum steel italy,steel,2025-11-27T05:16:50.990766
EC approves Mannesmann Stainless Pipes' acquisition by Cogne,Stainless Club,2025-11-26,"The European Commission has approved Cogne Acciai Speciali's acquisition of Mannesmann Stainless Pipes, enabling Cogne to gain control over MST and its subsidiaries across Europe and the U.S. The deal, valued at EUR 135 million, strengthens Cogne's position in the stainless steel tube market.",https://www.stainless.club/industry-news/read/ec-approves-cognes-acquisition-of-mannesmann-stainless-pipes.html,Cogne Acciai Speciali news aluminum steel italy,steel,2025-11-27T05:16:50.990772
Tenaris Announces Second Tranche of USD 600 Million Share Buyback Program,QuiverQuant,"November 3, 2025","Tenaris has initiated the second tranche of its USD 1.2 billion share buyback program, purchasing up to USD 600 million in shares through a financial institution starting November 3, 2025. The buyback is part of a broader strategy authorized by shareholders and will result in the cancellation of repurchased shares.",https://www.quiverquant.com/news/Tenaris+Announces+Second+Tranche+of+USD+600+Million+Share+Buyback+Program,Tenaris news steel italy,general,2025-11-27T05:16:57.435203
Tenaris to Commence a USD 600 million Second Tranche of its USD 1.2 Billion Share Buyback Program,Business Insider Markets,"November 2, 2025","Tenaris announced the start of the second tranche of its USD 1.2 billion share buyback program, covering up to USD 600 million in shares. The program, authorized by shareholders, will be executed independently by a financial institution and is set to conclude by April 30, 2026.",https://markets.businessinsider.com/news/stocks/tenaris-to-commence-a-usd-600-million-second-tranche-of-its-usd-1-2-billion-share-buyback-program-1035471986,Tenaris news steel italy,general,2025-11-27T05:16:57.435219
Italian expertise fuels Prysmian innovation,Cable Technology News,2025-03-09,"Prysmian continues to invest heavily in R&D in Italy, with €216 million invested between 2021 and 2024 and plans for an additional €270 million by 2028. The Milan R&D hub is central to Prysmian’s global innovation strategy, focusing on energy transition and digital transformation, supported by Italian authorities and regional funding.",https://www.cabletechnologynews.co.uk/italian-expertise-fuels-prysmian-innovation/,Prysmian news copper cables italy,general,2025-11-27T05:17:06.040897
Prysmian Could Be a Relative Winner From Trump's Copper Tariff,Fastbull,2025-03-09,"Prysmian is seen as a potential beneficiary of President Trump’s proposed 50% copper tariff due to its vertically integrated copper operations in the U.S., including sourcing from a Freeport mine in Arizona and its own copper rod mill in Texas. Analysts suggest this gives Prysmian a competitive edge over smaller rivals.",https://m.fastbull.com/news-detail/prysmian-could-be-a-relative-winner-from-trumps-news_8600_0_2025_3_929_3/8600_NAT.GAS,Prysmian news copper cables italy,copper,2025-11-27T05:17:06.040917
Prysmian Raises Annual Targets After Record Q3 Performance,Energy News Pro,2025-03-09,"Prysmian has raised its full-year 2025 guidance following a record-breaking third quarter, reflecting strong demand for its cable solutions, including copper cables, and ongoing investments in capacity expansion and innovation in Italy and globally.",https://energynews.pro/en/prysmian-raises-annual-targets-after-record-q3-performance/,Prysmian news copper cables italy,copper,2025-11-27T05:17:06.040926
